"user_id","status_id","created_at","screen_name","text","favorite_count","retweet_count"
"x39387668","x1491220444564893701",2022-02-09 01:20:34,"coolbutuseless","@F_J_Heather Probably geomtextpath  https://t.co/YVT2HKvLDM

I've been meaning to dig into it to see how it was done.

#rstats",0,0
"x39387668","x1491149244761362436",2022-02-08 20:37:38,"coolbutuseless","Here's the core code for the starfield that gets called for each and every frame

I'm still battling with environment issues when ensuring variables are available inside loop

This is similar in idea to #processing - but using #RStats instead of a new DSL https://t.co/6i5RQZCVwW",5,2
"x39387668","x1491149911202885634",2022-02-08 20:40:17,"coolbutuseless","@tylermorganwall this is a read-from-file + display loop captured in realtime.   ~30fps maybe.

Caveat: only works on a real x11() device

#RStats https://t.co/xCutnFEPhm",3,2
"x39387668","x1491160087305535488",2022-02-08 21:20:43,"coolbutuseless","@tylermorganwall Here's an example of the fastest I can get #RStats rendering

It says it blits the raster to screen 100 times in 0.4 seconds  (250fps)

I'd be grateful if anyone on windows could try similar code! https://t.co/odkf39KXed",3,1
"x39387668","x1491148499194458112",2022-02-08 20:34:41,"coolbutuseless","Here's a tidied up version of a realtime animated starfield in #RStats

Interactive =&gt; stars re-spawn at current mouse location

FPS = how many times/sec the render func is being called

Some code to follow ... https://t.co/wnI8M31Iaw",17,4
"x39387668","x1490916185415852040",2022-02-08 05:11:33,"coolbutuseless","First up in the #RStats demoscene:

2000 point rotating starfield

Stars re-spawn from mouse position

Approx 45fps. https://t.co/lNFpeBjn9X",12,2
"x39387668","x1490915393548042241",2022-02-08 05:08:24,"coolbutuseless","Next up in #RStats demoscene:

* cracktros for new CRAN pkgs
* shadebobs
* starfields
* plasma
* copperbars
* sine scrollers
* greetz https://t.co/Jq4kNa66F3",4,2
"x392623479","x1491099663130316804",2022-02-08 17:20:37,"NadarSenpai","Update: February AT PENN | University of Pennsylvania Almanac - UPENN Almanac #Analytics #DataScience #AI #ML #RStats #Python #coding #DataAnalytics https://t.co/ztnLCroPnS",0,0
"x392623479","x1491219719839522817",2022-02-09 01:17:41,"NadarSenpai","Create a web application to optimize your supply chain inventory #Analytics #DataScience #AI #ML #RStats #Python #coding #DataAnalytics https://t.co/EXeSOoC84d",0,2
"x392623479","x1490971633879769096",2022-02-08 08:51:53,"NadarSenpai","Create a machine learning powered web app to answer questions #Analytics #DataScience #AI #ML #RStats #Python #coding #DataAnalytics https://t.co/O90AjxhWDy",0,2
"x392623479","x1490977572905426945",2022-02-08 09:15:29,"NadarSenpai","Stress Free Goal Setting with Deb Eckerling #Analytics #DataScience #AI #ML #RStats #Python #coding #DataAnalytics https://t.co/gic3lH9LUx",0,1
"x392623479","x1490968023766818816",2022-02-08 08:37:32,"NadarSenpai","Locate and count items with object detection #Analytics #DataScience #AI #ML #RStats #Python #coding #DataAnalytics https://t.co/7Mfxj9SNz9",0,0
"x392623479","x1491216446793396232",2022-02-09 01:04:41,"NadarSenpai","Predict an event with fairness, explainability, and robustness #Analytics #DataScience #AI #ML #RStats #Python #coding #DataAnalytics https://t.co/YASWeijftl",0,3
"x392623479","x1490877178350870531",2022-02-08 02:36:33,"NadarSenpai","No Description, Website, or Topics Provided #Analytics #DataScience #AI #ML #RStats #Python #coding #DataAnalytics https://t.co/UC4bCvys34",1,2
"x392623479","x1490988374404050948",2022-02-08 09:58:24,"NadarSenpai","In data science, uncertainty is one of the most challenging aspects - https://t.co/x76Qi0IgSp #Analytics #DataScience #AI #ML #RStats #Python #coding #DataAnalytics https://t.co/KoOZ9U60GG",0,1
"x392623479","x1491213173684424704",2022-02-09 00:51:40,"NadarSenpai","Analyze AI fraud prediction models #Analytics #DataScience #AI #ML #RStats #Python #coding #DataAnalytics https://t.co/B1GYPKIOe4",0,2
"x392623479","x1490991647626305536",2022-02-08 10:11:24,"NadarSenpai","A “Practical Data Science” Approach to Detecting Meteors with CAMS - SETI Institute #Analytics #DataScience #AI #ML #RStats #Python #coding #DataAnalytics https://t.co/bhyCrxHJf6",3,5
"x392623479","x1490977581705084931",2022-02-08 09:15:31,"NadarSenpai","Going Live to Grow Your Business – An Interview with Lindy Chapman #Analytics #DataScience #AI #ML #RStats #Python #coding #DataAnalytics https://t.co/mFzBMegIpR",0,0
"x392623479","x1490879948135018497",2022-02-08 02:47:33,"NadarSenpai","R Markdown: The Definitive Guide #Analytics #DataScience #AI #ML #RStats #Python #coding #DataAnalytics https://t.co/whUuZBkGvA",0,0
"x392623479","x1491148762164699142",2022-02-08 20:35:43,"NadarSenpai","How to build a data science and machine learning roadmap in 2022 - VentureBeat #Analytics #DataScience #AI #ML #RStats #Python #coding #DataAnalytics https://t.co/dDvdrLIq1W",2,3
"x392623479","x1491050564859441153",2022-02-08 14:05:31,"NadarSenpai","Deepnote raises $20M for its collaborative data science notebooks - TechCrunch #Analytics #DataScience #AI #ML #RStats #Python #coding #DataAnalytics https://t.co/PhZBoC4xkb",1,3
"x392623479","x1491181495746277381",2022-02-08 22:45:48,"NadarSenpai","Data Scientist (Marketing and Natural Language Processing) - IT-Online #Analytics #DataScience #AI #ML #RStats #Python #coding #DataAnalytics https://t.co/1DjCKPrgjd",0,3
"x392623479","x1491203354265063428",2022-02-09 00:12:39,"NadarSenpai","Create a conversational voicebot using WhatsApp and Watson services #Analytics #DataScience #AI #ML #RStats #Python #coding #DataAnalytics https://t.co/G1wHlaetmP",0,0
"x392623479","x1490977483843588100",2022-02-08 09:15:07,"NadarSenpai","Inverness street maps #Analytics #DataScience #AI #ML #RStats #Python #coding #DataAnalytics https://t.co/5132VeySQT",0,0
"x392623479","x1490868869296267265",2022-02-08 02:03:32,"NadarSenpai","The Best Way to Support LaTeX Math in Markdown with MathJax #Analytics #DataScience #AI #ML #RStats #Python #coding #DataAnalytics https://t.co/RCJljZPdNK",0,1
"x392623479","x1491125849105575938",2022-02-08 19:04:40,"NadarSenpai","Synthetic data for continuous testing and machine learning - InfoWorld #Analytics #DataScience #AI #ML #RStats #Python #coding #DataAnalytics https://t.co/W028CNcLT5",0,2
"x392623479","x1491142215581720582",2022-02-08 20:09:42,"NadarSenpai","Big Data trends the channel should know for 2022 - CRN Australia #Analytics #DataScience #AI #ML #RStats #Python #coding #DataAnalytics https://t.co/NzViFhhWHE",2,3
"x392623479","x1491200081076310016",2022-02-08 23:59:39,"NadarSenpai","Monitor Azure machine learning with Watson OpenScale #Analytics #DataScience #AI #ML #RStats #Python #coding #DataAnalytics https://t.co/4Bt3Xzn9Os",0,3
"x392623479","x1490981828127334400",2022-02-08 09:32:23,"NadarSenpai","Franklin College adds data science major - Daily Journal #Analytics #DataScience #AI #ML #RStats #Python #coding #DataAnalytics https://t.co/vOpfiN52ik",1,2
"x392623479","x1490977474318311425",2022-02-08 09:15:05,"NadarSenpai","Bifurcation diagram for nonautonomous SIR model #Analytics #DataScience #AI #ML #RStats #Python #coding #DataAnalytics https://t.co/5zJlS0Cerk",0,0
"x392623479","x1491209900516589569",2022-02-09 00:38:40,"NadarSenpai","Build an e-learning portal #Analytics #DataScience #AI #ML #RStats #Python #coding #DataAnalytics https://t.co/lAJU2oZEZw",0,0
"x392623479","x1491196807795388422",2022-02-08 23:46:38,"NadarSenpai","Monitor Sagemaker machine learning with Watson OpenScale #Analytics #DataScience #AI #ML #RStats #Python #coding #DataAnalytics https://t.co/ZNpsfL98pa",1,0
"x392623479","x1490978554942742539",2022-02-08 09:19:23,"NadarSenpai","SMU Graduate Julian LaNeve Wins $100k Grand Prize from Data Science Competition – SMU Daily Campus - The Daily Campus #Analytics #DataScience #AI #ML #RStats #Python #coding #DataAnalytics https://t.co/XjJKIFRZfD",1,2
"x392623479","x1491076750629081092",2022-02-08 15:49:34,"NadarSenpai","Data Science Careers Q&amp;A With Adobe | Data and Lifelong Learning - Datamation #Analytics #DataScience #AI #ML #RStats #Python #coding #DataAnalytics https://t.co/XO2kTZ3MPH",1,2
"x392623479","x1490860559872540672",2022-02-08 01:30:30,"NadarSenpai","Quietly Struggling (with Software) #Analytics #DataScience #AI #ML #RStats #Python #coding #DataAnalytics https://t.co/FyT3hWSEBS",1,5
"x392623479","x1490977624528920582",2022-02-08 09:15:41,"NadarSenpai","Deploy your ML model as a Web Service in Microsoft Azure Cloud #Analytics #DataScience #AI #ML #RStats #Python #coding #DataAnalytics https://t.co/Wp7mUs4MLI",0,0
"x392623479","x1491193534598291458",2022-02-08 23:33:38,"NadarSenpai","Capture clickstream data from your ecommerce website #Analytics #DataScience #AI #ML #RStats #Python #coding #DataAnalytics https://t.co/j0AdRae8Dj",1,2
"x392623479","x1491089843358732296",2022-02-08 16:41:36,"NadarSenpai","Columbia Mailman Offers Early Career Training in Data Science and Omics | Columbia Public Health - Columbia University's Mailman School of Public Health #Analytics #DataScience #AI #ML #RStats #Python #coding #DataAnalytics https://t.co/FQQ9T9P4Ix",2,3
"x392623479","x1491037472410722317",2022-02-08 13:13:30,"NadarSenpai","Data Science for IoT: How Does It Work? - IoT For All #Analytics #DataScience #AI #ML #RStats #Python #coding #DataAnalytics https://t.co/BDDQKqXkx6",1,3
"x392623479","x1490977617725779971",2022-02-08 09:15:39,"NadarSenpai","R Programming Concepts Made Easy! #Analytics #DataScience #AI #ML #RStats #Python #coding #DataAnalytics https://t.co/mf4W4ZAEfX",0,0
"x392623479","x1490977616119349248",2022-02-08 09:15:39,"NadarSenpai","Loan Approval Prediction Machine Learning #Analytics #DataScience #AI #ML #RStats #Python #coding #DataAnalytics https://t.co/EFKYkfv10L",0,1
"x392623479","x1490977613883781126",2022-02-08 09:15:38,"NadarSenpai","Supreme Court Judgement Prediction #Analytics #DataScience #AI #ML #RStats #Python #coding #DataAnalytics https://t.co/DxUsFcmdDX",0,0
"x392623479","x1491190261396955136",2022-02-08 23:20:37,"NadarSenpai","Enhance customer helpdesks with Smart Document Understanding using the Watson Assistant search skill #Analytics #DataScience #AI #ML #RStats #Python #coding #DataAnalytics https://t.co/KXf82GKx64",0,1
"x392623479","x1490977609781751808",2022-02-08 09:15:37,"NadarSenpai","Understanding Subqueries in SQL #Analytics #DataScience #AI #ML #RStats #Python #coding #DataAnalytics https://t.co/Y2iXgIHybC",0,0
"x392623479","x1491116029518696448",2022-02-08 18:25:39,"NadarSenpai","Kukun Expands Leadership to Include Economic and Data Science Experts - Business Wire #Analytics #DataScience #AI #ML #RStats #Python #coding #DataAnalytics https://t.co/GlXRRIVvWs",1,5
"x392623479","x1491086570170068993",2022-02-08 16:28:36,"NadarSenpai","College of Arts &amp; Sciences receives grant to initiate instructional programs in Big Data Analytics and Artificial Intelligence - Tuskegee University #Analytics #DataScience #AI #ML #RStats #Python #coding #DataAnalytics https://t.co/5GwmcRG4rw",0,1
"x392623479","x1491186988174790660",2022-02-08 23:07:37,"NadarSenpai","Improve Watson Discovery results using API-based relevancy training #Analytics #DataScience #AI #ML #RStats #Python #coding #DataAnalytics https://t.co/zfxHRcOepo",0,2
"x392623479","x1490977576239898624",2022-02-08 09:15:29,"NadarSenpai","Data Science 101 Blog gets a New Home #Analytics #DataScience #AI #ML #RStats #Python #coding #DataAnalytics https://t.co/Ot4nasTlPQ",1,0
"x392623479","x1491152035722506242",2022-02-08 20:48:44,"NadarSenpai","Making sense of the metaverse through data science - TechNative - TechNative #Analytics #DataScience #AI #ML #RStats #Python #coding #DataAnalytics https://t.co/TQlUk6cwPo",2,2
"x392623479","x1490977433633566722",2022-02-08 09:14:55,"NadarSenpai","Matplotlib secondary y-axis [Complete Guide] #Analytics #DataScience #AI #ML #RStats #Python #coding #DataAnalytics https://t.co/Pu8OEsJBcU",0,0
"x392623479","x1491083296977080320",2022-02-08 16:15:35,"NadarSenpai","Office of Data Science - National Institute of Environmental Health Sciences #Analytics #DataScience #AI #ML #RStats #Python #coding #DataAnalytics https://t.co/t7OtHakO81",2,7
"x392623479","x1491183712586940417",2022-02-08 22:54:36,"NadarSenpai","Defining Python Functions With Optional Arguments #Analytics #DataScience #AI #ML #RStats #Python #coding #DataAnalytics https://t.co/cUOcH95Efz",0,3
"x392623479","x1491030925936840712",2022-02-08 12:47:29,"NadarSenpai","HU gets $5 million grant for new data science center aimed at racial equity - Afro American #Analytics #DataScience #AI #ML #RStats #Python #coding #DataAnalytics https://t.co/01Kxw3lmkf",0,1
"x392623479","x1490977515447668739",2022-02-08 09:15:15,"NadarSenpai","Visualize and analyze differential expression data in a network #Analytics #DataScience #AI #ML #RStats #Python #coding #DataAnalytics https://t.co/RLUWQGgP6v",0,0
"x392623479","x1490977513765433346",2022-02-08 09:15:14,"NadarSenpai","Outputting Beautiful Jupyter Notebooks (R-Kernel Edition) #Analytics #DataScience #AI #ML #RStats #Python #coding #DataAnalytics https://t.co/7Zo5WJbbVj",0,0
"x392623479","x1491132395730485258",2022-02-08 19:30:41,"NadarSenpai","Forecasting changes to the workforce through data science - https://t.co/hF6ZMCcrUV #Analytics #DataScience #AI #ML #RStats #Python #coding #DataAnalytics https://t.co/dklGS6aNQp",0,4
"x392623479","x1491027652748185602",2022-02-08 12:34:29,"NadarSenpai","Top statistics books for data scientists - Analytics India Magazine #Analytics #DataScience #AI #ML #RStats #Python #coding #DataAnalytics https://t.co/CLfxzMKTYm",0,0
"x392623479","x1490977508887793665",2022-02-08 09:15:13,"NadarSenpai","Communities and cliques #Analytics #DataScience #AI #ML #RStats #Python #coding #DataAnalytics https://t.co/uycC2jMaLm",0,0
"x392623479","x1490977507281043456",2022-02-08 09:15:13,"NadarSenpai","Making Heat Maps In R #Analytics #DataScience #AI #ML #RStats #Python #coding #DataAnalytics https://t.co/EDWlIrMYiY",0,0
"x392623479","x1490977505658155008",2022-02-08 09:15:13,"NadarSenpai","Visualizing the similarity of two networks #Analytics #DataScience #AI #ML #RStats #Python #coding #DataAnalytics https://t.co/2rC4CVeoVk",0,0
"x392623479","x1490977503984304133",2022-02-08 09:15:12,"NadarSenpai","A Step-By-Step Guide to Generating Gene Interaction Networks with GeneMANIA #Analytics #DataScience #AI #ML #RStats #Python #coding #DataAnalytics https://t.co/Q5jzXEwRMz",0,0
"x392623479","x1490977364817620996",2022-02-08 09:14:39,"NadarSenpai","Archived | Build an image classifier to help search for extraterrestrial life #Analytics #DataScience #AI #ML #RStats #Python #coding #DataAnalytics https://t.co/7u0lFYDmbj",0,1
"x392623479","x1490977485411926017",2022-02-08 09:15:08,"NadarSenpai","Build and Share Jupyter Notebooks on RStudio Team #Analytics #DataScience #AI #ML #RStats #Python #coding #DataAnalytics https://t.co/v3LUJqQ1NG",0,0
"x392623479","x1490977361394737158",2022-02-08 09:14:38,"NadarSenpai","Create a web app to visually interact with objects detected using machine learning #Analytics #DataScience #AI #ML #RStats #Python #coding #DataAnalytics https://t.co/WP4dG4dcR7",0,2
"x392623479","x1490977482279104514",2022-02-08 09:15:07,"NadarSenpai","Projet Optimisation multicritères du portefeuille (French) #Analytics #DataScience #AI #ML #RStats #Python #coding #DataAnalytics https://t.co/wOMdpAcujJ",0,0
"x392623479","x1490977358106755078",2022-02-08 09:14:37,"NadarSenpai","Use your arms to make music #Analytics #DataScience #AI #ML #RStats #Python #coding #DataAnalytics https://t.co/JOKM7Tr44L",0,1
"x392623479","x1491178222490296322",2022-02-08 22:32:47,"NadarSenpai","Mastering the Art of Cloud Tagging Using Data Science - DARKReading #Analytics #DataScience #AI #ML #RStats #Python #coding #DataAnalytics https://t.co/ZcFtKo4H5w",1,3
"x392623479","x1490977477610860545",2022-02-08 09:15:06,"NadarSenpai","EMLAR 2022 tutorial on Bayesian methods #Analytics #DataScience #AI #ML #RStats #Python #coding #DataAnalytics https://t.co/3zLT4kYvOQ",0,0
"x392623479","x1491024379458719745",2022-02-08 12:21:28,"NadarSenpai","Common Probability Distributions: Road Towards Data Science - MarkTechPost #Analytics #DataScience #AI #ML #RStats #Python #coding #DataAnalytics https://t.co/oPLoGf6JX4",1,1
"x392623479","x1490977351219707907",2022-02-08 09:14:36,"NadarSenpai","Build a web app that recognizes yoga poses using a model from the Model Asset eXchange hosted on the Machine Learning eXchange #Analytics #DataScience #AI #ML #RStats #Python #coding #DataAnalytics https://t.co/ettkryVk8i",1,1
"x392623479","x1491138942418440192",2022-02-08 19:56:42,"NadarSenpai","Since Data Scientists Don't Do Business Decisions — Businesses Need Decision Scientists - Forbes #Analytics #DataScience #AI #ML #RStats #Python #coding #DataAnalytics https://t.co/Ik81tusHrW",0,2
"x392623479","x1490977471084523520",2022-02-08 09:15:04,"NadarSenpai","Gyrotriangle (aka hyperbolic triangle) with moving colors #Analytics #DataScience #AI #ML #RStats #Python #coding #DataAnalytics https://t.co/b0LAwFsqSY",0,0
"x392623479","x1490977469499068417",2022-02-08 09:15:04,"NadarSenpai","Decision tree regression and Classification #Analytics #DataScience #AI #ML #RStats #Python #coding #DataAnalytics https://t.co/72DcMxFRLf",0,0
"x392623479","x1490977344525565952",2022-02-08 09:14:34,"NadarSenpai","Object tracking in video with OpenCV and Deep Learning #Analytics #DataScience #AI #ML #RStats #Python #coding #DataAnalytics https://t.co/EnzjBmY50B",0,0
"x392623479","x1491119302719778816",2022-02-08 18:38:40,"NadarSenpai","All You Need To Know About Enterprise Data Science - Analytics Insight #Analytics #DataScience #AI #ML #RStats #Python #coding #DataAnalytics https://t.co/1RL7sJa1qz",1,2
"x392623479","x1491021106060353536",2022-02-08 12:08:28,"NadarSenpai","Best Online Master's in Data Science Programs in 2022 - Fortune #Analytics #DataScience #AI #ML #RStats #Python #coding #DataAnalytics https://t.co/W8xDtdtzGn",1,2
"x392623479","x1490977462033203200",2022-02-08 09:15:02,"NadarSenpai","GooglyPlusPlus2022 optimizes batting/bowling lineup #Analytics #DataScience #AI #ML #RStats #Python #coding #DataAnalytics https://t.co/0OXLeByNRg",0,0
"x392623479","x1490977460460015616",2022-02-08 09:15:02,"NadarSenpai","Carter-Kohn algorithm for State Space Models in R : Univariate Case #Analytics #DataScience #AI #ML #RStats #Python #coding #DataAnalytics https://t.co/63OaXGS1Is",0,0
"x392623479","x1491171675945291776",2022-02-08 22:06:46,"NadarSenpai","Now data science students can get a 3-year visa extension in the US - Analytics India Magazine #Analytics #DataScience #AI #ML #RStats #Python #coding #DataAnalytics https://t.co/2YxNnIZ7qh",0,2
"x392623479","x1490977457293660164",2022-02-08 09:15:01,"NadarSenpai","Nonparametric Value-at-Risk (VaR) #Analytics #DataScience #AI #ML #RStats #Python #coding #DataAnalytics https://t.co/7KaUjNb0im",0,0
"x392623479","x1490977455590371329",2022-02-08 09:15:01,"NadarSenpai","Statistical Hypothesis Testing-A Step by Step Guide #Analytics #DataScience #AI #ML #RStats #Python #coding #DataAnalytics https://t.co/mz65JZAKs1",1,0
"x392623479","x1490977453736882177",2022-02-08 09:15:00,"NadarSenpai","Tabnet for R #Analytics #DataScience #AI #ML #RStats #Python #coding #DataAnalytics https://t.co/TLX80h8oIj",0,0
"x392623479","x1491014559674638338",2022-02-08 11:42:27,"NadarSenpai","Data Science for More Effective Farm Inputs - AG INFORMATION NETWORK OF THE WEST - AGInfo Ag Information Network Of The West #Analytics #DataScience #AI #ML #RStats #Python #coding #DataAnalytics https://t.co/4EcN4IM5lp",1,1
"x392623479","x1491073477394194442",2022-02-08 15:36:34,"NadarSenpai","Council Post: Generalists—The building blocks of a data science organisation - Analytics India Magazine #Analytics #DataScience #AI #ML #RStats #Python #coding #DataAnalytics https://t.co/goGNT8aPhB",1,2
"x392623479","x1490882717797527553",2022-02-08 02:58:33,"NadarSenpai","The User-Developer Spectrum in the R Ecosystem #Analytics #DataScience #AI #ML #RStats #Python #coding #DataAnalytics https://t.co/xf7WTwzyC8",0,0
"x392623479","x1490977447294423040",2022-02-08 09:14:59,"NadarSenpai","Linear Discriminant Analysis: A step by step Guide #Analytics #DataScience #AI #ML #RStats #Python #coding #DataAnalytics https://t.co/srBZarsi0w",0,0
"x392623479","x1490977445591146501",2022-02-08 09:14:58,"NadarSenpai","Simulating survival outcomes: setting the parameters for the desired distribution #Analytics #DataScience #AI #ML #RStats #Python #coding #DataAnalytics https://t.co/h0kz7bWLJT",0,1
"x392623479","x1491008013351673857",2022-02-08 11:16:26,"NadarSenpai","Data Scientist Soft Skills: How to Develop Business Acumen | by Vicky Yu | Feb, 2022 - DataDrivenInvestor #Analytics #DataScience #AI #ML #RStats #Python #coding #DataAnalytics https://t.co/vw1WavDW4U",3,4
"x392623479","x1490977574498885633",2022-02-08 09:15:29,"NadarSenpai","Ryan Swanstrom a Guest on #PirateBroadcast #Analytics #DataScience #AI #ML #RStats #Python #coding #DataAnalytics https://t.co/2BuQIHjr3t",0,0
"x392623479","x1491096389807489028",2022-02-08 17:07:37,"NadarSenpai","Aurora Solar Technologies Provides an Update on Its Insight(TM) Data Science Product and Associated Strategic Initiatives - Yahoo Finance #Analytics #DataScience #AI #ML #RStats #Python #coding #DataAnalytics https://t.co/m38xNcoAA7",2,3
"x392623479","x1491004740200718346",2022-02-08 11:03:26,"NadarSenpai","Texas A&amp;M Energy Institute and the Texas A&amp;M Institute of Data Science to Team on Data Science for Energy Sector - insideHPC - insideHPC #Analytics #DataScience #AI #ML #RStats #Python #coding #DataAnalytics https://t.co/QcqM4hFN7d",2,3
"x392623479","x1490977571290292233",2022-02-08 09:15:28,"NadarSenpai","Starting a Data Career #Analytics #DataScience #AI #ML #RStats #Python #coding #DataAnalytics https://t.co/CUknEtYubm",0,0
"x392623479","x1490977428793327618",2022-02-08 09:14:54,"NadarSenpai","Matplotlib legend font size #Analytics #DataScience #AI #ML #RStats #Python #coding #DataAnalytics https://t.co/jcYGuqhVxG",0,0
"x392623479","x1491066930995896326",2022-02-08 15:10:33,"NadarSenpai","Faculty Spotlight: After 12 Years at Google, Eric Tassone Joins School of Data Science - UVA Today #Analytics #DataScience #AI #ML #RStats #Python #coding #DataAnalytics https://t.co/gnqqU6amJv",1,1
"x392623479","x1490977425584697347",2022-02-08 09:14:53,"NadarSenpai","How to Generate Payslip using Python Tkinter + Video Tutorial #Analytics #DataScience #AI #ML #RStats #Python #coding #DataAnalytics https://t.co/1sb9aLkWyD",0,0
"x392623479","x1490977424045383680",2022-02-08 09:14:53,"NadarSenpai","Scikit learn Split Data #Analytics #DataScience #AI #ML #RStats #Python #coding #DataAnalytics https://t.co/o1MvZqob27",0,0
"x392623479","x1491112756111499269",2022-02-08 18:12:39,"NadarSenpai","USD 68.02 billion growth for Data Science Platform Market from 2021 to 2026 | Evolving Opportunities with Alphabet Inc. &amp;Altair Engineering Inc.| 17000+ Technavio Reports - PRNewswire #Analytics #DataScience #AI #ML #RStats #Python #coding #DataAnalytics https://t.co/WAB7UOB9b4",2,5
"x392623479","x1491001467045568519",2022-02-08 10:50:25,"NadarSenpai","How the convenience industry is harnessing data science - Retail Customer Experience #Analytics #DataScience #AI #ML #RStats #Python #coding #DataAnalytics https://t.co/r9yd61E0PL",3,2
"x392623479","x1491165129253306369",2022-02-08 21:40:45,"NadarSenpai","Simmons College receives funding for data science programs from major national bank - Louisville Business First - Louisville Business First #Analytics #DataScience #AI #ML #RStats #Python #coding #DataAnalytics https://t.co/2UVxet7cWg",2,2
"x392623479","x1491063657740091393",2022-02-08 14:57:33,"NadarSenpai","How to get a data job at a ""kind"" but generous hedge fund - eFinancialCareers #Analytics #DataScience #AI #ML #RStats #Python #coding #DataAnalytics https://t.co/rrDFWBlUuO",1,1
"x392623479","x1490977366533107714",2022-02-08 09:14:39,"NadarSenpai","Develop, train, and deploy a spam filter model on Hortonworks Data Platform using Watson Studio Local #Analytics #DataScience #AI #ML #RStats #Python #coding #DataAnalytics https://t.co/1xvZwBONtJ",0,0
"x392623479","x1491206627348860937",2022-02-09 00:25:39,"NadarSenpai","Authenticate chatbot users with SMS one-time passcode #Analytics #DataScience #AI #ML #RStats #Python #coding #DataAnalytics https://t.co/mGkkMpCoto",0,0
"x392623479","x1490977363139919875",2022-02-08 09:14:39,"NadarSenpai","Deploy and use a multi-framework deep learning platform on Kubernetes #Analytics #DataScience #AI #ML #RStats #Python #coding #DataAnalytics https://t.co/yVEm9XypBU",0,1
"x392623479","x1491145488963612672",2022-02-08 20:22:43,"NadarSenpai","Spatial Biology Technologies in the Lab of the Future - Technology Networks #Analytics #DataScience #AI #ML #RStats #Python #coding #DataAnalytics https://t.co/y9BHtwFQnv",0,2
"x392623479","x1491161856014270472",2022-02-08 21:27:45,"NadarSenpai","UB-educated data scientist urges more women to work in AI - UB Now: News and views for UB faculty and staff - University at Buffalo Reporter #Analytics #DataScience #AI #ML #RStats #Python #coding #DataAnalytics https://t.co/QVOLa5vZH5",0,0
"x392623479","x1491109482818150400",2022-02-08 17:59:38,"NadarSenpai","UC Public Safety Research Center opens in School of Criminal Justice | University Of Cincinnati - University of Cincinnati #Analytics #DataScience #AI #ML #RStats #Python #coding #DataAnalytics https://t.co/BVNkaZZal7",0,1
"x392623479","x1490977354646102030",2022-02-08 09:14:37,"NadarSenpai","Assemble a pizza-ordering chatbot dialog #Analytics #DataScience #AI #ML #RStats #Python #coding #DataAnalytics https://t.co/T7EFvtP3QG",0,2
