"user_id","status_id","created_at","screen_name","text","favorite_count","retweet_count"
"x492415178","x1506445957327888390",2022-03-23 01:41:19,"BHarrap","Ok #statstwitter my analysis code started out small but has blown out to be fairly lengthy (~1800 lines so far). Is it worthwhile chopping it up into separate files at this stage, or just learn from this pain and do it next time?

#RStats",1,3
"x4263007693","x1506445427624792069",2022-03-23 01:39:13,"gp_pulipaka","HuggingfaceğŸ¤— Transformers for #NLProc. #BigData #Analytics #DataScience #AI #MachineLearning #IoT #IIoT #PyTorch #Python #RStats #TensorFlow #Java #JavaScript #ReactJS #CloudComputing #Serverless #DataScientist #Linux #Programming #Coding #100DaysofCode  
https://t.co/Eo25WN0pbM https://t.co/t998JC3Q9t",8,12
"x4263007693","x1506274263044608005",2022-03-22 14:19:04,"gp_pulipaka","#PyTorch Geometric vs. Deep Graph Library. #BigData #Analytics #DataScience #AI #MachineLearning #IoT #IIoT #Python #RStats #TensorFlow #Java #JavaScript #ReactJS #GoLang #CloudComputing #Serverless #DataScientist #Linux #Programming #Coding #100DaysofCode
https://t.co/6FgomnV6uc https://t.co/nmK7C1tMw4",13,19
"x4263007693","x1506444131056472065",2022-03-23 01:34:03,"gp_pulipaka","7 Deep Learning Books to Read in 2022. #BigData #Analytics #DataScience #IoT #IIoT #PyTorch #Python #RStats #TensorFlow #Java #JavaScript #ReactJS #GoLang #CloudComputing #Serverless #DataScientist #Linux #Books #Programming #Coding #100DaysofCode 
https://t.co/VlEwMhmv7y https://t.co/qXUjwLfd3D",19,17
"x4263007693","x1506442115320012806",2022-03-23 01:26:03,"gp_pulipaka","Linux Cheat-Sheet. #BigData #Analytics #DataScience #AI #MachineLearning #CyberSecurity #IoT #IIoT #PyTorch #Python #RStats #TensorFlow #Java #JavaScript #ReactJS #CloudComputing #Serverless #DataScientist #Linux #Programming #Coding #100DaysofCode 
https://t.co/Ydz2459WCa https://t.co/9bOiNXnAye",24,18
"x4263007693","x1506438094320508930",2022-03-23 01:10:04,"gp_pulipaka","A Comprehensive Guide on #MLOps for #MachineLearning Engineering. #BigData #Analytics #DataScience #AI #IoT #IIoT #Python #RStats #TensorFlow #Java #JavaScript #ReactJS #CloudComputing #Serverless #DataScientist #Linux #Programming #Coding #100DaysofCode  
https://t.co/LmVOaIcE2L https://t.co/rWkAy7OLC3",8,22
"x4263007693","x1506278034684489732",2022-03-22 14:34:03,"gp_pulipaka","The Journey: Deep Learning As a Medical Student. #BigData #Analytics #DataScience #IoT #IIoT #PyTorch #Python #RStats #TensorFlow #Java #JavaScript #ReactJS #CloudComputing #Serverless #DataScientist #Linux #Books #Programming #Coding #100DaysofCode 
https://t.co/yyjwceYCnJ https://t.co/E6nMom33Ew",8,13
"x4263007693","x1506073300870574089",2022-03-22 01:00:31,"gp_pulipaka","Deploying AI With an Event-Driven Platform. #BigData #Analytics #DataScience #AI #MachineLearning #IoT #IIoT #Python #RStats #TensorFlow #JavaScript #ReactJS #GoLang #CloudComputing #Serverless #DataScientist #Linux #Programming #Coding #100DaysofCode  
https://t.co/zYNVdlCeby https://t.co/VLu4lcjXpJ",23,28
"x4263007693","x1506304462171869192",2022-03-22 16:19:04,"gp_pulipaka","#PyTorch: How to Develop Deep Learning Models with #Python. #BigData #Analytics #DataScience #AI #MachineLearning #IoT #IIoT #RStats #TensorFlow #JavaScript #ReactJS #CloudComputing #Serverless #DataScientist #Linux #Programming #Coding #100DaysofCode  
https://t.co/4yAr9ZOLN8 https://t.co/a7mkM8grHR",53,29
"x4263007693","x1506075698066243588",2022-03-22 01:10:02,"gp_pulipaka","Free eBook: Data Structures &amp; #Algorithms With #Python. #BigData #Analytics #DataScience #IoT #IIoT #Python #RStats #TensorFlow #Java #JavaScript #ReactJS #GoLang #CloudComputing #Serverless #DataScientist #Linux #Books #Programming #Coding #100DaysofCode 
https://t.co/zOUznvT3LR https://t.co/BkKyTpxVak",218,94
"x4263007693","x1506062865538682885",2022-03-22 00:19:03,"gp_pulipaka","Has Deep Learning Hit Its Limit Now? #BigData #Analytics #DataScience #AI #MachineLearning #IoT #IIoT #PyTorch #Python #RStats #TensorFlow #Java #JavaScript #ReactJS #CloudComputing #Serverless #DataScientist #Linux #Programming #Coding #100DaysofCode 
https://t.co/M6nHbnN2SY https://t.co/X0N6E1QJC6",8,18
"x4263007693","x1506269711348244484",2022-03-22 14:00:58,"gp_pulipaka","A Comprehensive Guide on #RecSys Engines. #BigData #Analytics #DataScience #AI #MachineLearning #IoT #IIoT #Python #RStats #TensorFlow #Java #JavaScript #ReactJS #CloudComputing #Serverless #DataScientist #Linux #Programming #Coding #100DaysofCode  
https://t.co/scyWz2WsMK https://t.co/WAENgvCugl",28,32
"x4263007693","x1506368631713718277",2022-03-22 20:34:03,"gp_pulipaka","Book Review: The Age of AI. #BigData #Analytics #DataScience #AI #MachineLearning #IoT #IIoT #PyTorch #Python #RStats #TensorFlow #Java #JavaScript #ReactJS #GoLang #CloudComputing #Serverless #DataScientist #Linux #Programming #Coding #100DaysofCode  
https://t.co/RUGEbdTkqw https://t.co/roz5rf4lOT",7,10
"x4263007693","x1506435584390311943",2022-03-23 01:00:06,"gp_pulipaka","Basics of #ComputerVision! #BigData #Analytics #DataScience #AI #MachineLearning #IoT #IIoT #PyTorch #Python #RStats #TensorFlow #Java #JavaScript #ReactJS #GoLang #CloudComputing #Serverless #DataScientist #Linux #Programming #Coding #100DaysofCode  
https://t.co/S1NbRsoDvl https://t.co/q4DeMyUyOJ",15,20
"x4263007693","x1506061866518335495",2022-03-22 00:15:04,"gp_pulipaka","The AI Hierarchy of Needs. @mrogati #BigData #Analytics #DataScience #AI #MachineLearning #IoT #IIoT #PyTorch #Python #RStats #TensorFlow #Java #JavaScript #ReactJS #CloudComputing #Serverless #DataScientist #Linux #Programming #Coding #100DaysofCode  
https://t.co/BPuDI0eUrH https://t.co/SESgiWHp7I",26,36
"x4263007693","x1506425276485488643",2022-03-23 00:19:08,"gp_pulipaka","Best Machine Learning Books To Learn The Concepts! #BigData #Analytics #DataScience #IoT #IIoT #PyTorch #Python #RStats #TensorFlow #Java #JavaScript #ReactJS #CloudComputing #Serverless #DataScientist #Linux #Books #Programming #Coding #100DaysofCode 
https://t.co/gOFC1S3xYl https://t.co/swMKTD2kvM",19,27
"x4263007693","x1506278039390466056",2022-03-22 14:34:04,"gp_pulipaka","NeuralForecast - New #Python Library. #BigData #Analytics #DataScience #AI #MachineLearning #IoT #IIoT #Python #RStats #TensorFlow #Java #JavaScript #ReactJS #GoLang #CloudComputing #Serverless #DataScientist #Linux #Programming #Coding #100DaysofCode  
https://t.co/IVt2xIzmPV https://t.co/kUMdLmUlcS",10,21
"x4263007693","x1506381719397711881",2022-03-22 21:26:03,"gp_pulipaka","Modern Convolutional Neural Networks. #BigData #Analytics #DataScience #AI #MachineLearning #IoT #IIoT #Python #RStats #TensorFlow #Java #JavaScript #ReactJS #GoLang #CloudComputing #Serverless #DataScientist #Linux #Programming #Coding #100DaysofCode  
https://t.co/xha9ZoQAmj https://t.co/Yj0EJHoQHI",20,24
"x4263007693","x1506433811978113024",2022-03-23 00:53:03,"gp_pulipaka","AI Best: Single Point Precision Floating Point. #BigData #Analytics #DataScience #AI #MachineLearning #IoT #IIoT #Python #RStats #TensorFlow #Java #JavaScript #ReactJS #CloudComputing #Serverless #DataScientist #Linux #Programming #Coding #100DaysofCode  
https://t.co/c3OFPyiYpG https://t.co/nLjurWnlOy",12,17
"x4263007693","x1506302207985172485",2022-03-22 16:10:06,"gp_pulipaka","Graph Neural Networks for Novices. #BigData #Analytics #DataScience #AI #MachineLearning #IoT #IIoT #PyTorch #RStats #TensorFlow #Java #JavaScript #ReactJS #CloudComputing #Serverless #DataScientist #Linux #Programming #Coding #100DaysofCode  
https://t.co/G8VmW5glPe https://t.co/xZFykUo59c",6,16
"x4263007693","x1506276022198673412",2022-03-22 14:26:03,"gp_pulipaka","Free eBook: The Python Workbook. #BigData #Analytics #DataScience #AI #MachineLearning #IoT #IIoT #Python #RStats #TensorFlow #Java #JavaScript #ReactJS #GoLang #CloudComputing #Serverless #DataScientist #Linux #Books #Programming #Coding #100DaysofCode 
https://t.co/Kosu4Mh2pC https://t.co/ntyczTT6qH",83,58
"x4263007693","x1506060601579159557",2022-03-22 00:10:03,"gp_pulipaka","800 Free #ComputerScience Classes You Can Take Right Now. #BigData #Analytics #DataScience #AI #MachineLearning #IoT #IIoT #Python #RStats #TensorFlow #JavaScript #ReactJS #Serverless #DataScientist #Linux #Programming #Coding #100DaysofCode 
https://t.co/96997SoKJW https://t.co/70En63vPZT",134,83
"x4263007693","x1506072434679721984",2022-03-22 00:57:04,"gp_pulipaka","#AI Best: A Greater Foundation for Machine Learning. @bigdataconf #BigData #Analytics #DataScience #MachineLearning #IoT #IIoT #Python #RStats #TensorFlow #JavaScript #ReactJS #Serverless #Linux #Programming #Coding #100DaysOfCode
https://t.co/snGxIdaHlk
https://t.co/m9mdGlXT9K https://t.co/0n6B5akCqz",12,15
"x277302744","x1506444431913889792",2022-03-23 01:35:15,"SpinyDag","In order for my laptop to come back from the dead it had to have the hard drive wiped. I'm at the point where it may be time to reinstall #Rstats, but do I really want to bring that negativity back to my personal computer?",2,2
"x1301786821609824256","x1506439728685588486",2022-03-23 01:16:34,"kennedymwavu","Yes R can be quirky sometimes, but damn it really got on the nerves of this person!

#rstats fans you can have a look. Quite a good writer, so trust me when I tell you you won't get bored.

https://t.co/14UVvJvU0w",0,2
"x14629263","x1506436579534979074",2022-03-23 01:04:03,"JonTheGeek","Tomorrow is a use-it-or-lose-it rando day off and it's going to be glorious. I meany ""day off"" is gonna be @R4DScommunity &amp; putting together my #rstudioconf proposal but still! #rstats",1,2
"x233585808","x1506360612829470731",2022-03-22 20:02:11,"CRANberriesFeed","CRAN updates: quantdr safetyCharts #rstats",1,2
"x233585808","x1506224750221275139",2022-03-22 11:02:19,"CRANberriesFeed","CRAN updates: abess distr6 IDSL.IPA pedSimulate rsimsum TreeSearch #rstats",0,1
"x233585808","x1506315342481698816",2022-03-22 17:02:18,"CRANberriesFeed","CRAN updates: gpboost lqr openair PTXQC #rstats",1,2
"x233585808","x1506254919183089671",2022-03-22 13:02:12,"CRANberriesFeed","New CRAN package rqPen with initial version 2.3 #rstats",0,1
"x233585808","x1506285138057089028",2022-03-22 15:02:16,"CRANberriesFeed","CRAN updates: backbone IDSL.UFAx squeezy tidylo #rstats",0,1
"x233585808","x1506436117503086598",2022-03-23 01:02:13,"CRANberriesFeed","CRAN updates: ecpc riskclustr tidytable #rstats",1,2
"x233585808","x1506254928330776580",2022-03-22 13:02:14,"CRANberriesFeed","CRAN updates: adobeanalyticsr greta #rstats",0,1
"x233585808","x1506330412599107584",2022-03-22 18:02:11,"CRANberriesFeed","New CRAN package limonaid with initial version 0.1.3 #rstats",0,1
"x233585808","x1506330385671729166",2022-03-22 18:02:04,"CRANberriesFeed","New CRAN package ConnectednessApproach with initial version 1.0.0 #rstats",1,2
"x233585808","x1506390811805691904",2022-03-22 22:02:11,"CRANberriesFeed","CRAN updates: dagwood piecepackr #rstats",1,2
"x233585808","x1506164288121151489",2022-03-22 07:02:04,"CRANberriesFeed","CRAN removals: NADA2 provSummarizeR rdtLite sparsebn thriftr TInPosition ycinterextra #rstats",0,1
"x233585808","x1506270036075421708",2022-03-22 14:02:16,"CRANberriesFeed","CRAN updates: bistablehistory easySdcTable hash IDSL.UFA interactionR #rstats",0,1
"x233585808","x1506405915041439749",2022-03-22 23:02:12,"CRANberriesFeed","CRAN updates: accept gridpattern #rstats",1,2
"x233585808","x1506179427381698564",2022-03-22 08:02:13,"CRANberriesFeed","CRAN updates: gets SortedEffects SPlit #rstats",0,1
"x233585808","x1506209610159509506",2022-03-22 10:02:09,"CRANberriesFeed","CRAN updates: pkgndep #rstats",0,1
"x233585808","x1506285123943161862",2022-03-22 15:02:13,"CRANberriesFeed","New CRAN package subtee with initial version 1.0.1 #rstats",0,1
"x233585808","x1506300223143960594",2022-03-22 16:02:13,"CRANberriesFeed","CRAN updates: cartogramR discnorm qgcompint #rstats",0,1
"x233585808","x1506315286592606218",2022-03-22 17:02:04,"CRANberriesFeed","New CRAN package adace with initial version 1.0.1 #rstats",0,1
"x233585808","x1506058620923953152",2022-03-22 00:02:11,"CRANberriesFeed","CRAN updates: caviarpd CITAN #rstats",0,1
"x233585808","x1506073729092182023",2022-03-22 01:02:13,"CRANberriesFeed","CRAN updates: epiR lhs rapportools #rstats",1,1
"x233585808","x1506421007493570561",2022-03-23 00:02:10,"CRANberriesFeed","CRAN updates: cubature #rstats",1,2
"x233585808","x1506345512768843783",2022-03-22 19:02:11,"CRANberriesFeed","CRAN updates: MTE REBayes #rstats",2,3
"x233585808","x1506194564700385282",2022-03-22 09:02:22,"CRANberriesFeed","CRAN updates: BigVAR cxhull densitr mirt oceanic ordinalNet SignifReg tmvtnorm #rstats",0,1
"x233585808","x1506330443301494787",2022-03-22 18:02:18,"CRANberriesFeed","New CRAN package spldv with initial version 0.1.0 #rstats",0,1
"x233585808","x1506330449542586375",2022-03-22 18:02:20,"CRANberriesFeed","CRAN updates: fritools IDSL.MXP oce RCMinification #rstats",0,1
"x75673231","x1506314349652062209",2022-03-22 16:58:21,"enricomolinari","Japanese start-up develops armband that mimics PAIN in the #metaverse 

https://t.co/p9w1ffGUNz via @MailOnline #fintech #insurtech #finserv #marketing #DevOps #RStats #flutter #Python #datavis #ModelOps #AI #IoT @enricomolinari  #CyberSecurity #GovTech #ehealth #smartcities #ESG",1,4
"x75673231","x1506409135218184194",2022-03-22 23:15:00,"enricomolinari","#GendeGap and diversity are good business

https://t.co/H1R23YWGpZ #fintech #insurtech #finserv #marketing #payments #100DaysOfCode #DevOps #datascientist #RStats #flutter #JavaScript #TensorFlow #Python #datavis #ModelOps #AI #IoT @enricomolinari #CyberSecurity #GovTech #ESG https://t.co/odffalusPY",3,8
"x75673231","x1506436062863925250",2022-03-23 01:02:00,"enricomolinari","To invest properly in #DevOps companies should follow 5 principles 

https://t.co/s4bxWiOMDx #fintech #insurtech #finserv #marketing #100DaysOfCode #DevOps #datascientist #RStats #flutter #JavaScript #TensorFlow #Python #ModelOps #AI #IoT @enricomolinari #CyberSecurity #GovTech https://t.co/ebkXqbezSo",7,8
"x935569091678691328","x1506285557504225282",2022-03-22 15:03:56,"tidyversetweets","Split time from datetime #tidyverse #rstats https://t.co/7WyTG3kIMe",0,1
"x935569091678691328","x1506279197014175763",2022-03-22 14:38:40,"tidyversetweets","R: create filtered dataframe with dplyr and for loop #tidyverse #rstats https://t.co/o2SQaHnnJ3",0,1
"x935569091678691328","x1506333815538597888",2022-03-22 18:15:42,"tidyversetweets","Splitting a column in an R dataframe based on a condition in another column of same dataframe #tidyverse #rstats https://t.co/Un2m2H0qad",0,1
"x935569091678691328","x1506321904197582848",2022-03-22 17:28:22,"tidyversetweets","credentials for gmailr in production in no interactive mode #tidyverse #rstats https://t.co/ubVNv0dkLw",1,1
"x935569091678691328","x1506339646506258436",2022-03-22 18:38:52,"tidyversetweets","importing csv file #tidyverse #rstats https://t.co/1ScABOiaFv",0,1
"x935569091678691328","x1506435741659942912",2022-03-23 01:00:43,"tidyversetweets","Is it possible (how) to have different line widths for different groups in ggsurvplot figure in R? #tidyverse #rstats https://t.co/jn3sDwxWNO",0,1
"x935569091678691328","x1506285558712176650",2022-03-22 15:03:57,"tidyversetweets","Getting negative time duration in simulation in r #tidyverse #rstats https://t.co/WGbyzGc8yC",0,1
"x935569091678691328","x1506202184802787331",2022-03-22 09:32:39,"tidyversetweets","How to get the complete vector of values from the scale of a plot in R? #tidyverse #rstats https://t.co/fuhCIP88Xd",0,1
"x935569091678691328","x1506245520402137088",2022-03-22 12:24:51,"tidyversetweets","Web-scraping with Login using R and rvest does not work #tidyverse #rstats https://t.co/sZuYbahIqZ",0,1
"x935569091678691328","x1506316421189484553",2022-03-22 17:06:35,"tidyversetweets","How can I read in a list of- and combine- multiple CSVs with duplicate ID columns? #tidyverse #rstats https://t.co/CBnF8jGSyV",0,1
"x935569091678691328","x1506382262878752778",2022-03-22 21:28:13,"tidyversetweets","reorder x-axis with heatmap in R #tidyverse #rstats https://t.co/uJIUhJnLEg",1,1
"x935569091678691328","x1506272680269557764",2022-03-22 14:12:46,"tidyversetweets","dplyr mutate, dynamic variable #tidyverse #rstats https://t.co/RWMTDIQyN3",0,1
"x935569091678691328","x1506435741097811970",2022-03-23 01:00:43,"tidyversetweets","Filter based on minimum date differences greater than zero dplyr #tidyverse #rstats https://t.co/XPRgM6AvtI",0,1
"x935569091678691328","x1506359116343783429",2022-03-22 19:56:14,"tidyversetweets","Make ggplot panels the same height in ggarrange #tidyverse #rstats https://t.co/Bj5unVv3ft",0,1
"x935569091678691328","x1506342896110211076",2022-03-22 18:51:47,"tidyversetweets","creating a list of character sting and bind with table #tidyverse #rstats https://t.co/CTv58wLxav",0,1
"x935569091678691328","x1506306825242742788",2022-03-22 16:28:27,"tidyversetweets","dplyr multi core (multidplyr) with pmap function #tidyverse #rstats https://t.co/rX2ae6yFVi",0,1
"x935569091678691328","x1506378455474229260",2022-03-22 21:13:05,"tidyversetweets","How can I create a loop in R for plotting multiple datasets in sequence? #tidyverse #rstats https://t.co/bEPUFEKl9C",0,1
"x935569091678691328","x1506352255074717702",2022-03-22 19:28:58,"tidyversetweets","gganimate is not rendering out animations at all, and R doesn't appear to be doing anything? #tidyverse #rstats https://t.co/bHpLtMZYIr",0,1
"x935569091678691328","x1506435739923402753",2022-03-23 01:00:43,"tidyversetweets","ggplot aid in graphing, helping with creating a graph from a picture #tidyverse #rstats https://t.co/5Rl2ielkQf",0,1
"x935569091678691328","x1506264205174915077",2022-03-22 13:39:06,"tidyversetweets","Replace NA date by the value of another colum #tidyverse #rstats https://t.co/AXp42qVL6p",1,1
"x935569091678691328","x1506095229820096513",2022-03-22 02:27:39,"tidyversetweets","https://t.co/uaELhppyGw NA error and format invalid 'trim' argument #tidyverse #rstats https://t.co/Guk4C2gzkQ",1,1
"x935569091678691328","x1506233156340432896",2022-03-22 11:35:43,"tidyversetweets","Filtering names with letters only #tidyverse #rstats https://t.co/jRsERewB9b",0,1
"x935569091678691328","x1506212686337658883",2022-03-22 10:14:23,"tidyversetweets","Why is the ymd() function (Lubridate package) working when it's a vector, but not as a column in a dataframe? #tidyverse #rstats https://t.co/rJUWOIvxOv",0,1
"x935569091678691328","x1506285558099763204",2022-03-22 15:03:57,"tidyversetweets","How to make select() and filter() functions work together in the server in shiny? #tidyverse #rstats https://t.co/qQ2PA0usI4",1,1
"x935569091678691328","x1506356466793553926",2022-03-22 19:45:43,"tidyversetweets","Add counts to stacked bar plot with data from 2 data frames #tidyverse #rstats https://t.co/u0tZhW73Ay",0,1
"x935569091678691328","x1506143615856390147",2022-03-22 05:39:55,"tidyversetweets","I'm wondering what's wrong with the Shiny code. #tidyverse #rstats https://t.co/arXCbzl99Q",0,1
"x935569091678691328","x1506233155782590474",2022-03-22 11:35:43,"tidyversetweets","How can I remove duplicate values in different columns of R dataframe? #tidyverse #rstats https://t.co/jSJ91CnuNO",0,1
"x935569091678691328","x1506326289950650378",2022-03-22 17:45:48,"tidyversetweets","%Change in Oil Price #tidyverse #rstats https://t.co/YSJe0kVtKT",0,1
"x935569091678691328","x1506363633139343364",2022-03-22 20:14:11,"tidyversetweets","Creating a heatmap in R #tidyverse #rstats https://t.co/fJP8kuJTpM",0,1
"x935569091678691328","x1506344903130943490",2022-03-22 18:59:46,"tidyversetweets","Why is this making my data frame become values? #tidyverse #rstats https://t.co/W66Ewkmvru",0,1
"x935569091678691328","x1506171570691227648",2022-03-22 07:31:00,"tidyversetweets","Creating multiple proportion table in R dataframe #tidyverse #rstats https://t.co/zgPflN8CiU",0,1
"x935569091678691328","x1506321903644037125",2022-03-22 17:28:22,"tidyversetweets","Create a column that is a list of named columns efficently R #tidyverse #rstats https://t.co/lAfaz3T9Zn",2,1
"x935569091678691328","x1506368455133511686",2022-03-22 20:33:21,"tidyversetweets","why is ggplot2 not creating graphs identical to before even though code is the same? #tidyverse #rstats https://t.co/DiXOFiKF5L",0,1
"x935569091678691328","x1506368454042996740",2022-03-22 20:33:21,"tidyversetweets","Correlation between Oil price change and Recession #tidyverse #rstats https://t.co/ul6bxblLKv",0,1
"x935569091678691328","x1506221718297325568",2022-03-22 10:50:16,"tidyversetweets","select.(-all_of(x)) where x is a list of column names, but some are already removed or do not exist #tidyverse #rstats https://t.co/yO59CXsLNS",0,1
"x935569091678691328","x1506416815211266052",2022-03-22 23:45:31,"tidyversetweets","'pandoc document conversion failed with Error 97' when knitting rmarkdown #tidyverse #rstats https://t.co/Qw8LonEM4Q",0,1
"x935569091678691328","x1506259959981527045",2022-03-22 13:22:14,"tidyversetweets","Labeling a specific point using ggsurvplot #tidyverse #rstats https://t.co/SAn8oSPGtH",0,1
"x935569091678691328","x1506326290537791495",2022-03-22 17:45:48,"tidyversetweets","How to parse JSON in R from PANTHER API #tidyverse #rstats https://t.co/yy80z47SoB",0,1
"x935569091678691328","x1506435740573605890",2022-03-23 01:00:43,"tidyversetweets","R: Comparing different versions of data in terms of levels #tidyverse #rstats https://t.co/En8IZdaLbk",0,1
"x935569091678691328","x1506239238009929728",2022-03-22 11:59:53,"tidyversetweets","Illustrate standard deviation in histogram #tidyverse #rstats https://t.co/qHQttczF1l",0,1
"x935569091678691328","x1506071208365805568",2022-03-22 00:52:12,"tidyversetweets","R: Drawing Arbitrary Partitions on a Graph #tidyverse #rstats https://t.co/NVcNJtZnzu",0,1
"x935569091678691328","x1506402129480761353",2022-03-22 22:47:09,"tidyversetweets","Bookdown site not rendering correct HTML theme on github page #tidyverse #rstats https://t.co/YK6kO9E9hi",0,1
"x935569091678691328","x1506235600885661696",2022-03-22 11:45:26,"tidyversetweets","How to sum values if the number of rows exceeds the desired number in R #tidyverse #rstats https://t.co/X5eiBU9QU5",1,2
"x935569091678691328","x1506408844158722052",2022-03-22 23:13:50,"tidyversetweets","no applicable method for 'group_by' applied to an object of class ""function"" #tidyverse #rstats https://t.co/MZfB5Etmb2",1,1
"x935569091678691328","x1506212685712543746",2022-03-22 10:14:23,"tidyversetweets","Multiple split and export to separate excel tabs #tidyverse #rstats https://t.co/4VILFFZe82",1,1
"x935569091678691328","x1506333814913748998",2022-03-22 18:15:42,"tidyversetweets","jtools::summ() does not report regression results in a table #tidyverse #rstats https://t.co/PQn5DELIxe",0,1
"x935569091678691328","x1506254023128719362",2022-03-22 12:58:38,"tidyversetweets","Numbered points on plot and in legend #tidyverse #rstats https://t.co/AET40RYGmU",0,1
"x935569091678691328","x1506359115249029136",2022-03-22 19:56:14,"tidyversetweets","Plotting years with decimals in R ggplot #tidyverse #rstats https://t.co/rQtU6jiZYu",0,1
"x935569091678691328","x1506147699862781954",2022-03-22 05:56:09,"tidyversetweets","creating function to obtain result of table #tidyverse #rstats https://t.co/FPb05iyRkr",3,1
"x935569091678691328","x1506230867349413889",2022-03-22 11:26:37,"tidyversetweets","Cumulative sum based on two columns string match #tidyverse #rstats https://t.co/L0qiu7UIfS",1,1
"x935569091678691328","x1506193209730519050",2022-03-22 08:56:59,"tidyversetweets","How to apply code formatting to R Markdown inline code? #tidyverse #rstats https://t.co/U6A9zza2gm",0,1
"x935569091678691328","x1506112360704094215",2022-03-22 03:35:43,"tidyversetweets","My package &amp;quot;xaringan&amp;quot; can&amp;#39;t run in R-markdwon &amp;quot;UTF-8 decoding error in https://t.co/K9NGMPpZlZ at byte offset 13&amp;quot; #tidyverse #rstats https://t.co/nioBYf0uxz",0,1
"x935569091678691328","x1506354295696142336",2022-03-22 19:37:05,"tidyversetweets","R studio ggplot2 fitting with specific distribution required correction #tidyverse #rstats https://t.co/vB9qrEdvOJ",0,1
"x935569091678691328","x1506306825825759235",2022-03-22 16:28:27,"tidyversetweets","R : regression line interrupted in ggplot while a continuous line is expected #tidyverse #rstats https://t.co/tlFMiEEooF",0,1
"x935569091678691328","x1506306826421383174",2022-03-22 16:28:27,"tidyversetweets","Take the uncertainty in its face value in siunitx #tidyverse #rstats https://t.co/ePslMBLTi4",0,1
"x935569091678691328","x1506306824630415361",2022-03-22 16:28:27,"tidyversetweets","AROC for classes in Multi-Class models #tidyverse #rstats https://t.co/TWWxe64ygz",0,1
"x935569091678691328","x1506272680739323907",2022-03-22 14:12:46,"tidyversetweets","Cannot import fonts into R #tidyverse #rstats https://t.co/p7PgMW0sRj",0,1
"x935569091678691328","x1506321903090339841",2022-03-22 17:28:22,"tidyversetweets","how to group levels of each subgroup in a forest plot #tidyverse #rstats https://t.co/TMRvLIgiCw",0,1
"x935569091678691328","x1506095229299998721",2022-03-22 02:27:39,"tidyversetweets","Change part of a legend using ggplot in R? #tidyverse #rstats https://t.co/fe4XdQ8WWh",0,1
"x935569091678691328","x1506162192483237888",2022-03-22 06:53:44,"tidyversetweets","The Shiny code is correct, but an error is displayed on the web page. #tidyverse #rstats https://t.co/7IMMPKUggy",0,1
"x935569091678691328","x1506254023640424449",2022-03-22 12:58:38,"tidyversetweets","Use tidyverse to add totals to a pivot data frame #tidyverse #rstats https://t.co/OJYjLAJ3cv",1,1
"x935569091678691328","x1506285556942229512",2022-03-22 15:03:56,"tidyversetweets","combine several variables into one #tidyverse #rstats https://t.co/My6luRUNPj",0,1
