"user_id","status_id","created_at","screen_name","text","favorite_count","retweet_count"
"x268619848","x1473823850064396288",2021-12-23 01:12:42,"Sheraj99","Python for #CyberSecurity! #BigData #Analytics #DataScience #IoT #IIoT #PyTorch #Python #RStats #TensorFlow #Java #JavaScript #ReactJS #GoLang #CloudComputing #Serverless #DataScientist #Linux #Books #Programming #Coding #100DaysofCode 
https://t.co/5ppEtnoATw",3,5
"x268619848","x1473456607816298496",2021-12-22 00:53:25,"Sheraj99","AI Best: Gregory's Taylor Series with @vaishalilambe. #BigData #Analytics #DataScience #AI #MachineLearning #IoT #IIoT #Python #RStats #TensorFlow #JavaScript #ReactJS #CloudComputing #Serverless #DataScientist #Linux #Programming #Coding #100DaysofCode  
https://t.co/lJ8qxh9zVx",11,13
"x268619848","x1473458925643182086",2021-12-22 01:02:38,"Sheraj99","Infographic: How to become a #DataScientist #SQL #DataScience #BigData #Analytics #AI #IIoT #PyTorch #Python #RStats #TensorFlow #JavaScript #ReactJS #CloudComputing #Linux #Programming #Coding #100DaysofCode #Flutter #Jupyter #DL #NLProc #R #golang #CodeNewbie #ML #CyberSecurity https://t.co/vklbR4XiRx",10,26
"x268619848","x1473459140500635649",2021-12-22 01:03:29,"Sheraj99","Biases in #AI Systems https://t.co/6xz4Hc73tG #SQL #DataScientists #DataScience #BigData #Analytics #IIoT #PyTorch #Python #RStats #TensorFlow #JavaScript #ReactJS #CloudComputing #Linux #Programming #Coding #100DaysofCode #Flutter #Jupyter #DL #NLProc #R #golang #CodeNewbie",11,19
"x268619848","x1473462027700129793",2021-12-22 01:14:57,"Sheraj99","AI Best: Gregory's Taylor Law of Fluctuation. #BigData #Analytics #DataScience #AI #MachineLearning #IoT #IIoT #Python #RStats #TensorFlow #Java #JavaScript #ReactJS #CloudComputing #Serverless #DataScientist #Linux #Programming #Coding #100DaysofCode 
https://t.co/jHlT49mitb",9,19
"x268619848","x1473819429544865797",2021-12-23 00:55:08,"Sheraj99","New Releases: SAS e-Books. #BigData #Analytics #DataScience #IoT #IIoT #PyTorch #Python #RStats #TensorFlow #Java #JavaScript #ReactJS #GoLang #CloudComputing #Serverless #DataScientist #Linux #Books #Programming #Coding #100DaysofCode 
https://t.co/ygtnducbhN",6,13
"x268619848","x1473810938130280460",2021-12-23 00:21:24,"Sheraj99","#ReinforcementLearning: Bellman Equation and Optimality. #BigData #Analytics #DataScience #AI #MachineLearning #IoT #IIoT #Python #RStats #TensorFlow #JavaScript #ReactJS #CloudComputing #Serverless #DataScientist #Linux #Programming #Coding #100DaysofCode
https://t.co/UpRAFzT1Q1",5,17
"x268619848","x1473459504561991683",2021-12-22 01:04:56,"Sheraj99","Top #ML #Algorithms for Predictions #SQL #DataScientists #DataScience #BigData #Analytics #AI #IIoT #PyTorch #Python #RStats #TensorFlow #JavaScript #ReactJS #CloudComputing #Linux #Programming #Coding #100DaysofCode #Flutter #Jupyter #DL #NLProc #R #golang #CodeNewbie #MLOps https://t.co/0orwI5hZ7Y",119,117
"x1357104077042294787","x1473784105502490625",2021-12-22 22:34:46,"MaleFunctions","Take The Trash Out Twitter 👩🏻‍⚖️
#Python #BigData #Analytics #AI #DataScience #IoT #IIoT #Azure #PyTorch #Cython #RStats #DotNet #C #CPP #Java #CSharp #Flutter #SQL #TensorFlow #JavaScript #ReactJS #MachineLearning #HTML #Serverless #DataScientist #Linux #Programming #100DaysofCode https://t.co/g3dNPLzbC3",10,34
"x1357104077042294787","x1473476699585236994",2021-12-22 02:13:15,"MaleFunctions","@KIIARA You’re causing me to over work my accounts and it’s costing you @KIIARA how fkn dumb is a brunette bleached blonde?#Python #BigData #AI #IoT #IIoT #Azure #PyTorch #Cython #RStats #DotNet #C #CPP #Java #CSharp #Flutter #SQL #TensorFlow #JavaScript #ReactJS #Serverless #Linux #HTML https://t.co/1Abg4oUMqB",8,15
"x1357104077042294787","x1473823782364233737",2021-12-23 01:12:26,"MaleFunctions","Who Knows The Story”David and Goliath”that’s what’s just occurred @KIIARA #trendingkiiara #HTML #AI #FactsNotFear #Security #Azure #WordPress #NFT #Serverless #Python #PyTorch #Ad 
#fintech #insurtech #finserv #Roblox #DevOps #RStats #flutter #JavaScript #Coding #Python #ModelOps https://t.co/38a8b3tLII https://t.co/qYxqKGDQCk",6,12
"x1357104077042294787","x1473771592371085314",2021-12-22 21:45:03,"MaleFunctions","If I ask nice🥺would You all Do Me a favor and Deliver This Message To @KIIARA📝I🤍U #lilkiiwi #Ad 🚑#HTML #NFT #trendingkiiara #WordPress #Roblox #gratitude 
#insurtech #Security #DevOps #RStats #flutter #JavaScript #TensorFlow #Python #ModelOps #Infosec
https://t.co/gmwx2fNiv5",3,12
"x1357104077042294787","x1473774519714205702",2021-12-22 21:56:41,"MaleFunctions","Lobotomy’s by #Dexter 
#IDO #ETH #NFT #GameFi #HTML #WordPress #Security #Python #AI #IoT #IIoT #Azure #PyTorch #Cython #RStats #DotNet #C #CPP #Java #CSharp #Flutter  #TensorFlow #JavaScript #ReactJS 
#trendingkiiara @KIIARA #Airdrop #MentalHealthMatters https://t.co/EzveE49hwl",4,22
"x935569091678691328","x1473823096394162183",2021-12-23 01:09:43,"tidyversetweets","Scaling problem when plotting a graph in R #tidyverse #rstats https://t.co/oPN3VkhR15",0,0
"x935569091678691328","x1473823095769210883",2021-12-23 01:09:42,"tidyversetweets","Convert list to string with conditions #tidyverse #rstats https://t.co/p5tWNbgGOM",0,0
"x935569091678691328","x1473729751730855940",2021-12-22 18:58:48,"tidyversetweets","Running out of memory #tidyverse #rstats https://t.co/u0F2RS3Ht8",0,1
"x935569091678691328","x1473666501454573574",2021-12-22 14:47:28,"tidyversetweets","Rmd output to different directory #tidyverse #rstats https://t.co/6kKuX7GDMh",0,1
"x935569091678691328","x1473701055762513926",2021-12-22 17:04:46,"tidyversetweets","How can I install tidyverse on Archlinux? #tidyverse #rstats https://t.co/LjYBNxJlLx",0,1
"x935569091678691328","x1473701055158534145",2021-12-22 17:04:46,"tidyversetweets","ML piplines : attributes use / can we save elements in the attibutes of a list ? #tidyverse #rstats https://t.co/BCSrDmswGM",0,1
"x935569091678691328","x1473729751017824260",2021-12-22 18:58:47,"tidyversetweets","Collapsing one hot encoded columns based on conditional in R dplyr #tidyverse #rstats https://t.co/mztAC3Q2Bn",0,1
"x935569091678691328","x1473607159233531905",2021-12-22 10:51:39,"tidyversetweets","dplyr: adding rows with 0 cases using group_by() and summarise() #tidyverse #rstats https://t.co/fbq7tjMR5I",1,2
"x935569091678691328","x1473802602144047116",2021-12-22 23:48:16,"tidyversetweets","Dynamic intervals per group with Sparklyr - a faster solution #tidyverse #rstats https://t.co/XB3yULWwZ9",0,1
"x935569091678691328","x1473599691988377603",2021-12-22 10:21:59,"tidyversetweets","ggmosaic: ""Discrete value supplied to continuous scale"" error when ggplot2/ggmosaic is imported #tidyverse #rstats https://t.co/BZn2aaPpsN",1,2
"x935569091678691328","x1473607159791378433",2021-12-22 10:51:39,"tidyversetweets","Univariate linear regression (OLS) #tidyverse #rstats https://t.co/VdPnTi5E5M",1,2
"x935569091678691328","x1473708931277070338",2021-12-22 17:36:04,"tidyversetweets","creating a Sex Ratio Table from a table with the number of men and women (Summarise?) #tidyverse #rstats https://t.co/d9n85Dmm42",2,2
"x935569091678691328","x1473708930601824265",2021-12-22 17:36:03,"tidyversetweets","pivoting multiple columns R #tidyverse #rstats https://t.co/vUHgwhTuKW",2,2
"x935569091678691328","x1473663347946135559",2021-12-22 14:34:56,"tidyversetweets","In rbind(df, subrow) : number of columns of result is not a multiple of vector length (arg 2) #tidyverse #rstats https://t.co/T0REnrCHDz",1,2
"x935569091678691328","x1473725678646407170",2021-12-22 18:42:36,"tidyversetweets","recode data using dplyr::recode when variables habe a space #tidyverse #rstats https://t.co/zfG3qAVyBo",1,1
"x935569091678691328","x1473734089542971394",2021-12-22 19:16:02,"tidyversetweets","ggplot2: two x-axis tics (year and month) and labels on two lines #tidyverse #rstats https://t.co/4cTaQBtjb3",0,1
"x935569091678691328","x1473460236107370497",2021-12-22 01:07:50,"tidyversetweets","In R TidyVerse what is command for dropping a record with an NA #tidyverse #rstats https://t.co/CtQAWsOMQe",0,1
"x935569091678691328","x1473772124653318144",2021-12-22 21:47:10,"tidyversetweets","Having issues running command: library(tidyverse) #tidyverse #rstats https://t.co/Nh7Bdqc4IO",2,2
"x935569091678691328","x1473734090222448649",2021-12-22 19:16:02,"tidyversetweets","use levene_test in map() function from purrr? #tidyverse #rstats https://t.co/h1TXU8svpA",0,1
"x935569091678691328","x1473599691325681667",2021-12-22 10:21:59,"tidyversetweets","dplyr: Why are cases not summarized using summarise()? #tidyverse #rstats https://t.co/awG4rURwaG",1,2
"x935569091678691328","x1473701056429404164",2021-12-22 17:04:46,"tidyversetweets","Parse through a messy column to create multiple new columns when variables in original column are out of order and not always present #tidyverse #rstats https://t.co/6oZ1ozXU0s",0,1
"x935569091678691328","x1473745132998565888",2021-12-22 19:59:55,"tidyversetweets","R--How do I iterate over different length lists? #tidyverse #rstats https://t.co/0XLGWRMZxN",0,1
"x935569091678691328","x1473745132289679372",2021-12-22 19:59:55,"tidyversetweets","""Error in FUN(X[[i]], ...) : object 'group' not found"" error code while plotting a map #tidyverse #rstats https://t.co/HYPHT82E9e",0,1
"x935569091678691328","x1473585495087230979",2021-12-22 09:25:34,"tidyversetweets","Assigning a value and sum up if two strings match in two different data frames in R #tidyverse #rstats https://t.co/eq3UKH3KiL",1,2
"x935569091678691328","x1473784763844636674",2021-12-22 22:37:23,"tidyversetweets","Is it possible to change the appearance of one panel in a facet_wrap()? #tidyverse #rstats https://t.co/stUMufUjwI",0,1
"x935569091678691328","x1473751830576443399",2021-12-22 20:26:32,"tidyversetweets","Using a complex pivot_wider to deal with a time series / longitudinal measurement design #tidyverse #rstats https://t.co/MstXM7LNN9",1,1
"x935569091678691328","x1473751829880221707",2021-12-22 20:26:31,"tidyversetweets","Concept Clarification: Wilcoxon rank test vs two-samples T-test #tidyverse #rstats https://t.co/4gbjoJDloa",2,1
"x935569091678691328","x1473780389718200325",2021-12-22 22:20:01,"tidyversetweets","Insert another condtion in R code #tidyverse #rstats https://t.co/qJArEsTJOh",1,2
"x935569091678691328","x1473486339253616640",2021-12-22 02:51:33,"tidyversetweets","Can anyone explain why creating a histogram with two conditions shows incorrect distribution in R? #tidyverse #rstats https://t.co/aAAArBwqec",3,1
"x935569091678691328","x1473648010215239681",2021-12-22 13:33:59,"tidyversetweets","How to remove specific legends in ggplot2? #tidyverse #rstats https://t.co/DlGXWz8GQQ",2,2
"x935569091678691328","x1473679886145495048",2021-12-22 15:40:39,"tidyversetweets","How to perform calculations on a data table rendered with a reactive data frame, in R Shiny? #tidyverse #rstats https://t.co/6zl5vurLKP",0,1
"x935569091678691328","x1473663347283443717",2021-12-22 14:34:55,"tidyversetweets","How do I draw the line for change-point detection using/after doing a Pettitt test. #tidyverse #rstats https://t.co/0N3Y0Q6VOD",1,2
"x935569091678691328","x1473675055246848013",2021-12-22 15:21:27,"tidyversetweets","Using rle function with condition on a column in r #tidyverse #rstats https://t.co/iArdHd8ce7",0,1
"x935569091678691328","x1473772123877519363",2021-12-22 21:47:10,"tidyversetweets","Regular expression to extract words that starts with a pattern, but ends before symbols or spaces #tidyverse #rstats https://t.co/WxtI5F2zMS",3,3
"x935569091678691328","x1473675053904629770",2021-12-22 15:21:27,"tidyversetweets","Automating masking Values in output table #tidyverse #rstats https://t.co/LuEopNrkeV",0,1
"x935569091678691328","x1473599693246636036",2021-12-22 10:21:59,"tidyversetweets","R dataframe set attribute in dependence of previous and following attribute values #tidyverse #rstats https://t.co/HpkyPEqDRW",1,2
"x935569091678691328","x1473659940652916741",2021-12-22 14:21:23,"tidyversetweets","Why the R script provide by site pubmed is not executing ? Is it possible to make it run? #tidyverse #rstats https://t.co/8Of96NVfJ3",1,1
"x935569091678691328","x1473764534192160771",2021-12-22 21:17:00,"tidyversetweets","I am getting error when running code for a leftjoin of two tables named ""data"" and lookups"" #tidyverse #rstats https://t.co/Gj63UWIe6c",0,1
"x935569091678691328","x1473599692634218499",2021-12-22 10:21:59,"tidyversetweets","How to automate date sting with glue #tidyverse #rstats https://t.co/VtnOI2DdAJ",1,2
"x935569091678691328","x1473759622221778945",2021-12-22 20:57:29,"tidyversetweets","`dplyr::select` without reordering columns #tidyverse #rstats https://t.co/XFrtENJHs0",0,1
"x935569091678691328","x1473691885705302016",2021-12-22 16:28:20,"tidyversetweets","Building a text scroller in an RMarkdown document? #tidyverse #rstats https://t.co/LQvhDYcUSs",0,1
"x935569091678691328","x1473734091375878156",2021-12-22 19:16:02,"tidyversetweets","Shiny Module: Downloading all plots into a single PDF #tidyverse #rstats https://t.co/gemg4R61lY",4,1
"x935569091678691328","x1473679887110217732",2021-12-22 15:40:39,"tidyversetweets","my facet wrap produces two maps with data and one which just shows NA. How do I remove the NA map? #tidyverse #rstats https://t.co/M8jM1rgOpU",0,1
"x935569091678691328","x1473691886338596870",2021-12-22 16:28:20,"tidyversetweets","Merge multiple bar plots using ggplot2 #tidyverse #rstats https://t.co/NB7tmqjE0A",2,2
"x935569091678691328","x1473708931922989059",2021-12-22 17:36:04,"tidyversetweets","Popup message by column for DT::datatable that is part of an html markdown? #tidyverse #rstats https://t.co/FylXHgIqzv",1,2
"x935569091678691328","x1473618960335753220",2021-12-22 11:38:33,"tidyversetweets","How to replace a column in R by a modified column, dependent on filtered values? (removing outliers in panel data) #tidyverse #rstats https://t.co/I0mMqjpCGb",1,2
"x935569091678691328","x1473540270260162565",2021-12-22 06:25:52,"tidyversetweets","data tidying using dplyr in R #tidyverse #rstats https://t.co/MWTpc6ZRwC",1,1
"x935569091678691328","x1473759621554782224",2021-12-22 20:57:29,"tidyversetweets","Pivot wider to one row in R #tidyverse #rstats https://t.co/834rsWhFIi",0,1
"x935569091678691328","x1473609831898652675",2021-12-22 11:02:16,"tidyversetweets","Case_when mutate str_detect #tidyverse #rstats https://t.co/Wxp1bQ81ZN",1,2
"x935569091678691328","x1473585494508322819",2021-12-22 09:25:34,"tidyversetweets","How to remove Y Axis Titles and replace them with Legend Titles #tidyverse #rstats https://t.co/Qn5HvsWuQH",1,2
"x935569091678691328","x1473675054617669636",2021-12-22 15:21:27,"tidyversetweets","How to extend width of KableExtra tableoutput #tidyverse #rstats https://t.co/aP69LyaFc3",0,1
"x935569091678691328","x1473510082000392196",2021-12-22 04:25:54,"tidyversetweets","How to deal with this kind of data into ""group by_Country and Year"" in R #tidyverse #rstats https://t.co/CZnwXsJ1o7",1,1
"x935569091678691328","x1473554915695996930",2021-12-22 07:24:03,"tidyversetweets","Kernel Density Estimation via Sparklyr Framework #tidyverse #rstats https://t.co/LkvA5XDKCi",0,1
"x935569091678691328","x1473641133246930949",2021-12-22 13:06:39,"tidyversetweets","R data.table add column that sums all previous rows that meet condition #tidyverse #rstats https://t.co/RIvCHa4lJj",1,2
"x935569091678691328","x1473659941315612675",2021-12-22 14:21:23,"tidyversetweets","How to parse dates from a string without using regular expression? #tidyverse #rstats https://t.co/63lXDwwrqC",1,1
"x935569091678691328","x1473795961646460935",2021-12-22 23:21:53,"tidyversetweets","Add Git Bash to RStudio terminal (the dropdown only has cmd and powershell as choice) #tidyverse #rstats https://t.co/sLZ9gLhOaN",0,1
"x25951988","x1473822627789639680",2021-12-23 01:07:51,"dbfmurray","Finished this one last night - which I started WAY back in September as part of an #ironQuest / #sportsvizsunday entry. I have worked on and off on it for a few months - spending a LOT of time figuring out how to retrieve stats off the web using #rstats awesome rvest() package.",0,0
"x79818808","x1473821914980302854",2021-12-23 01:05:01,"cosmoduende","Lo había publicado en inglés para @TDataScience, comparto en español: 

StrangeR things: Añadiendo… ¿Gatos? 🐱 a tus plots en R  📈

Cómo analizar y visualizar datos con ayuda de divertidos gatos con el package “ggcats” 🐈 #RStats #DataAnalysis #Dataviz 

https://t.co/fRoXQzy6cf",0,0
"x97806291","x1473821696893329409",2021-12-23 01:04:09,"LaMatemaga","¡Hola! Hoy en #ProgramandoEnR haremos unos cuantos ejercicios de matrices y arreglos. ¡Acompáñanos!
https://t.co/2CsCsFopIY
#RStats https://t.co/fpBJv4Vyfs",4,2
"x2782310810","x1473819931137351680",2021-12-23 00:57:08,"DD_NaNa_","Up to 63% OFF. Introduction to R. Master the basics of data analysis by manipulating common data structures such as vectors, matrices, and data frames https://t.co/jKb6to9M1T #rstats #data #analysis",0,1
"x2782310810","x1473628258696511490",2021-12-22 12:15:30,"DD_NaNa_","Up to 63% OFF. Machine Learning with Tree-Based Models in R. Learn how to use tree-based models and ensembles to make classification and regression predictions with tidymodels https://t.co/eeePMeCPuY #rstats #machinelearning #ai",4,3
"x4263007693","x1473503681693818880",2021-12-22 04:00:28,"gp_pulipaka","How to Train a Convolutional Neural Network. #BigData #Analytics #DataScience #AI #MachineLearning #IoT #IIoT #Python #RStats #TensorFlow #Java #JavaScript #ReactJS #CloudComputing #Serverless #DataScientist #Linux #Programming #Coding #100DaysofCode 
https://t.co/R5CQ4DicRo https://t.co/MtjnkMICwW",28,43
"x4263007693","x1473503716405878786",2021-12-22 04:00:37,"gp_pulipaka","The Engine of the Neural Network: The Backpropagation Equation. #BigData #Analytics #DataScience #AI #MachineLearning #IoT #IIoT #PyTorch #Python #RStats #TensorFlow #JavaScript #ReactJS #Serverless #DataScientist #Linux #Programming #Coding #100DaysofCode
https://t.co/7Y5jVachLW https://t.co/tTUpquZsV6",28,52
"x4263007693","x1473816530555228162",2021-12-23 00:43:37,"gp_pulipaka","AI Best: @InterConWorld Award. #BigData #Analytics #DataScience #AI #MachineLearning #IoT #IIoT #PyTorch #Python #RStats #TensorFlow #Java #JavaScript #ReactJS #GoLang #CloudComputing #Serverless #DataScientist #Linux #Programming #Coding #100DaysofCode 
https://t.co/a4hPU77qUM https://t.co/q3vaA1gQjb",7,18
"x4263007693","x1473497033692663810",2021-12-22 03:34:03,"gp_pulipaka","Classification with Convolutional Neural Networks. #BigData #Analytics #DataScience #AI #MachineLearning #IoT #IIoT #Python #RStats #TensorFlow #JavaScript #ReactJS #CloudComputing #Serverless #DataScientist #Linux #Programming #Coding #100DaysofCode 
https://t.co/JZ5Uk6ehDO https://t.co/M3QN2faOaE",24,44
"x4263007693","x1473484207448023044",2021-12-22 02:43:05,"gp_pulipaka","Forecast Reservoir Operation (FIRO) for the Rise of the Flood. #BigData #Analytics #DataScience #AI #MachineLearning #IoT #IIoT #Python #RStats #TensorFlow #JavaScript #ReactJS #Serverless #DataScientist #Linux #Programming #Coding #100DaysofCode 
https://t.co/18nUG0EwE5 https://t.co/c4su1alSDu",24,44
"x4263007693","x1473482082190086153",2021-12-22 02:34:39,"gp_pulipaka","What are Artificial Neural Networks. #BigData #Analytics #DataScience #AI #MachineLearning #IoT #IIoT #PyTorch #Python #RStats #TensorFlow #Java #JavaScript #ReactJS #CloudComputing #Serverless #DataScientist #Linux #Programming #Coding #100DaysofCode 
https://t.co/QpBcpa4DMD https://t.co/per5eTEdgc",33,52
"x4263007693","x1473518680420102151",2021-12-22 05:00:04,"gp_pulipaka","The Mind Controlled Robots Now One Step Closer! #BigData #Analytics #DataScience #AI #MachineLearning #Robotics #IoT #IIoT #PyTorch #Python #RStats #TensorFlow #JavaScript #ReactJS #Serverless #DataScientist #Linux #Programming #Coding #100DaysofCode 
https://t.co/budoreRvkE https://t.co/bOzB7qnh5b",30,47
"x4263007693","x1473506131465097219",2021-12-22 04:10:12,"gp_pulipaka","Best Machine Learning #Books for Beginners and Experts in 2021. #BigData #Analytics #DataScience #IoT #IIoT #Python #RStats #TensorFlow #Java #JavaScript #ReactJS #GoLang #CloudComputing #Serverless #DataScientist #Linux #Programming #Coding #100DaysofCode
https://t.co/emAPAyUSPt https://t.co/RfqTfRmDYA",41,58
"x4263007693","x1473730171379273740",2021-12-22 19:00:28,"gp_pulipaka","From Facebook post many years ago in #ComputerScience! #BigData #Analytics #DataScience #AI #MachineLearning #IoT #IIoT #PyTorch #Python #RStats #TensorFlow #Java #JavaScript #ReactJS #GoLang #CloudComputing #Serverless #DataScientist #Linux #Programming #Coding #100DaysofCode https://t.co/yvbgcfT95w https://t.co/rmB6CT3EXu",33,31
"x4263007693","x1473529503569920004",2021-12-22 05:43:05,"gp_pulipaka","A Multifaceted Face Generator w/ Neural Networks. #BigData #Analytics #DataScience #AI #MachineLearning #IoT #IIoT #Python #RStats #TensorFlow #Java #JavaScript #ReactJS #CloudComputing #Serverless #DataScientist #Linux #Programming #Coding #100DaysofCode 
https://t.co/aAMYou8jMT https://t.co/Q4CHK8AEJM",46,36
"x4263007693","x1473699174948524047",2021-12-22 16:57:17,"gp_pulipaka","#AI Best: A Grader Foundation for Machine Learning. @bigdataconf
 #BigData #Analytics #DataScience #AI #MachineLearning #IoT #IIoT #Python #RStats #TensorFlow #JavaScript #ReactJS #Serverless #DataScientist #Linux #Programming #Coding #100DaysOfCode 
https://t.co/hOCcfRNWD9 https://t.co/0IGF9BNyAD",11,28
"x4263007693","x1473493264288333825",2021-12-22 03:19:05,"gp_pulipaka","Beginner's Guide to Neural Networks. #BigData #Analytics #DataScience #AI #MachineLearning #IoT #IIoT #PyTorch #Python #RStats #TensorFlow #Java #JavaScript #ReactJS #CloudComputing #Serverless #DataScientist #Linux #Programming #Coding #100DaysofCode 
https://t.co/QXS0qku4G1 https://t.co/zngkrFzVRX",34,49
"x4263007693","x1473497036578336772",2021-12-22 03:34:04,"gp_pulipaka","Overview: A Comprehensive Guide on Fourier Analysis. #BigData #Analytics #DataScience #AI #MachineLearning #IoT #IIoT #Python #RStats #TensorFlow  #JavaScript #ReactJS #CloudComputing #Serverless #DataScientist #Linux #Programming #Coding #100DaysofCode 
https://t.co/bxZ5cPxxXZ https://t.co/0LSPZpGXgo",24,40
"x4263007693","x1473483285170905095",2021-12-22 02:39:25,"gp_pulipaka","How to Handle Tabular Data Using #PyTorch Tabular Code! #BigData #Analytics #DataScience #AI #MachineLearning #IoT #IIoT #Python #RStats #TensorFlow #JavaScript #ReactJS #CloudComputing #Serverless #DataScientist #Linux #Programming #Coding #100DaysofCode 
https://t.co/2hFscRiHDt https://t.co/YQcHnCpwA7",37,46
"x4263007693","x1473693327912493061",2021-12-22 16:34:03,"gp_pulipaka","Critically Conscious Computing!  #BigData #Analytics #DataScience #AI #MachineLearning #IoT #IIoT #Python #RStats #TensorFlow #Java #JavaScript #ReactJS #CloudComputing #Serverless #DataScientist #Linux #Books #Programming #Coding #100DaysofCode 
https://t.co/R4z1SRkdA1 https://t.co/RiIhf81R1f",11,23
"x4263007693","x1473819913387134976",2021-12-23 00:57:04,"gp_pulipaka","AI Best: Top Books on Machine Learning. #BigData #Analytics #DataScience #IoT #IIoT #PyTorch #Python #RStats #TensorFlow #Java #JavaScript #ReactJS #GoLang #CloudComputing #Serverless #DataScientist #Linux #Books #Programming #Coding #100DaysofCode 
https://t.co/TkXucQHZAa https://t.co/4ySVGg3u76",13,28
"x4263007693","x1473518892844818436",2021-12-22 05:00:55,"gp_pulipaka","Books on Sale November 24: Future Tech. #BigData #Analytics #DataScience #AI #MachineLearning #IoT #IIoT #PyTorch #Python #RStats #TensorFlow #Java #JavaScript #ReactJS #CloudComputing #Serverless #DataScientist #Linux #Programming #Coding #100DaysofCode 
https://t.co/i9vtA4Pz9e https://t.co/rt6mJDCyjd",28,37
"x4263007693","x1473506097596149769",2021-12-22 04:10:04,"gp_pulipaka","Aligned Cognitive Architectures of #ReinforcementLearning. #BigData #Analytics #DataScience #AI #MachineLearning #IoT #IIoT #Python #RStats #TensorFlow #JavaScript #ReactJS #Serverless #DataScientist #Linux #Programming #Coding #100DaysofCode 
https://t.co/9zG7vxv8zU https://t.co/ha45mnlMu7",8,33
"x4263007693","x1473499051198930945",2021-12-22 03:42:04,"gp_pulipaka","Free eBooks: Books on Machine Learning and #DataScience. #BigData #Analytics #IoT #IIoT #PyTorch #Python #RStats #TensorFlow #Java #JavaScript #ReactJS #GoLang #CloudComputing #Serverless #DataScientist #Linux #Books #Programming #Coding #100DaysofCode 
https://t.co/VQ0YTT8dH4 https://t.co/BWTdGXymrw",95,99
"x4263007693","x1473488552860209158",2021-12-22 03:00:21,"gp_pulipaka","Introduction to Artificial Neural Network with Implementation. #BigData #Analytics #DataScience #AI #MachineLearning #IoT #IIoT #Python #RStats #TensorFlow #JavaScript #ReactJS #Serverless #DataScientist #Linux #Programming #Coding #100DaysofCode 
https://t.co/Vf4qRaDncL https://t.co/qNd8ccX2BM",61,91
"x4263007693","x1473487721398210568",2021-12-22 02:57:03,"gp_pulipaka","#AI Best: 1847 Activation Functions for Deep Learning. #BigData #Analytics #DataScience #MachineLearning #IoT #IIoT #PyTorch #Python #RStats #TensorFlow #JavaScript #ReactJS #Serverless #Linux #Programming #Coding #100DaysofCode 
https://t.co/fmC0RAw3Yb
https://t.co/Ah8YFj4Z0S https://t.co/qz2y0nJOxF",13,30
"x4263007693","x1473499045138243586",2021-12-22 03:42:03,"gp_pulipaka","#AI, #Analytics, #MachineLearning, #DataScience, Research  in 2021 and Key Waves for 2022. @kdnuggets #BigData #IoT #IIoT #Python #RStats #TensorFlow #JavaScript #ReactJS #Serverless #CloudComputing #DataScientist #Linux #Programming #Coding #100DaysofCode
https://t.co/YjalszDxBr https://t.co/Nclk6ff5HM",19,37
