"user_id","status_id","created_at","screen_name","text","favorite_count","retweet_count"
"x268619848","x1490841499197607937",2022-02-08 00:14:46,"Sheraj99","AI Lab Papers and Talks at NeurIPS 2021. #BigData #Analytics #DataScience #AI #MachineLearning #IoT #IIoT #PyTorch #Python #RStats #TensorFlow #Java #JavaScript #ReactJS #CloudComputing #Serverless #DataScientist #Linux #Programming #Coding #100DaysofCode 
https://t.co/idskMVIjby",8,22
"x935569091678691328","x1491094104998039552",2022-02-08 16:58:32,"tidyversetweets","Read/upload to google drive directly without downloading or saving files #tidyverse #rstats https://t.co/dV0bYgonJ2",0,1
"x935569091678691328","x1491139806159867904",2022-02-08 20:00:08,"tidyversetweets","DLL 'RSQLite' not found: maybe not installed for this architecture? Error : package 'RSQLite' could not be loaded. #tidyverse #rstats https://t.co/hu2w7CLRfV",0,1
"x935569091678691328","x1491094102951268356",2022-02-08 16:58:31,"tidyversetweets","Determine time of event in R #tidyverse #rstats https://t.co/66nyfzSPcz",0,1
"x935569091678691328","x1491094104456978436",2022-02-08 16:58:32,"tidyversetweets","tibble slice function error in a R Shiny app #tidyverse #rstats https://t.co/78wc31AQt1",0,1
"x935569091678691328","x1491118756592078848",2022-02-08 18:36:29,"tidyversetweets","R function to add column to dataframes using purrr::map #tidyverse #rstats https://t.co/0XzuJ3CfKt",1,1
"x935569091678691328","x1491118755979665416",2022-02-08 18:36:29,"tidyversetweets","reconfiguring data.frame with tibble childrens #tidyverse #rstats https://t.co/fedUK4x8CQ",0,1
"x935569091678691328","x1491160739087892480",2022-02-08 21:23:19,"tidyversetweets","Extracting a table from a text file #tidyverse #rstats https://t.co/GnhINvOoSd",0,1
"x935569091678691328","x1491160738483916807",2022-02-08 21:23:19,"tidyversetweets","Can`t install packages even after changing library path #tidyverse #rstats https://t.co/uL3AAMHwQg",1,2
"x935569091678691328","x1491139806889394180",2022-02-08 20:00:08,"tidyversetweets","r one sided geom_quasirandom #tidyverse #rstats https://t.co/f4OONnU2yW",0,1
"x935569091678691328","x1491184530379743232",2022-02-08 22:57:51,"tidyversetweets","Plot the log(density) of a theoretical distribution over the log(density) of a empirical vector #tidyverse #rstats https://t.co/lLGgTMhV0K",1,1
"x935569091678691328","x1491087312003997696",2022-02-08 16:31:32,"tidyversetweets","Strange behavior with ggplots geom_point #tidyverse #rstats https://t.co/JNO2mdaxeq",0,1
"x935569091678691328","x1491184530987827204",2022-02-08 22:57:51,"tidyversetweets","Reorder Function in R Issues #tidyverse #rstats https://t.co/mhduK8kqKY",0,1
"x935569091678691328","x1491114748674703361",2022-02-08 18:20:34,"tidyversetweets","Add different pictures to each Markers in the Leaflet Package (Map Application) #tidyverse #rstats https://t.co/ITtSpajMvO",0,1
"x935569091678691328","x1491100001526763526",2022-02-08 17:21:58,"tidyversetweets","creating frequency table for labelled data #tidyverse #rstats https://t.co/yZQsMyMQ1V",0,1
"x935569091678691328","x1490985675054854144",2022-02-08 09:47:40,"tidyversetweets","How to put a black border around certain dots on a ggplot geom_point plot #tidyverse #rstats https://t.co/5uplgErlUf",0,1
"x935569091678691328","x1491054347995787274",2022-02-08 14:20:33,"tidyversetweets","Bookmarks not working with RMarkdown (pdf) and titlesec #tidyverse #rstats https://t.co/ZhlBZjcuLM",0,1
"x935569091678691328","x1491178251171123200",2022-02-08 22:32:54,"tidyversetweets","unknown NAs in ggplot #tidyverse #rstats https://t.co/oVzkJ5Wlao",0,1
"x935569091678691328","x1490869795667025923",2022-02-08 02:07:12,"tidyversetweets","Pass variable name as argument dynamically on svydesign and dplyr::select functions #tidyverse #rstats https://t.co/k7Xf3AYbRa",0,1
"x935569091678691328","x1491094105555980289",2022-02-08 16:58:32,"tidyversetweets","Plotting column graph with multiple groups using ggplot #tidyverse #rstats https://t.co/KbxH4OcoiB",0,1
"x935569091678691328","x1491103608422682628",2022-02-08 17:36:18,"tidyversetweets","Plot list of lists with facet_wrap() #tidyverse #rstats https://t.co/vU3FLVswpj",0,1
"x935569091678691328","x1490869794341629956",2022-02-08 02:07:12,"tidyversetweets","RMarkdown: is it possible to return a table and a chart from the same cell? #tidyverse #rstats https://t.co/ltQsSf6QPE",0,1
"x935569091678691328","x1491217553854771203",2022-02-09 01:09:04,"tidyversetweets","Group By counts of zero are missing using dplyr #tidyverse #rstats https://t.co/fXNsJ33sob",1,1
"x935569091678691328","x1491094103668531213",2022-02-08 16:58:32,"tidyversetweets","Using purrr to repeat simulation while varying the inputs #tidyverse #rstats https://t.co/bstk3CLdkB",0,1
"x935569091678691328","x1491043710393634817",2022-02-08 13:38:17,"tidyversetweets","Geom_area() with discrete x-axis #tidyverse #rstats https://t.co/EYheCphJiO",0,1
"x935569091678691328","x1491178251716333568",2022-02-08 22:32:54,"tidyversetweets","Overlay the standard deviation of a group while maintaining the yearly y axis #tidyverse #rstats https://t.co/cllMcF44le",0,1
"x935569091678691328","x1491008242444640256",2022-02-08 11:17:21,"tidyversetweets","recode_factor giving an error #tidyverse #rstats https://t.co/IXYMeyaCpy",1,1
"x935569091678691328","x1490910038474563587",2022-02-08 04:47:07,"tidyversetweets","Error in filter(ToothGrowth, dose == 0.5) : object 'dose' not found #tidyverse #rstats https://t.co/wdLJAa8w6v",1,1
"x935569091678691328","x1490985675629416448",2022-02-08 09:47:40,"tidyversetweets","Iteration over data.table #tidyverse #rstats https://t.co/WvVwVOJ07y",0,1
"x935569091678691328","x1491217555083739140",2022-02-09 01:09:05,"tidyversetweets","Insert a graph from RStudio to R Markdown #tidyverse #rstats https://t.co/C85Q5FYJJ4",0,0
"x935569091678691328","x1490869796245839873",2022-02-08 02:07:13,"tidyversetweets","Plotting a better treemap using ggplot and the geom_rect hack, but how to get the labels correct? #tidyverse #rstats https://t.co/ttWmJHAgwq",0,1
"x935569091678691328","x1491103609064497159",2022-02-08 17:36:18,"tidyversetweets","R: Add a table1 to ggdraw figure #tidyverse #rstats https://t.co/xf3OZ7RLyn",0,1
"x935569091678691328","x1491114747919585285",2022-02-08 18:20:34,"tidyversetweets","Why I am having these discontinue lines in the table created with latex for PDF documents? #tidyverse #rstats https://t.co/MDPOCAnlnU",0,1
"x935569091678691328","x1491103610255597568",2022-02-08 17:36:18,"tidyversetweets","Cut/paste graphics as high quality #tidyverse #rstats https://t.co/AYgszMZo5A",1,1
"x935569091678691328","x1491054348620677128",2022-02-08 14:20:33,"tidyversetweets","Rangemap - Fatal error #tidyverse #rstats https://t.co/rFOWL8gmiE",1,1
"x935569091678691328","x1490903986446254082",2022-02-08 04:23:04,"tidyversetweets","Why are these solid lines appearing below my plot in ggplot? #tidyverse #rstats https://t.co/qMRuxJ5Ka2",0,1
"x935569091678691328","x1490972945128337411",2022-02-08 08:57:05,"tidyversetweets","How to group by multiple variables in python ggplot #tidyverse #rstats https://t.co/6xw5C8QFFx",0,1
"x935569091678691328","x1491019300647452677",2022-02-08 12:01:17,"tidyversetweets","Match two tables based on a time difference criterium #tidyverse #rstats https://t.co/74yH7XgHNh",0,1
"x935569091678691328","x1491190112134258689",2022-02-08 23:20:02,"tidyversetweets","summarize count with a condition #tidyverse #rstats https://t.co/riquKb9Ver",0,1
"x935569091678691328","x1491040625151598593",2022-02-08 13:26:01,"tidyversetweets","Can values of geom_function arguments (e.g. fill colours) be added to ggplot2 themes? #tidyverse #rstats https://t.co/ihRWYy9pz8",0,1
"x935569091678691328","x1491114749333053446",2022-02-08 18:20:34,"tidyversetweets","How to add manual tick at last row of ggplot facet? #tidyverse #rstats https://t.co/WpD5LEzVLO",1,1
"x935569091678691328","x1490988233269911557",2022-02-08 09:57:50,"tidyversetweets","R - Issues with group order/ ggplot Stacked barchart #tidyverse #rstats https://t.co/EQgmSO3Khu",0,1
"x935569091678691328","x1491040624530931720",2022-02-08 13:26:01,"tidyversetweets","Rearranging dataset to make plot with ggplot for specific time-period #tidyverse #rstats https://t.co/lNpJULsV3T",0,1
"x935569091678691328","x1491040623876521987",2022-02-08 13:26:01,"tidyversetweets","Filtering data based on value from other data frame using dplyr #tidyverse #rstats https://t.co/GJfDcPR3rp",0,1
"x935569091678691328","x1491011408074620928",2022-02-08 11:29:55,"tidyversetweets","In ggplot2, how to add a white hole in the middle of the pie chart #tidyverse #rstats https://t.co/oTNk4z50De",2,1
"x935569091678691328","x1491128658202927105",2022-02-08 19:15:50,"tidyversetweets","mutate columns with labels attributes in r #tidyverse #rstats https://t.co/N0bLbwoOXz",0,1
"x935569091678691328","x1491061178973528064",2022-02-08 14:47:42,"tidyversetweets","read_csv function in tidyverse not understanding `col_select` #tidyverse #rstats https://t.co/zEo2o8ph1N",0,1
"x935569091678691328","x1490869794991747073",2022-02-08 02:07:12,"tidyversetweets","Converting Nested Queries into Individual Queries #tidyverse #rstats https://t.co/fzQMTHlYJv",0,1
"x935569091678691328","x1491217554496536579",2022-02-09 01:09:05,"tidyversetweets","How to make line align with points in R ggplot via facet_wrap and multiple groups? #tidyverse #rstats https://t.co/BMMlDz9ejq",1,1
"x935569091678691328","x1491174365764935680",2022-02-08 22:17:28,"tidyversetweets","2D summary plot with counts as labels #tidyverse #rstats https://t.co/c3T15NcfIf",0,1
"x935569091678691328","x1491154764905816068",2022-02-08 20:59:34,"tidyversetweets","dplyr solution: absolute difference of two values in one column matched by other column #tidyverse #rstats https://t.co/inIIkZj0ci",2,2
"x935569091678691328","x1491073504753635334",2022-02-08 15:36:40,"tidyversetweets","Comparing dates across different data frames and return output #tidyverse #rstats https://t.co/BeEVqbzGk5",0,1
"x935569091678691328","x1491152091112484870",2022-02-08 20:48:57,"tidyversetweets","R Markdown output #tidyverse #rstats https://t.co/ggnugfT9ww",0,1
"x935569091678691328","x1491040625743040515",2022-02-08 13:26:02,"tidyversetweets","How to conditionally count the number of occurrences using dplyr? #tidyverse #rstats https://t.co/U3U9mvPuT5",0,1
"x935569091678691328","x1491121550438932490",2022-02-08 18:47:35,"tidyversetweets","DBConnect to open SQLite in read-only mode in R #tidyverse #rstats https://t.co/z6X3x3UK3Q",1,2
"x935569091678691328","x1490854854801121284",2022-02-08 01:07:50,"tidyversetweets","Simple question on piping #tidyverse #rstats https://t.co/MGSMnCXJmB",0,1
"x935569091678691328","x1491190112595726350",2022-02-08 23:20:02,"tidyversetweets","Performing pivot_longer() over multiple sets of columns #tidyverse #rstats https://t.co/YQK1vCU16Q",1,1
"x935569091678691328","x1491137158194814980",2022-02-08 19:49:37,"tidyversetweets","Tabulate based on number of times ID occurs AND another column value R #tidyverse #rstats https://t.co/Wfcj193V0Z",0,1
"x935569091678691328","x1490917447880388608",2022-02-08 05:16:34,"tidyversetweets","How to overlay two scatter plots (two points) from the same individuals? #tidyverse #rstats https://t.co/44XXSwMvnH",0,1
"x935569091678691328","x1490940022480068613",2022-02-08 06:46:16,"tidyversetweets","How can I do ggplot after importing the data from FRED by quantmod? #tidyverse #rstats https://t.co/fTXpXZ8YuT",0,1
"x935569091678691328","x1490997997588594688",2022-02-08 10:36:38,"tidyversetweets","Align dataframe columns according to row values #tidyverse #rstats https://t.co/V8rHh3qRBo",0,1
"x935569091678691328","x1491087310531674115",2022-02-08 16:31:32,"tidyversetweets","Use map with nested lists #tidyverse #rstats https://t.co/WTPddSykqF",0,1
"x935569091678691328","x1490903985896792071",2022-02-08 04:23:04,"tidyversetweets","can not have consistent point size in geom_size (in ggplot) #tidyverse #rstats https://t.co/z6TUBRevZL",1,1
"x935569091678691328","x1491114750066900999",2022-02-08 18:20:34,"tidyversetweets","Using Purr and Map to extract information from grouped data #tidyverse #rstats https://t.co/UDtedsB4pl",1,1
"x935569091678691328","x1490988233794232325",2022-02-08 09:57:50,"tidyversetweets","Open a text file containing a table with no clear separator #tidyverse #rstats https://t.co/9h7CI9gLdN",0,1
"x935569091678691328","x1490997996951154696",2022-02-08 10:36:38,"tidyversetweets","In R , is there any avaiable funcation like IFERROR formula in EXCEL #tidyverse #rstats https://t.co/xAJXF84wu7",0,1
"x935569091678691328","x1491190111027011584",2022-02-08 23:20:02,"tidyversetweets","ggplotly removes legend superscript and caption in R #tidyverse #rstats https://t.co/LyTXHI8UUc",0,1
"x935569091678691328","x1491087311370866690",2022-02-08 16:31:32,"tidyversetweets","Multiple HTML page file as shiny HTML Template #tidyverse #rstats https://t.co/2BHEPTya9z",0,1
"x935569091678691328","x1490940023172366337",2022-02-08 06:46:16,"tidyversetweets","Toggle all trace on/off in ggplotly() #tidyverse #rstats https://t.co/oePaUEf9mr",0,1
"x935569091678691328","x1490953707286327296",2022-02-08 07:40:39,"tidyversetweets","observe(), observeEvent(), and updateSelectizeInput() #tidyverse #rstats https://t.co/POD8tCYo7C",0,1
"x935569091678691328","x1490878211575721984",2022-02-08 02:40:39,"tidyversetweets","Line annotation from data on ggplotly object #tidyverse #rstats https://t.co/WI3YF6A9zQ",1,1
"x935569091678691328","x1490953706526892038",2022-02-08 07:40:38,"tidyversetweets","How to add y bar in ggplot2() annotate? #tidyverse #rstats https://t.co/xIVhEVsOQt",1,1
"x935569091678691328","x1490854855417769990",2022-02-08 01:07:50,"tidyversetweets","Understanding 'lib' vs. 'destdir' in 'install.packages()' #tidyverse #rstats https://t.co/aY6g8tmSzI",1,1
"x935569091678691328","x1491131545326866433",2022-02-08 19:27:18,"tidyversetweets","dplyr: How to rearrange this dataframe and create new columns by extracting parts of other columns #tidyverse #rstats https://t.co/S0QymNjdYh",3,1
"x935569091678691328","x1491100002109861891",2022-02-08 17:21:58,"tidyversetweets","ggspatial: geom_sf fails with certain xlim values in coord_sf #tidyverse #rstats https://t.co/3wq4PWdzBa",1,1
"x935569091678691328","x1491028271693287426",2022-02-08 12:36:56,"tidyversetweets","Determining duration between lead/lag datetime stamps by group in R #tidyverse #rstats https://t.co/xGLvtsDNzC",0,1
"x935569091678691328","x1491169345829056532",2022-02-08 21:57:31,"tidyversetweets","Error in -title : invalid argument to unary operator #tidyverse #rstats https://t.co/iOkIihtXgq",0,1
"x935569091678691328","x1491131545997950981",2022-02-08 19:27:19,"tidyversetweets","Fastest way of numbering instances of a value within a vector #tidyverse #rstats https://t.co/eTgdLulPOC",0,1
"x960807860752990208","x1491217430991220736",2022-02-09 01:08:35,"ValaviRoozbeh","@OliverDalby1 Add this here for the records, but I'll send you the code in DM. This is just a function extracting the fold IDs with purrr package in #RStats https://t.co/W6tm7Drkqn",1,1
"x492415178","x1491217387957649409",2022-02-09 01:08:25,"BHarrap","Currently writing up my first PhD paper and so far half of my reference list is #rstats packages!

Gotta cite your packages people 📃",3,1
"x1398323356324319233","x1491217236732035074",2022-02-09 01:07:49,"pachadotdev","I can't tweet much these days, so here is a reminder that if you need scalable RStudio in the cloud, @digitalocean offers a very simple 1-click setup (https://t.co/5GlZxbT7vo). 
Link for free credits: https://t.co/byalNmeCAn
#RStats #CloudComputing",0,2
"x760411020","x1491215976628879360",2022-02-09 01:02:48,"amgarcia4","8 hour #RStats workshop hurt my brain, but ya girl needs to learn that stuff ASAP. https://t.co/YFJ4tLWO4V",0,2
"x233585808","x1491125229573353482",2022-02-08 19:02:13,"CRANberriesFeed","CRAN updates: firebase rscorecard taxonbridge #rstats",1,2
"x233585808","x1490898726663213057",2022-02-08 04:02:10,"CRANberriesFeed","CRAN updates: fabisearch #rstats",0,1
"x233585808","x1491004427976724483",2022-02-08 11:02:11,"CRANberriesFeed","New CRAN package PPLasso with initial version 1.0 #rstats",0,1
"x233585808","x1491095055620268039",2022-02-08 17:02:19,"CRANberriesFeed","New CRAN package PHclust with initial version 0.1.0 #rstats",0,1
"x233585808","x1491004453029298176",2022-02-08 11:02:17,"CRANberriesFeed","CRAN updates: hhsmm nflverse worldfootballR #rstats",0,1
"x233585808","x1491200718832910339",2022-02-09 00:02:11,"CRANberriesFeed","CRAN updates: nlraa #rstats",1,2
"x233585808","x1491095048049639432",2022-02-08 17:02:17,"CRANberriesFeed","New CRAN package NegativeControlOutcomeAdjustment with initial version 0.0.4 #rstats",1,2
"x233585808","x1491004402169257984",2022-02-08 11:02:05,"CRANberriesFeed","New CRAN package EMMIXSSL with initial version 1.1.0 #rstats",1,2
"x233585808","x1490959109709078529",2022-02-08 08:02:07,"CRANberriesFeed","New CRAN package biglasso with initial version 1.5.0 #rstats",0,1
"x233585808","x1491110118238343174",2022-02-08 18:02:10,"CRANberriesFeed","CRAN updates: GDPuc #rstats",1,2
"x233585808","x1491215826028015625",2022-02-09 01:02:13,"CRANberriesFeed","CRAN updates: magic rmutil RNeXML #rstats",1,2
"x233585808","x1491095072774971403",2022-02-08 17:02:23,"CRANberriesFeed","New CRAN package RMCC with initial version 0.1.0 #rstats",0,1
"x233585808","x1491155413320052736",2022-02-08 21:02:09,"CRANberriesFeed","CRAN updates: rSAFE #rstats",1,2
"x233585808","x1491094998623965197",2022-02-08 17:02:05,"CRANberriesFeed","New CRAN package amerifluxr with initial version 1.0.0 #rstats",1,2
"x233585808","x1490974217797619712",2022-02-08 09:02:09,"CRANberriesFeed","New CRAN package mstclustering with initial version 1.0.0.0 #rstats",0,1
"x233585808","x1491170521924390913",2022-02-08 22:02:11,"CRANberriesFeed","CRAN updates: MCMCvis #rstats",1,2
"x233585808","x1491095027145388036",2022-02-08 17:02:12,"CRANberriesFeed","New CRAN package elfgen with initial version 2.2.3 #rstats",0,1
"x233585808","x1490959097675628546",2022-02-08 08:02:04,"CRANberriesFeed","CRAN removals: bootsPLS #rstats",0,1
"x233585808","x1491049733951000578",2022-02-08 14:02:13,"CRANberriesFeed","CRAN updates: minidown riem spant #rstats",1,2
"x233585808","x1491095087232737281",2022-02-08 17:02:26,"CRANberriesFeed","CRAN updates: RCurl tLagPropOdds #rstats",1,2
"x233585808","x1490989334559961088",2022-02-08 10:02:13,"CRANberriesFeed","CRAN updates: dplyr RFLPtools RTTWebClient #rstats",2,3
"x233585808","x1491079953374453770",2022-02-08 16:02:18,"CRANberriesFeed","New CRAN package DIZtools with initial version 0.0.2 #rstats",0,1
"x233585808","x1491080023570370563",2022-02-08 16:02:35,"CRANberriesFeed","CRAN updates: av bioacoustics CHNOSZ flightsbr jomo lowpassFilter rgbif saemix treeclim #rstats",1,2
"x233585808","x1490838332091338753",2022-02-08 00:02:11,"CRANberriesFeed","CRAN updates: glmm.hp iNZightRegression #rstats",1,2
"x233585808","x1490974206510743555",2022-02-08 09:02:06,"CRANberriesFeed","New CRAN package hypsoLoop with initial version 0.2.0 #rstats",0,1
"x233585808","x1491004438844219393",2022-02-08 11:02:14,"CRANberriesFeed","New CRAN package shrink with initial version 1.2.2 #rstats",1,2
"x233585808","x1491079907564298244",2022-02-08 16:02:07,"CRANberriesFeed","New CRAN package bigDM with initial version 0.4.1 #rstats",1,2
"x233585808","x1491095016483209222",2022-02-08 17:02:09,"CRANberriesFeed","New CRAN package aum with initial version 2022.2.7 #rstats",1,2
"x233585808","x1490959180181782530",2022-02-08 08:02:23,"CRANberriesFeed","CRAN updates: AtmChile cancensus FastJM fst glmtrans IxPopDyMod PTSR Rrdap #rstats",0,1
"x233585808","x1491079925905997824",2022-02-08 16:02:11,"CRANberriesFeed","New CRAN package BwQuant with initial version 0.1.0 #rstats",0,1
"x233585808","x1491079942192476160",2022-02-08 16:02:15,"CRANberriesFeed","New CRAN package cryptoverse with initial version 0.1.0 #rstats",1,2
"x233585808","x1490853423171973121",2022-02-08 01:02:09,"CRANberriesFeed","CRAN updates: AdMit #rstats",0,1
"x233585808","x1491079987750965248",2022-02-08 16:02:26,"CRANberriesFeed","New CRAN package pomdpSolve with initial version 1.0.0 #rstats",1,2
"x233585808","x1491064818383704064",2022-02-08 15:02:10,"CRANberriesFeed","CRAN updates: sandwichr #rstats",1,2
"x233585808","x1491185614867345410",2022-02-08 23:02:10,"CRANberriesFeed","CRAN updates: katex #rstats",0,1
"x233585808","x1491095007230578690",2022-02-08 17:02:07,"CRANberriesFeed","New CRAN package ammiBayes with initial version 1.0-0 #rstats",2,2
"x233585808","x1491095037786136577",2022-02-08 17:02:14,"CRANberriesFeed","New CRAN package itscalledsoccer with initial version 0.1.0 #rstats",1,2
"x1327925920624087040","x1490863450800721923",2022-02-08 01:42:00,"EasternStyle1","Sci-fi robot.(2) #Analytics #MachineLearning #AI #Python #Rstats #Reactjs #IoT #IIoT #Linux #Serverless #flutter #ML #javascript #TensorFlow #BigData #CloudComputing #SDGs #SmartCities #Cloud #SmartHome #5G #Robotics #100DaysOfCode https://t.co/jSfHcPh5cL",3,9
"x1327925920624087040","x1490860179067486209",2022-02-08 01:29:00,"EasternStyle1","Cylinder balancer.#Programming #IoT #AI #100DaysOfCode #MachineLearning #ML #Airdrop #Python #CloudComputing #Analytics #Serverless #womenwhocode #cybersecurity #CodeNewbie #DataScience #5G #RTXOn #RStats https://t.co/MJdlo7mHhR",3,12
"x1327925920624087040","x1491193123187269637",2022-02-08 23:32:00,"EasternStyle1","To change life by Technology.#Programming #IoT #AI #100DaysOfCode #MachineLearning #ML #Airdrop #Python #CloudComputing #Analytics #Serverless #womenwhocode #cybersecurity #CodeNewbie #DataScience #5G #RTXOn #RStats https://t.co/b8Xum0iFKY",4,3
"x1327925920624087040","x1491208977698283525",2022-02-09 00:35:00,"EasternStyle1","Sci-fi robot.(1)#Programming #IoT #AI #100DaysOfCode #MachineLearning #ML #Airdrop #Python #CloudComputing #Analytics #Serverless #womenwhocode #cybersecurity #CodeNewbie #DataScience #5G #RTXOn #RStats https://t.co/B3OCeLDzn2",5,5
"x1327925920624087040","x1490844576508043271",2022-02-08 00:27:00,"EasternStyle1","Spherical robot.#Programming #IoT #AI #100DaysOfCode #MachineLearning #ML #Airdrop #Python #CloudComputing #Analytics #Serverless #womenwhocode #cybersecurity #CodeNewbie #DataScience #5G #RTXOn #RStats https://t.co/mzcKgpeIyd",23,23
"x307012324","x1490845583120101376",2022-02-08 00:31:00,"brshallo","I used to say ""I apply this function across observations"" but now say ""I apply this function on all observations"" so as to avoid confusion with #rstats #tidyverse dplyr::across() and to make clear I'm doing a row-wise rather than column-wise operation.",7,3
"x307012324","x1491206460935749633",2022-02-09 00:25:00,"brshallo","See new post where I parse the functions &amp; packages in my gists: https://t.co/tKgzQSAxzV #rstats

Using extract_code_md() (for those rare cases you want to extract code from .md files):
``` r
&lt;code&gt;
```
eg reprexes, README's (when .Rmd isn't available so knitr::purll won't work). https://t.co/bqZx6uO4oB",1,2
"x68583134","x1491203223096414210",2022-02-09 00:12:08,"jhollist","Lake/Geospatial people...  Anyone know of a cross-walk between the various US lake/reservoir identifiers?  Something to crosswalk IDs from NHDPlus COMIDs, National Inventory Of Dams, National Lakes Assessments, LAGOS, etc.  #limnology #hyrdology #rstats #geospatial",1,3
"x20731596","x1491203059120488450",2022-02-09 00:11:29,"jasemurphy","I put all my grocery purchases into #rstats. This is my favourite chart so far!  Having a baby  -&gt; eating chocolate https://t.co/KvIAGDEvnO",9,2
"x874743751","x1491201011595165699",2022-02-09 00:03:20,"KellyBodwin","I made a handy #rstats-to-#python translation guide:

S3 Method:
🔵"".""
🐍 "".""

Pipe: 
🔵""%&gt;%""
🐍 "".""

Accessor:
🔵""$""
🐍 "".""

Library specifier:
🔵""::""
🐍 "".""

Seriously python there is other punctuation on your keyboard. 😡",65,8
"x120629514","x1491199289611395072",2022-02-08 23:56:30,"Atsushi776","backpipe enables decorator on R #rstats
backpipe使えばRでも簡単にデコレータを実現できるね。

library(backpipe)
library(magrittr)

add_msg = function(f, msg) {
  function(...) {
    message(msg)  
    f(...)
  }
}

add = add_msg(""Sum is ..."") %&lt;%
  function(x, y) x + y
add(1, 1) https://t.co/PNTwDsGLbX",4,2
"x1488738031217651712","x1491198990108352516",2022-02-08 23:55:19,"Bodak_Tools","Machine Learning A-Z™: Hands-On Python &amp; R In Data Science https://t.co/46NpvEyCnB

#MachineLearning. #BigData #Analytics #DataScience #AI #IoT #IIoT #Python #RStats #TensorFlow #Java #JavaScript #ReactJS #CloudComputing #DataScientist #Linux #Programming #Coding #100DaysofCode",7,18
"x24858833","x1491198730275811328",2022-02-08 23:54:17,"DavidRickmann","I got a little obsessed with ""Around the World in 80 Days"" and discovered that there wasn't a nice detailed dataset charting the route described in the book. 

So I made one.
#RStats https://t.co/wF6cJHGd1i",51,17
"x29983351","x1491193840774135810",2022-02-08 23:34:51,"robertodepinho","Share of Population Vaccinated against Covid-19 by country

Data: @OurWorldInData

#rstats (1/2)

Info on estimates &amp; online dashboards: https://t.co/2TcIAe6cfe https://t.co/WBbexaWx6E",1,2
"x29983351","x1491192908480929796",2022-02-08 23:31:09,"robertodepinho","Porcentaje de población vacunada contra Covid-19 por país

Data:@OurWorldInData

 #rstats (1/2)

Información sobre estimaciones y paneles en línea: https://t.co/2TcIAe6cfe https://t.co/degUNtW8BQ",0,2
"x29983351","x1491193609684717571",2022-02-08 23:33:56,"robertodepinho","Porcentaje de población vacunada contra Covid-19 por país

Data:@OurWorldInData

 #rstats (2/2)

Información sobre estimaciones y paneles en línea: https://t.co/2TcIAe6cfe https://t.co/7T9vhedv1j",1,1
