"user_id","status_id","created_at","screen_name","text","favorite_count","retweet_count"
"x1166319354989989890","x1403521431447683072",2021-06-12 01:16:00,"MR_ANONWOLF","#internet of Things (IoT) Fundamentals Certification Training - Overview
#DarkWeb #Anonymity  #Security #blockchain #tech4all
 #BigData #DataScience #AI #MachineLearning #IoT #IIoT #Python #RStats  #JavaScript #ReactJS #TensorFlow #CloudComputing #Linux #OSINT #warez #data #BTC https://t.co/Di6FyfY4pQ",3,5
"x1166319354989989890","x1403455875394818050",2021-06-11 20:55:30,"MR_ANONWOLF","#internet of Things (IoT) Fundamentals Certification Training - Overview
#DarkWeb #Anonymity  #Security #blockchain #tech4all
 #BigData #DataScience #AI #MachineLearning #IoT #IIoT #Python #RStats  #JavaScript #ReactJS #TensorFlow #CloudComputing #Linux #OSINT #warez #data #BTC https://t.co/Zq2b0iOkhK",4,8
"x1166319354989989890","x1403451238361055238",2021-06-11 20:37:04,"MR_ANONWOLF","#internet of Things (IoT) Fundamentals Certification Training - Overview
#DarkWeb #Anonymity  #Security #blockchain #tech4all
 #BigData #DataScience #AI #MachineLearning #IoT #IIoT #Python #RStats  #JavaScript #ReactJS #TensorFlow #CloudComputing #Linux #OSINT #warez #data #BTC https://t.co/G319jHFSqb",5,18
"x1166319354989989890","x1403487849467555845",2021-06-11 23:02:33,"MR_ANONWOLF","#internet of Things (IoT) Fundamentals Certification Training - Overview
#DarkWeb #Anonymity  #Security #blockchain #tech4all
 #BigData #DataScience #AI #MachineLearning #IoT #IIoT #Python #RStats  #JavaScript #ReactJS #TensorFlow #CloudComputing #Linux #OSINT #warez #data #BTC https://t.co/kUm7CQwbIH",5,13
"x1166319354989989890","x1403448267707498505",2021-06-11 20:25:16,"MR_ANONWOLF","#internet of Things (IoT) Fundamentals Certification Training - Overview
#DarkWeb #Anonymity  #Security #blockchain #tech4all
 #BigData #DataScience #AI #MachineLearning #IoT #IIoT #Python #RStats  #JavaScript #ReactJS #TensorFlow #CloudComputing #Linux #OSINT #warez #data #BTC https://t.co/jCejKJPLbs",5,11
"x1166319354989989890","x1403450056099909632",2021-06-11 20:32:22,"MR_ANONWOLF","#internet of Things (IoT) Fundamentals Certification Training - Overview
#DarkWeb #Anonymity  #Security #blockchain #tech4all
 #BigData #DataScience #AI #MachineLearning #IoT #IIoT #Python #RStats  #JavaScript #ReactJS #TensorFlow #CloudComputing #Linux #OSINT #warez #data #BTC https://t.co/1hkkg6hE6Z",4,9
"x935569091678691328","x1403246551749652484",2021-06-11 07:03:43,"tidyversetweets","Sort by numbers in R before printing as barchart with ggplot2 #tidyverse #rstats https://t.co/ljkeNcXe28",1,2
"x935569091678691328","x1403241483667390466",2021-06-11 06:43:35,"tidyversetweets","Changing POSICXT x-axis to selected labels #tidyverse #rstats https://t.co/bPpJelWGys",1,2
"x935569091678691328","x1403199648257515521",2021-06-11 03:57:20,"tidyversetweets","Unable to get the effect of align_text_col in fle #tidyverse #rstats https://t.co/Rba8uWceGJ",1,2
"x935569091678691328","x1403321354019954691",2021-06-11 12:00:57,"tidyversetweets","Visual markdown editor formatting (support semantic line breaks) #tidyverse #rstats https://t.co/OEuBBfEsDB",1,2
"x935569091678691328","x1403397861698588679",2021-06-11 17:04:58,"tidyversetweets","All possible combinations in a vector #tidyverse #rstats https://t.co/5AJuRz4AO8",1,2
"x935569091678691328","x1403319243878375424",2021-06-11 11:52:34,"tidyversetweets","Replace all fields in a TSV file based on a TSV conversion table #tidyverse #rstats https://t.co/zKndKaZooH",1,2
"x935569091678691328","x1403519381741531136",2021-06-12 01:07:51,"tidyversetweets","Creating new variable by selecting column based on value of another column #tidyverse #rstats https://t.co/VQDMZTudm8",0,1
"x935569091678691328","x1403466187804090370",2021-06-11 21:36:28,"tidyversetweets","How do I use %*% to multiply two vectors in order to produce a matrix? #tidyverse #rstats https://t.co/EAaHUylEvF",1,2
"x935569091678691328","x1403358338864275461",2021-06-11 14:27:55,"tidyversetweets","Conditionally Rollmean based on another column value #tidyverse #rstats https://t.co/8dHuS5hU4u",0,1
"x935569091678691328","x1403358338264481795",2021-06-11 14:27:55,"tidyversetweets","Is there a way to use mutate inside of ones own function? #tidyverse #rstats https://t.co/CqERp3lj6k",2,2
"x935569091678691328","x1403311645493972997",2021-06-11 11:22:23,"tidyversetweets","Is there a way or alternative function to have a vectorized str_detect() in R? #tidyverse #rstats https://t.co/DeWeTbZL4D",1,2
"x935569091678691328","x1403241484845989892",2021-06-11 06:43:35,"tidyversetweets","How to make 3D PCA in R using? #tidyverse #rstats https://t.co/nt4Crfc4xv",1,2
"x935569091678691328","x1403241484330098689",2021-06-11 06:43:35,"tidyversetweets","Machine learning with sparse features + missing data #tidyverse #rstats https://t.co/9xGkmnJsv6",2,4
"x935569091678691328","x1403412260135981058",2021-06-11 18:02:11,"tidyversetweets","navbar in R flexdashboard cuts off main content #tidyverse #rstats https://t.co/PdliG9C3pb",1,2
"x935569091678691328","x1403321354577874956",2021-06-11 12:00:58,"tidyversetweets","dplyr: How to calculate frequency of different values within each group #tidyverse #rstats https://t.co/Gk83yfpiYi",3,2
"x935569091678691328","x1403456733180215303",2021-06-11 20:58:54,"tidyversetweets","How to make funnel chart with bars in R ggplot2? #tidyverse #rstats https://t.co/HdssDA5Gmy",1,2
"x935569091678691328","x1403306123571175424",2021-06-11 11:00:26,"tidyversetweets","Reorder in ggplot2 with multiple variables #tidyverse #rstats https://t.co/f4T2khMEkq",1,2
"x935569091678691328","x1403397860775890947",2021-06-11 17:04:58,"tidyversetweets","Convert txt file to vector #tidyverse #rstats https://t.co/d320RTMIGY",1,2
"x935569091678691328","x1403497755222241280",2021-06-11 23:41:55,"tidyversetweets","Plot multiple series where each series have a distinct line type and specific part of each series colored differently using ggplot2 #tidyverse #rstats https://t.co/59ptXYHnRF",0,1
"x935569091678691328","x1403412261083828226",2021-06-11 18:02:11,"tidyversetweets","R How to Generate Sequences in a Tibble Given Start and End Points #tidyverse #rstats https://t.co/XAEvpqPQKV",1,2
"x935569091678691328","x1403412260593172480",2021-06-11 18:02:11,"tidyversetweets","Get column name into pacf() plot title through map() in R #tidyverse #rstats https://t.co/KIWoXy9acI",1,2
"x935569091678691328","x1403485386509197313",2021-06-11 22:52:46,"tidyversetweets","Recoding character values that are only part of entire value #tidyverse #rstats https://t.co/jzN8rHCKXZ",0,1
"x935569091678691328","x1403412259611680769",2021-06-11 18:02:11,"tidyversetweets","Preserving non-breaking space in HTML output of knitr-ed rmarkdown #tidyverse #rstats https://t.co/ie0CF76aZK",1,2
"x935569091678691328","x1403407130649104386",2021-06-11 17:41:48,"tidyversetweets","clean code inside of mutate = case_when in dplyr #tidyverse #rstats https://t.co/8fkdNLBtc2",1,2
"x935569091678691328","x1403407130057662469",2021-06-11 17:41:48,"tidyversetweets","Count and filter in R #tidyverse #rstats https://t.co/fpNsR0VW0i",1,2
"x935569091678691328","x1403373763035635719",2021-06-11 15:29:13,"tidyversetweets","Sample within a group multiple times in r using dplyr #tidyverse #rstats https://t.co/b1v7cQOyhb",1,2
"x935569091678691328","x1403397861283401736",2021-06-11 17:04:58,"tidyversetweets","Mirror two PheWAS plots with ggplot2 #tidyverse #rstats https://t.co/DlSRhSF4CH",1,2
"x935569091678691328","x1403358339858407427",2021-06-11 14:27:56,"tidyversetweets","Merge and mutate in list of data frames #tidyverse #rstats https://t.co/xVwB7oybSZ",0,1
"x935569091678691328","x1403358339355004929",2021-06-11 14:27:55,"tidyversetweets","Turn the first row into a column #tidyverse #rstats https://t.co/z8jXxa2zbf",0,1
"x935569091678691328","x1403353927119212549",2021-06-11 14:10:23,"tidyversetweets","Calendar Heatmap in R #tidyverse #rstats https://t.co/WsKebFme7V",1,2
"x935569091678691328","x1403366648044679185",2021-06-11 15:00:56,"tidyversetweets","I can't install any package please help me #tidyverse #rstats https://t.co/3HiKnGZ9CR",1,2
"x935569091678691328","x1403439283407446018",2021-06-11 19:49:34,"tidyversetweets","Factor not behaving within mutate statement as expected #tidyverse #rstats https://t.co/JILOQxjGB5",2,2
"x935569091678691328","x1403384666489462786",2021-06-11 16:12:32,"tidyversetweets","Does qplot with stat=identity argument exist in the syntax? Checked the documentation but couldn't find #tidyverse #rstats https://t.co/0aqXFPYpeV",0,1
"x935569091678691328","x1403384665956753408",2021-06-11 16:12:32,"tidyversetweets","Merge lists with a dataframe and regress the lists in R #tidyverse #rstats https://t.co/M0aRDeEn64",1,2
"x935569091678691328","x1403384665449275404",2021-06-11 16:12:32,"tidyversetweets","Dangers of mixing [tidyverse] and [data.table] syntax in R? #tidyverse #rstats https://t.co/BhgOIUTq0d",0,1
"x935569091678691328","x1403397862667472897",2021-06-11 17:04:58,"tidyversetweets","Adding median value and superscript characters in a survival curve in R #tidyverse #rstats https://t.co/MulkbgvhQy",1,2
"x935569091678691328","x1403397862155751425",2021-06-11 17:04:58,"tidyversetweets","plotly click events (without shiny, in console) #tidyverse #rstats https://t.co/SgobZYHzgP",1,2
"x935569091678691328","x1403432244899848192",2021-06-11 19:21:36,"tidyversetweets","Change the representation of the graph #tidyverse #rstats https://t.co/9Vd0OA0H5l",1,2
"x935569091678691328","x1403338857689587715",2021-06-11 13:10:31,"tidyversetweets","ggplot2 change the color of a confidence interval band? #tidyverse #rstats https://t.co/QMCtOUv9xc",2,3
"x935569091678691328","x1403281415714787330",2021-06-11 09:22:15,"tidyversetweets","Tibble to dataframe #tidyverse #rstats https://t.co/XHTUZWVUdi",1,2
"x935569091678691328","x1403311646148268033",2021-06-11 11:22:23,"tidyversetweets","Incorrect date axis labels #tidyverse #rstats https://t.co/8vSHOrSLKF",1,2
"x935569091678691328","x1403286054057111552",2021-06-11 09:40:41,"tidyversetweets","Interactive rubber-band line on background graphics #tidyverse #rstats https://t.co/W3AprZwFSU",0,1
"x935569091678691328","x1403286053604057088",2021-06-11 09:40:41,"tidyversetweets","Rmarkdown Preamble: custom inputs? #tidyverse #rstats https://t.co/MxlSE6M79S",1,2
"x935569091678691328","x1403286053113319424",2021-06-11 09:40:41,"tidyversetweets","! Undefined control sequence. \tightlist #tidyverse #rstats https://t.co/muQqZCqJLx",1,2
"x935569091678691328","x1403286052639367173",2021-06-11 09:40:41,"tidyversetweets","Color histogram bars using stat_bin ggplot #tidyverse #rstats https://t.co/zWCWTbuuug",1,2
"x935569091678691328","x1403426765998071811",2021-06-11 18:59:50,"tidyversetweets","Calculate frequency of values spread across multiple columns in R #tidyverse #rstats https://t.co/CqEbT0lZEN",1,2
"x935569091678691328","x1403426765498990597",2021-06-11 18:59:49,"tidyversetweets","R: Using ""group_by"" with ""nls()"" #tidyverse #rstats https://t.co/7Qb6ad21VQ",1,2
"x935569091678691328","x1403257302858178560",2021-06-11 07:46:26,"tidyversetweets","Air-gapped env- Installing R package source vs binaries #tidyverse #rstats https://t.co/ih6XrfPyHV",1,2
"x935569091678691328","x1403426764458692616",2021-06-11 18:59:49,"tidyversetweets","Adding to a row based upon values from another variable #tidyverse #rstats https://t.co/JnRgM8znnz",1,2
"x935569091678691328","x1403330706764308485",2021-06-11 12:38:07,"tidyversetweets","Fill color of shifted density plot #tidyverse #rstats https://t.co/CkmL6MNAGa",1,2
"x935569091678691328","x1403353928343900167",2021-06-11 14:10:24,"tidyversetweets","Arrange multiple columns with characters by frequency using fct_infreq() #tidyverse #rstats https://t.co/bYaDK4loMA",0,1
"x935569091678691328","x1403268293901918211",2021-06-11 08:30:07,"tidyversetweets","Replace parts of text values with a lookup table? #tidyverse #rstats https://t.co/VHXZV00iWv",1,2
"x935569091678691328","x1403407132272336901",2021-06-11 17:41:49,"tidyversetweets","Create a raster with ggplot output without projection distortion #tidyverse #rstats https://t.co/MgeiI84xfI",2,2
"x935569091678691328","x1403346829539004420",2021-06-11 13:42:11,"tidyversetweets","Can we access a SharePoint file securely via ShinyApps #tidyverse #rstats https://t.co/H33DF9uwuC",1,2
"x935569091678691328","x1403485385972281348",2021-06-11 22:52:46,"tidyversetweets","Merging Quarterly and Monthly Financial Data #tidyverse #rstats https://t.co/tRSgps4UlS",0,1
"x935569091678691328","x1403373764142895111",2021-06-11 15:29:13,"tidyversetweets","tidyverse replace NA by other data frame values under condition #tidyverse #rstats https://t.co/XmU9DA4g7R",1,2
"x935569091678691328","x1403373763685670922",2021-06-11 15:29:13,"tidyversetweets","confusion matrix plot #tidyverse #rstats https://t.co/2AdVL5EN35",2,2
"x935569091678691328","x1403298997838569477",2021-06-11 10:32:07,"tidyversetweets","How to make selectInput choices react to other conditions? #tidyverse #rstats https://t.co/CASPFWOJPu",1,2
"x935569091678691328","x1403338858356482048",2021-06-11 13:10:31,"tidyversetweets","Why does layout of df changes when rendering Rmarkdown file from within function using a vector? #tidyverse #rstats https://t.co/DeUpOflYvF",1,2
"x935569091678691328","x1403193794401611776",2021-06-11 03:34:05,"tidyversetweets","How to 0 to a value near zero, such as 1e-10? #tidyverse #rstats https://t.co/2rHFxuk428",1,2
"x935569091678691328","x1403176556575420422",2021-06-11 02:25:35,"tidyversetweets","Is there a way to pass a single yaml params list to several different rmd documents at once? #tidyverse #rstats https://t.co/RupDPHnhrn",2,2
"x935569091678691328","x1403330706130935810",2021-06-11 12:38:07,"tidyversetweets","Why do ""Joining, by ="" messages bleed through in Rmarkdown code blocks despite using warning=FALSE? Should I report as a bug? #tidyverse #rstats https://t.co/u6vyZ7P8i1",1,2
"x935569091678691328","x1403353927748308995",2021-06-11 14:10:24,"tidyversetweets","ggplot multiple binary variables, grouped by another binary varaible #tidyverse #rstats https://t.co/5KloThLOp9",0,1
"x935569091678691328","x1403199648894959620",2021-06-11 03:57:21,"tidyversetweets","The dplyr inner_join doesn't work in R, why? #tidyverse #rstats https://t.co/z6iPC1LS2e",1,2
"x935569091678691328","x1403426767998758914",2021-06-11 18:59:50,"tidyversetweets","Shinyapps - how to display images (&gt;10mb) without getting out of memory? #tidyverse #rstats https://t.co/WJ6ENJo3vz",1,2
"x935569091678691328","x1403426766992064515",2021-06-11 18:59:50,"tidyversetweets","Extracting a list of links from a webpage by using its class #tidyverse #rstats https://t.co/tLYnUlYsqx",1,2
"x935569091678691328","x1403432245868699650",2021-06-11 19:21:36,"tidyversetweets","How to force trailing zeroes in 'polynom::polynomial' object? (specifically to modify behavior of stat_lm and stat_regline_equation from ggpubr) #tidyverse #rstats https://t.co/3xmJVbTNXI",1,2
"x935569091678691328","x1403432245419937795",2021-06-11 19:21:36,"tidyversetweets","The setFunction in R.matlab library isn't executing properly? #tidyverse #rstats https://t.co/58OzLNNCp3",1,2
"x935569091678691328","x1403426765016551426",2021-06-11 18:59:49,"tidyversetweets","ggplot_shiny() function from ggplotgui package #tidyverse #rstats https://t.co/wB4LNa0ClM",1,2
"x935569091678691328","x1403159132262342661",2021-06-11 01:16:21,"tidyversetweets","How to narrow down data frame in R #tidyverse #rstats https://t.co/vPkVFRtRAB",1,2
"x935569091678691328","x1403304276429049857",2021-06-11 10:53:06,"tidyversetweets","Multivariate imputing missing values in weather data #tidyverse #rstats https://t.co/Vm2sE2PYeM",3,3
"x935569091678691328","x1403289348959662080",2021-06-11 09:53:47,"tidyversetweets","Converting whole R Markdown chunk to function with one variable #tidyverse #rstats https://t.co/RS57bCfVTE",0,1
"x935569091678691328","x1403426766488805382",2021-06-11 18:59:50,"tidyversetweets","Error: Can't subset columns that don't exist. x Column `month` doesn't exist #tidyverse #rstats https://t.co/2j9ppsomDC",1,2
"x935569091678691328","x1403426767495434248",2021-06-11 18:59:50,"tidyversetweets","Is there a way to create a range of sum of multiple columns matching a condition in R? #tidyverse #rstats https://t.co/3qLg5gCN7F",1,2
"x935569091678691328","x1403338858897588228",2021-06-11 13:10:31,"tidyversetweets","R Shiny - Execute code where we run code that is based on the input of the user #tidyverse #rstats https://t.co/5G5WGDxifN",1,2
"x935569091678691328","x1403330707221405704",2021-06-11 12:38:07,"tidyversetweets","add pvalue and odd ratio on a barplot #tidyverse #rstats https://t.co/wKCck5GFyO",0,1
"x935569091678691328","x1403397860213854209",2021-06-11 17:04:58,"tidyversetweets","How to plot boxplots at once when your x variable has more than 10 values #tidyverse #rstats https://t.co/0LK86PRGrt",1,2
"x935569091678691328","x1403407131219464193",2021-06-11 17:41:48,"tidyversetweets","Pivot_wider using multiple variables for publication table #tidyverse #rstats https://t.co/PN6AGRswd5",2,2
"x935569091678691328","x1403298998367096834",2021-06-11 10:32:07,"tidyversetweets","creating summary of subset filtered dataframe #tidyverse #rstats https://t.co/YUDAkFwMde",1,1
"x935569091678691328","x1403346830201602048",2021-06-11 13:42:11,"tidyversetweets","Unable to color axis labels based on condition using ggtext #tidyverse #rstats https://t.co/plHAD7YRHr",1,2
"x935569091678691328","x1403275287031287808",2021-06-11 08:57:54,"tidyversetweets","Add gradient color within groups in ggplot2 #tidyverse #rstats https://t.co/zxL0R6S956",0,1
"x935569091678691328","x1403349942215839749",2021-06-11 13:54:33,"tidyversetweets","Unable to scrape table in dynamic multitab website using rvest #tidyverse #rstats https://t.co/vPRC0KOcUc",1,2
"x935569091678691328","x1403253192843010056",2021-06-11 07:30:07,"tidyversetweets","R:: fill based on symbols like strokes, lines and dots instead of colours in ggplot #tidyverse #rstats https://t.co/JyqcVfaJv8",2,3
"x935569091678691328","x1403273375233937412",2021-06-11 08:50:18,"tidyversetweets","matching geom_point size to the geom_tile size #tidyverse #rstats https://t.co/dG10xVThK3",1,2
"x935569091678691328","x1403229301789528068",2021-06-11 05:55:10,"tidyversetweets","Plotting mean values using ggplot2 line? #tidyverse #rstats https://t.co/g5obvg2vQ4",1,2
"x935569091678691328","x1403298998820081668",2021-06-11 10:32:08,"tidyversetweets","How to provide multiple sizes for geom_point()? #tidyverse #rstats https://t.co/YHveJHCFLd",0,1
"x935569091678691328","x1403407131752251401",2021-06-11 17:41:48,"tidyversetweets","Render shiny in RMarkdown chunk #tidyverse #rstats https://t.co/HIAQJJhTYd",1,2
"x935569091678691328","x1403362478935789574",2021-06-11 14:44:22,"tidyversetweets","How to remove outliers in only one column after grouping by another column in R #tidyverse #rstats https://t.co/appFwoCPeN",0,1
"x4263007693","x1403163589746245633",2021-06-11 01:34:03,"gp_pulipaka","Line Search Optimization With #Python Code. #BigData #Analytics #DataScience #AI #MachineLearning #IoT #IIoT #RStats #TensorFlow #Java #JavaScript #ReactJS #GoLang #CloudComputing #Serverless #DataScientist #Linux #Programming #Coding #100DaysofCode 
https://t.co/jmPn7nRQJd https://t.co/ZXZSwfi7Ok",31,42
"x4263007693","x1403166861383155713",2021-06-11 01:47:03,"gp_pulipaka","GHOST: Handle Imbalanced Data in #MachineLearning. #BigData #Analytics #DataScience #AI #IoT #IIoT #PyTorch #Python #RStats #TensorFlow #Java #JavaScript #ReactJS #CloudComputing #Serverless #DataScientist #Linux #Programming #Coding #100DaysofCode 
https://t.co/fsyRm5sAqH https://t.co/dmJr88WdfC",15,33
"x4263007693","x1403517668397916161",2021-06-12 01:01:02,"gp_pulipaka","A Guide to the Field of Deep Learning. #BigData #Analytics #DataScience #AI #MachineLearning #IoT #IIoT #Python #RStats #TensorFlow #Java #JavaScript #ReactJS #GoLang #CloudComputing #Serverless #DataScientist #Linux #Programming #Coding #100DaysofCode 
https://t.co/j4A7YOb7gw https://t.co/nswI3GAnem",26,35
"x4263007693","x1403176812801363975",2021-06-11 02:26:36,"gp_pulipaka","TaxoNERD: Deep Neural Models for Taxonomic Entities. #BigData #Analytics #DataScience #AI #MachineLearning #NLProc #IoT #IIoT #Python #RStats #TensorFlow #JavaScript #ReactJS #CloudComputing #Serverless #Linux #Programming #Coding #100DaysofCode 
https://t.co/FlleYaQH72 https://t.co/xjDn8p8Rmv",15,22
"x4263007693","x1403164848939319297",2021-06-11 01:39:04,"gp_pulipaka","Best Data Science Books to Read. #BigData #Analytics #DataScience #Azure #SQL #IoT #IIoT #PyTorch #Python #RStats #TensorFlow #Java #JavaScript #ReactJS #GoLang #CloudComputing #Serverless #DataScientist #Linux #Books #Programming #Coding #100DaysofCode 
https://t.co/7jLR9qh1pQ https://t.co/Wh002VkgGT",52,64
"x4263007693","x1403356105728737284",2021-06-11 14:19:03,"gp_pulipaka","How to Build an AutoML App in #Python Code. #BigData #Analytics #DataScience #AI #MachineLearning #IoT #IIoT #RStats #TensorFlow #Java #JavaScript #ReactJS #GoLang #CloudComputing #Serverless #DataScientist #Linux #Programming #Coding #100DaysofCode 
https://t.co/OjlujbIdxS https://t.co/nfYWOxetL6",32,56
"x4263007693","x1403175416916066313",2021-06-11 02:21:03,"gp_pulipaka","Computational Evolution with #Robotics. #BigData #Analytics #DataScience #AI #MachineLearning #IoT #IIoT #PyTorch #Python #RStats #TensorFlow #Java #JavaScript #ReactJS #CloudComputing #Serverless #DataScientist #Linux #Programming #Coding #100DaysofCode 
https://t.co/neKfbfJpB0 https://t.co/1CHSmxd7JJ",36,61
"x4263007693","x1403183470059401218",2021-06-11 02:53:03,"gp_pulipaka","AI Best: Python Natural Language Processing. [+] #BigData #Analytics #DataScience #CPP #IoT #IIoT #Python #RStats #TensorFlow #Java #JavaScript #ReactJS #CloudComputing #Serverless #DataScientist #Linux #Books #Programming #Coding #100DaysofCode 
https://t.co/7jLR9qh1pQ https://t.co/GXJqPVnyQ7",19,33
"x4263007693","x1403359126810501126",2021-06-11 14:31:03,"gp_pulipaka","EDA Process and A Not So Common Visualization Tool for ML. #BigData #Analytics #DataScience #AI #MachineLearning #IoT #IIoT #RStats #TensorFlow #JavaScript #ReactJS #CloudComputing #Serverless #DataScientist #Linux #Programming #Coding #100DaysofCode
https://t.co/Wh332iioim https://t.co/S1cuqXyfaG",13,28
"x4263007693","x1403519181933498373",2021-06-12 01:07:03,"gp_pulipaka","Hyper-Parameter Tuning in Python Code. #BigData #Analytics #DataScience #AI #MachineLearning #IoT #IIoT #PyTorch #Python #RStats #TensorFlow #Java #JavaScript #ReactJS #CloudComputing #Serverless #DataScientist #Linux #Programming #Coding #100DaysofCode 
https://t.co/eXTHFcTiQg https://t.co/SEcyZksVyy",11,20
"x4263007693","x1403356611876462595",2021-06-11 14:21:04,"gp_pulipaka","Fully Explained P-Distribution with #Python Example. #BigData #Analytics #DataScience #AI #MachineLearning #IoT #IIoT #RStats #TensorFlow #JavaScript #ReactJS #CloudComputing #Serverless #DataScientist #Linux #Statistics #Programming #Coding #100DaysofCode
https://t.co/rTD6VWBVC0 https://t.co/SAoiSJD6I6",65,66
"x4263007693","x1403359883785871365",2021-06-11 14:34:04,"gp_pulipaka","Free eBook: Applications of Deep Neural Networks. #BigData #Analytics #DataScience #AI #MachineLearning #IoT #IIoT #Python #RStats #TensorFlow #JavaScript #ReactJS #CloudComputing #Serverless #DataScientist #Linux #Programming #Coding #100DaysofCode 
https://t.co/PkDY1tYLPj https://t.co/3QR2bWYkPu",56,59
"x4263007693","x1403161576128008196",2021-06-11 01:26:03,"gp_pulipaka","All Machine Learning Models Explained. #BigData #Analytics #DataScience #AI #MachineLearning #IoT #IIoT #PyTorch #Python #RStats #TensorFlow #Java #JavaScript #ReactJS #CloudComputing #Serverless #DataScientist #Linux #Programming #Coding #100DaysofCode 
https://t.co/729DTTrJrI https://t.co/DbRbVlOYyl",43,61
"x4263007693","x1403361140680314881",2021-06-11 14:39:03,"gp_pulipaka","Top #Statistics and Machine Learning Books to Read. #BigData #Analytics #DataScience #CPP #IoT #IIoT #Python #RStats #TensorFlow #Java #JavaScript #ReactJS #CloudComputing #Serverless #DataScientist #Linux #Books #Programming #Coding #100DaysofCode 
https://t.co/7jLR9qh1pQ https://t.co/BneRKj0W4u",29,48
"x4263007693","x1403159814830690307",2021-06-11 01:19:03,"gp_pulipaka","Feature Selection for Machine Learning. #BigData #Analytics #DataScience #AI #MachineLearning #IoT #IIoT #Python #RStats #TensorFlow #Java #JavaScript #ReactJS #GoLang #CloudComputing #Serverless #DataScientist #Linux #Programming #Coding #100DaysofCode 
https://t.co/2nYAC6LTzd https://t.co/RrP2Yf4rCR",24,52
"x4263007693","x1403178688041082880",2021-06-11 02:34:03,"gp_pulipaka","The Decadal Predictability in an Earth-System Model. #BigData #Analytics #DataScience #AI #MachineLearning #IoT #IIoT #Python #RStats #TensorFlow #JavaScript #ReactJS #CloudComputing #Serverless #DataScientist #Linux #Programming #Coding #100DaysofCode 
https://t.co/MLuKIyrrvc https://t.co/JCESLG6Y27",21,45
"x4263007693","x1403174912278339591",2021-06-11 02:19:03,"gp_pulipaka","Top Books on Swarm Intelligence. #BigData #Analytics #DataScience #IoT #IIoT #PyTorch #Python #RStats #TensorFlow #Java #JavaScript #ReactJS #GoLang #CloudComputing #Serverless #DataScientist #Linux #Books #Programming #Coding #100DaysofCode 
https://t.co/MWYRl3D5bx https://t.co/4nYSySsETD",72,85
"x4263007693","x1403170381599592454",2021-06-11 02:01:03,"gp_pulipaka","Everything You Need To Know About #ReinforcementLearning. #BigData #Analytics #DataScience #AI #MachineLearning #IoT #IIoT #Python #RStats #TensorFlow #JavaScript #ReactJS #CloudComputing #Serverless #DataScientist #Linux #Programming #100DaysofCode 
https://t.co/O2XxdTDStR https://t.co/z6K9bTMggs",40,75
