"user_id","status_id","created_at","screen_name","text","favorite_count","retweet_count"
"x269147553","x1410042444922556416",2021-06-30 01:08:10,"joel_nitta","Um... base::order() is not doing what I thought it would do. What's going on here? #RStats https://t.co/RTjv42MdZi",0,1
"x20828110","x1410041261546000384",2021-06-30 01:03:28,"guangchuangyu","Unaligned Tile Circular Tree. https://t.co/yRCvnwGRhT https://t.co/Ck8GBYPtFF #ggtree #rstats #evolution",0,0
"x20828110","x1409980881947738113",2021-06-29 21:03:33,"guangchuangyu","error with geom_tiplab() with latest ggtree while looping over trees https://t.co/BVoG6BevKs https://t.co/Ck8GBYPtFF #ggtree #rstats #evolution",1,1
"x34047563","x1410039662333378562",2021-06-30 00:57:07,"episinister","Yes, I made my first map with proc gmap today and I am so proud. Go ahead and tell me how much easier this would be with #RStats",3,2
"x994468660466061313","x1410039299601539074",2021-06-30 00:55:40,"BigBayesianGuy","We are up and running --- if you need high quality tutoring please visit our site or contact me! 
If you know people who would benefit from strong quantitative tutors -- please pass this info along!

#rstats #datascience #statistics #python #r #physics #engineering https://t.co/YGD36QQbd8",0,1
"x788597042","x1410038375168438273",2021-06-30 00:52:00,"MurphyWoodhouse","@caitlincschmidt Thanks! Always fun to complicate the official narrative with #rstats",1,1
"x935569091678691328","x1410038267437846534",2021-06-30 00:51:34,"tidyversetweets","Connecting to Spotify API using R- Authentication Token Issue #tidyverse #rstats https://t.co/y5248FMpWh",2,2
"x935569091678691328","x1410038266917687296",2021-06-30 00:51:34,"tidyversetweets","Web scraping with splashr fails with curl error after many successes #tidyverse #rstats https://t.co/JDGNX38Nlv",1,2
"x935569091678691328","x1410038265881763840",2021-06-30 00:51:34,"tidyversetweets","Wide to Long format with regex and multiple value columns in tidyr #tidyverse #rstats https://t.co/w6qa4G87VV",1,2
"x935569091678691328","x1409874701447577603",2021-06-29 14:01:37,"tidyversetweets","How to combine fill (columns) and color (points and lines) legends in a single plot made with ggplot2? #tidyverse #rstats https://t.co/QMgO17GtUc",1,2
"x935569091678691328","x1409889360158380034",2021-06-29 14:59:52,"tidyversetweets","haven::write_xpt question #tidyverse #rstats https://t.co/Klp7R4rMAQ",1,2
"x935569091678691328","x1410005702735810560",2021-06-29 22:42:10,"tidyversetweets","using a private multiple source RSPM in github-actions for private R dependencies #tidyverse #rstats https://t.co/5NdiKTpyDX",1,2
"x935569091678691328","x1409889358950322186",2021-06-29 14:59:52,"tidyversetweets","scale_x_date returns error: how can I apply time frame to x-axis? #tidyverse #rstats https://t.co/gteHkNgJ5D",1,2
"x935569091678691328","x1409836779658788870",2021-06-29 11:30:56,"tidyversetweets","Self-contained modified partial function #tidyverse #rstats https://t.co/zrfoH4Gy0E",1,2
"x935569091678691328","x1410024184508555269",2021-06-29 23:55:37,"tidyversetweets","scoping questions #tidyverse #rstats https://t.co/WsQpfruCGw",1,2
"x935569091678691328","x1409903912040210438",2021-06-29 15:57:42,"tidyversetweets","Strip plot with both categorical and numerical axis #tidyverse #rstats https://t.co/2ZYfZKZTG5",1,2
"x935569091678691328","x1409903911440470018",2021-06-29 15:57:41,"tidyversetweets","beta regression #tidyverse #rstats https://t.co/v0Va8yYOMY",1,2
"x935569091678691328","x1409934559408537612",2021-06-29 17:59:28,"tidyversetweets","R code - Changing cell value based on multiple conditions #tidyverse #rstats https://t.co/DSMIqmqLWR",1,2
"x935569091678691328","x1409856156743393287",2021-06-29 12:47:56,"tidyversetweets","dplyr with row_number, ifelse and mutate #tidyverse #rstats https://t.co/shZUvE8dYU",2,3
"x935569091678691328","x1409856156202409984",2021-06-29 12:47:56,"tidyversetweets","How to add percent labels on top of bar plots #tidyverse #rstats https://t.co/xuyoSULIsp",1,2
"x935569091678691328","x1409952491379347457",2021-06-29 19:10:44,"tidyversetweets","R function to map SI prefixes to their values #tidyverse #rstats https://t.co/jgbavVlZCs",1,2
"x935569091678691328","x1409870778649174017",2021-06-29 13:46:02,"tidyversetweets","How do I plot multiple unique lines in a single data frame using ggplot2? #tidyverse #rstats https://t.co/oB7ykwyQhx",4,2
"x935569091678691328","x1409992685960810506",2021-06-29 21:50:27,"tidyversetweets","R ggplot issue with multi line plot #tidyverse #rstats https://t.co/5bgSttmpn5",1,2
"x935569091678691328","x1410017486200885252",2021-06-29 23:29:00,"tidyversetweets","Excel Data Import #tidyverse #rstats https://t.co/8A9omGrqGs",1,2
"x935569091678691328","x1409696899867693058",2021-06-29 02:15:06,"tidyversetweets","Degree symbol in kableExtra #tidyverse #rstats https://t.co/gxLS1NuPmi",1,2
"x935569091678691328","x1409696898965856264",2021-06-29 02:15:06,"tidyversetweets","How to create second-order(Squared,power,expotent = 2) features ? #tidyverse #rstats https://t.co/Lqdj35QDrv",1,2
"x935569091678691328","x1409900610242088965",2021-06-29 15:44:34,"tidyversetweets","Exporting plot png using cairo #tidyverse #rstats https://t.co/Cl1WRhC3ER",1,2
"x935569091678691328","x1409985459212763139",2021-06-29 21:21:44,"tidyversetweets","How to facet wrap plots with two different factors #tidyverse #rstats https://t.co/DVMvxB0tXe",1,2
"x935569091678691328","x1409696896516464643",2021-06-29 02:15:05,"tidyversetweets","Is there a R function to present 'uncluttered' figure layouts? #tidyverse #rstats https://t.co/Xo12JFSlDP",1,2
"x935569091678691328","x1409948475819806721",2021-06-29 18:54:46,"tidyversetweets","Using showNotification() to display message after a button is clicked on #tidyverse #rstats https://t.co/SNLTn4oJWw",0,2
"x935569091678691328","x1409847284636913667",2021-06-29 12:12:41,"tidyversetweets","different colours in GGPLOT #tidyverse #rstats https://t.co/ab6zOwcTT9",2,2
"x935569091678691328","x1409894378181648397",2021-06-29 15:19:48,"tidyversetweets","How to add legend manually based on two geom_col with filtered data #tidyverse #rstats https://t.co/BEWY2uSkrV",1,2
"x935569091678691328","x1409894377565081603",2021-06-29 15:19:48,"tidyversetweets","Adding labels to plotly map created using plot_geo #tidyverse #rstats https://t.co/Z3foNE7VKO",1,2
"x935569091678691328","x1409992687051317249",2021-06-29 21:50:27,"tidyversetweets","Wide to Long form with multiple values #tidyverse #rstats https://t.co/MqnU6si9j0",1,2
"x935569091678691328","x1409992686535331846",2021-06-29 21:50:27,"tidyversetweets","Adding a legend entry for geom_segment #tidyverse #rstats https://t.co/PcGkeVj0rd",1,2
"x935569091678691328","x1410008454295605251",2021-06-29 22:53:06,"tidyversetweets","How best to transform quarterly data into monthly #tidyverse #rstats https://t.co/pDnAeYB7Cx",1,2
"x935569091678691328","x1409759097004740609",2021-06-29 06:22:15,"tidyversetweets","gather() in tidyr, two different codes, one is corrct and the other is wrong #tidyverse #rstats https://t.co/UbzQ3XFqZA",1,2
"x935569091678691328","x1410017485718495242",2021-06-29 23:29:00,"tidyversetweets","Adding line breaks between words to axis labels in ggplot #tidyverse #rstats https://t.co/qMHWhhI79e",1,2
"x935569091678691328","x1410017485135417344",2021-06-29 23:28:59,"tidyversetweets","ggiraphExtra and plotting, I am unable to plot the below nor can I download ggiraphExtra, #tidyverse #rstats https://t.co/Ep2x3D8EVn",1,2
"x935569091678691328","x1409718582016188418",2021-06-29 03:41:15,"tidyversetweets","Conditionally Alter Default Arguments When Passing Masked Variables to group_by() #tidyverse #rstats https://t.co/NPgdktAJl7",1,2
"x935569091678691328","x1409812006039916545",2021-06-29 09:52:29,"tidyversetweets","R: How to reposition stacked bars based on total value in a stacked barplot? #tidyverse #rstats https://t.co/ij8hLoe8YW",1,2
"x935569091678691328","x1409985458667503621",2021-06-29 21:21:44,"tidyversetweets","Download an object in tab1 of shiny app, when the 'download' button is in tab2? #tidyverse #rstats https://t.co/wDd9ZFaKRo",1,2
"x935569091678691328","x1409842377267744768",2021-06-29 11:53:11,"tidyversetweets","Printing the chi-squared value from Mauchley's test of Sphericity #tidyverse #rstats https://t.co/vR7ccFVbEx",1,2
"x935569091678691328","x1409842376705810436",2021-06-29 11:53:10,"tidyversetweets","How can I combine color and shape identity with ggplot2? #tidyverse #rstats https://t.co/IEySs6CtY4",2,2
"x935569091678691328","x1409832439644667909",2021-06-29 11:13:41,"tidyversetweets","How do I pivot_longer a data frame with round number and variable in the variable name? #tidyverse #rstats https://t.co/N475DCsqkf",1,2
"x935569091678691328","x1410038266422861826",2021-06-30 00:51:34,"tidyversetweets","My tidyverse is not loading, when I type in library(tidyverse) an error shows up, why? #tidyverse #rstats https://t.co/U0AyeZcMvO",1,2
"x935569091678691328","x1409794122974642178",2021-06-29 08:41:26,"tidyversetweets","Applying post probability adjustments to models that use SMOTE #tidyverse #rstats https://t.co/sn0W19AwFc",1,2
"x935569091678691328","x1409856155594149891",2021-06-29 12:47:56,"tidyversetweets","Output loop Ggplot2 figures to pdf: subscript out of bounds #tidyverse #rstats https://t.co/bNQCnsVZiX",2,2
"x935569091678691328","x1409874702244401163",2021-06-29 14:01:37,"tidyversetweets","Combining observation-values in new variable(s) #tidyverse #rstats https://t.co/7K7k3fVR6y",1,2
"x935569091678691328","x1409874700864475136",2021-06-29 14:01:37,"tidyversetweets","Format number to currency in dplyr? #tidyverse #rstats https://t.co/YkXsG6sZm7",1,2
"x935569091678691328","x1409874700046635023",2021-06-29 14:01:37,"tidyversetweets","robust linear model (rlm) that is less sensitive to outlier #tidyverse #rstats https://t.co/82gBqaYboT",2,2
"x935569091678691328","x1409812006685847554",2021-06-29 09:52:30,"tidyversetweets","Transforming the test set to the trained principal component space with tidymodels #tidyverse #rstats https://t.co/hDTBYSvN9g",1,2
"x935569091678691328","x1409829117676118016",2021-06-29 11:00:29,"tidyversetweets","How to join data frames with multiple columns in R #tidyverse #rstats https://t.co/BhQMbjFCYl",3,2
"x935569091678691328","x1409726626418593794",2021-06-29 04:13:13,"tidyversetweets","Compare and analyze data using multiple columns #tidyverse #rstats https://t.co/zWjQxbi1by",1,1
"x935569091678691328","x1409973504678760450",2021-06-29 20:34:14,"tidyversetweets","Multiple Ggplot Graphs (grid.arrange) #tidyverse #rstats https://t.co/eOGR2pFVLN",1,2
"x935569091678691328","x1409973504032874502",2021-06-29 20:34:14,"tidyversetweets","Error: Invalid input: time_trans works with objects of class POSIXct only in R #tidyverse #rstats https://t.co/2OW4yeRTs0",1,2
"x935569091678691328","x1409733945676140547",2021-06-29 04:42:18,"tidyversetweets","Moving averages appear to be calculating from the most recent date backwards using geom_ma #tidyverse #rstats https://t.co/qsr68TJIjx",1,2
"x935569091678691328","x1409832439095169032",2021-06-29 11:13:41,"tidyversetweets","Question about using cronbach alpha #tidyverse #rstats https://t.co/jlnkPGLn8C",2,2
"x935569091678691328","x1410001498617090048",2021-06-29 22:25:28,"tidyversetweets","How to select a column according to row max value #tidyverse #rstats https://t.co/xb4Ohi4yTs",1,2
"x935569091678691328","x1409927433420222464",2021-06-29 17:31:09,"tidyversetweets","Removing duplicates based on a specific category of another column #tidyverse #rstats https://t.co/Ej3ignTc1R",3,3
"x935569091678691328","x1409685886774636548",2021-06-29 01:31:20,"tidyversetweets","R Is there a way to summarise if column value is x? #tidyverse #rstats https://t.co/93M4gGWiJM",2,3
"x935569091678691328","x1409920576827936771",2021-06-29 17:03:55,"tidyversetweets","How to change the color of one factor in every dataset in a list using a loop? #tidyverse #rstats https://t.co/PFXDiIzDjG",1,2
"x935569091678691328","x1409995706874712066",2021-06-29 22:02:27,"tidyversetweets","Knit HTML Plot Size? #tidyverse #rstats https://t.co/Ig91H6uRnh",1,2
"x935569091678691328","x1409826087517835266",2021-06-29 10:48:27,"tidyversetweets","Plot rules (rectangles) of a J48 decision tree (package rWeka in R) learnt from a 2D dataset #tidyverse #rstats https://t.co/RWhEpzYJz8",1,2
"x935569091678691328","x1409880021746040837",2021-06-29 14:22:46,"tidyversetweets","R Package for Neural Prophet Facebook #tidyverse #rstats https://t.co/uc5nTvkdUb",1,2
"x935569091678691328","x1409863049696223240",2021-06-29 13:15:19,"tidyversetweets","Show legend and manage in a specific order from multiple layers (ggplot) #tidyverse #rstats https://t.co/cWSdMGi4vn",0,1
"x935569091678691328","x1409765823326130176",2021-06-29 06:48:59,"tidyversetweets","priceR function to pull conversion of histroical prices #tidyverse #rstats https://t.co/GKUInVpPCK",1,2
"x935569091678691328","x1409796995687108610",2021-06-29 08:52:51,"tidyversetweets","how to convert dataframe to jsonobject per user(group_by user) using R #tidyverse #rstats https://t.co/37uUVltHbh",1,2
"x935569091678691328","x1409749507689127936",2021-06-29 05:44:09,"tidyversetweets","NULL is coming during running a code #tidyverse #rstats https://t.co/3sqhli9PMs",1,2
"x935569091678691328","x1409821821466124291",2021-06-29 10:31:30,"tidyversetweets","pink background with red dots in a file name #tidyverse #rstats https://t.co/fn6xyPEoV6",1,2
"x935569091678691328","x1409985458055041026",2021-06-29 21:21:44,"tidyversetweets","change the order of bar charts to ascending, change to proportion on Y axis without losing color #tidyverse #rstats https://t.co/LSA8IDHovE",1,2
"x935569091678691328","x1409889359617302536",2021-06-29 14:59:52,"tidyversetweets","Save plotly (ggplotly) plots as static SVG images *in shiny* (with orca?) #tidyverse #rstats https://t.co/xt0NXCOLC1",1,2
"x935569091678691328","x1409863049192820739",2021-06-29 13:15:19,"tidyversetweets","Question on R programming with dplyr and tidy evaluation #tidyverse #rstats https://t.co/0dQ4zAQxYn",1,3
"x935569091678691328","x1409836780241756164",2021-06-29 11:30:56,"tidyversetweets","Error building webpage: RStudio + blogdown + Ezhil Theme #tidyverse #rstats https://t.co/xwx8KLk30X",1,2
"x935569091678691328","x1409971068257767425",2021-06-29 20:24:33,"tidyversetweets","How do I get the bars in this ggplot2 geom_bar graph to use Rcolorbrewer palette? #tidyverse #rstats https://t.co/3el5AzOHmr",1,2
"x935569091678691328","x1409794122387492867",2021-06-29 08:41:26,"tidyversetweets","Non linear model plotting issues using ggplot #tidyverse #rstats https://t.co/bIyGyc4u7b",1,3
"x935569091678691328","x1409696898164826116",2021-06-29 02:15:06,"tidyversetweets","how to plot geom_area() in ggplot in multiple columns in R #tidyverse #rstats https://t.co/dDWWEGrLoF",1,2
"x935569091678691328","x1409910427706867712",2021-06-29 16:23:35,"tidyversetweets","How to rename multiple .RDS files in RStudio #tidyverse #rstats https://t.co/7ngUXGxY1h",0,2
"x935569091678691328","x1409867904904990724",2021-06-29 13:34:37,"tidyversetweets","R- change color order in legend #tidyverse #rstats https://t.co/kMdT5ebpE3",1,2
"x935569091678691328","x1409867904234012676",2021-06-29 13:34:37,"tidyversetweets","Plotting two heatmaps using different scales #tidyverse #rstats https://t.co/RYTtYv8NVY",1,2
"x935569091678691328","x1409806558092009472",2021-06-29 09:30:51,"tidyversetweets","Pulling Intercept from tidy functionality (combining dplyr and broom package) #tidyverse #rstats https://t.co/nSeLcgNxFY",1,2
"x935569091678691328","x1409832440164724736",2021-06-29 11:13:41,"tidyversetweets","How can I 4D plot road network data (start and end points) with the time axis and speed value in R #tidyverse #rstats https://t.co/2Yjo9D98CU",1,2
"x935569091678691328","x1409910427098750981",2021-06-29 16:23:35,"tidyversetweets","Fuzzy Join with Partial String Match in R #tidyverse #rstats https://t.co/lIkNYuIxiX",1,2
"x935569091678691328","x1409863048517632011",2021-06-29 13:15:19,"tidyversetweets","R or Python) How can I plot road network data as 4D graph with the start point, end point, time axis, and speed value? #tidyverse #rstats https://t.co/27rOdnNd8s",0,1
"x935569091678691328","x1409696897380470786",2021-06-29 02:15:05,"tidyversetweets","How to combine/merge multiple dataframes by date column elegantly? #tidyverse #rstats https://t.co/wEz0zbqhya",1,2
"x935569091678691328","x1409801212925521921",2021-06-29 09:09:36,"tidyversetweets","What is the purpose for tibble$sub_tibble$columns? #tidyverse #rstats https://t.co/671hvCsHKA",1,2
"x935569091678691328","x1409726627014234113",2021-06-29 04:13:13,"tidyversetweets","filter() function #tidyverse #rstats https://t.co/IJxVOpDoMj",0,1
"x935569091678691328","x1409829118255022085",2021-06-29 11:00:29,"tidyversetweets","ggplot2, legent does not show #tidyverse #rstats https://t.co/xicQT6RsBX",1,2
"x2418647064","x1410038007273431041",2021-06-30 00:50:32,"hayleyjach","Any preferences or references for best multiple imputation practices, for this newbie who tends to work only with complete cases? #missingdata #RStats https://t.co/wWCPb6245Z",1,3
"x103516223","x1409846364301783046",2021-06-29 12:09:01,"mdsumner","#rstats  https://t.co/OeEZmOgDRY via @imgflip",17,2
"x103516223","x1410037762250612742",2021-06-30 00:49:34,"mdsumner","#rstats is there an example ""extdata"" raster file in any CRAN package that has data for the globe in longlat, hopefully geotiff? 

don't want netcdf (yes I know about {stars}/nc/reduced.nc)",0,2
"x103516223","x1409724905076138017",2021-06-29 04:06:23,"mdsumner","why does #rstats ... this is surely not for compatibility with S ...

I think that's a bug, no one wants what this does https://t.co/hJs2ooFY1h",1,2
"x103516223","x1409725631206617091",2021-06-29 04:09:16,"mdsumner","{gdalio} core of GDAL warp lib in #rstats at your fingertips

easily read any raster source to exact grid extent, dimension, projection  - with resampling options

WIP, but I'm really getting a lot out of this - sweeping up a lot of various confusions

https://t.co/u1uDly1oRg",26,7
"x103516223","x1409816729862098945",2021-06-29 10:11:16,"mdsumner","is there anything new in #rstats for approxfun() ? or is that pretty swift already?",0,2
"x103516223","x1409815771014782979",2021-06-29 10:07:27,"mdsumner","#rstats indexing is so good

so good for mesh stuff it's amazing https://t.co/TL7T5phFu3",4,2
"x571023450","x1409964965860106246",2021-06-29 20:00:18,"Little_Redstone","Adi Tatarko #Houzz #Evilest ⁉️#Woman #Business #Canada 🍁#Jobs #interiordesign #AI #Toronto #IoT #BigData #Analytics #DataScience #IoT #PyTorch #Python #RStats #TensorFlow #Java #JavaScript #ReactJS  #Code #webdev #Webdesign #decor #startup #coding #hack https://t.co/vyMIJ3F1o3 https://t.co/F2OgR5kdzT",1,1
"x571023450","x1409951471249014784",2021-06-29 19:06:41,"Little_Redstone","Adi #Befez Tatarko #Houzz Standards #Fraud #theft #Harrassment #CyberBullying #Evil #Canada #BigData #DataScience #startup #PyTorch #Python #RStats #TensorFlow #JavaScript #ReactJS #Code #web #taratko #Website #decor #coding #dev #Jobs #interiordesign
https://t.co/irn3DrUV6A https://t.co/UHl0gAiRhJ",2,3
"x571023450","x1409717521356189701",2021-06-29 03:37:03,"Little_Redstone","Adi Tatarko #Houzz #Evilest  #Woman  #Business #Canada  #Jobs #interiordesign #AI #Toronto #IoT #BigData #Analytics #DataScience #IoT #PyTorch #Python #RStats #TensorFlow #Java #JavaScript #ReactJS  #Code #webdev #Webdesign #decor #startup #coding #hack https://t.co/RSGavFXOy5",5,10
"x571023450","x1409966097466642432",2021-06-29 20:04:48,"Little_Redstone","Houzz Best Day Ever #udemy #coupons #webdevelopment #javascript #React #Angular  #PHP #css3 #HTML5 #WordPress #vuejs #Redux #Django #Python #RStats #TensorFlow #Java #JavaScript #ReactJS  #Code #webdev #Webdesign #decor #startup #coding #dev #DataScience
https://t.co/vyMIJ3F1o3",5,3
"x571023450","x1409960990746288136",2021-06-29 19:44:30,"Little_Redstone","HouzzIN-ToLogy BurP  #Befez Tatarko #Houzz #Fraud #theft #Harrassment #CyberBullying #Evil #Canada #BigData #DataScience #startup #PyTorch #Python #RStats #TensorFlow #JavaScript #ReactJS #Code #web #taratko #Website #decor #coding #dev  #interiordesign
https://t.co/hyHPQRs8uA",2,3
"x571023450","x1410035737479847937",2021-06-30 00:41:31,"Little_Redstone","Unlawfully Time by Art #Houzz #Fraud #theft #Harrassment  Adi Tatarko #Befez 🦄#CyberBullying #Evilest #Canada #BigData #DataScience #startup #PyTorch #Python #RStats #TensorFlow #JavaScript #ReactJS #Code #web #Website #decor #coding #dev #Jobs #interiordesign #AI #Toronto #IoT https://t.co/NJAxMVtDZY",3,5
"x571023450","x1409840470210007043",2021-06-29 11:45:36,"Little_Redstone","Click U Agree  Adi 💅 #Evil Tararko #Woman #Business #Canada #SEOClown #Google #reviews #BigData #Analytics #DataScience #IoT #PyTorch #Python #RStats #TensorFlow #Java #JavaScript #ReactJS  #Code #crime  #Webdesign #decor #startup #coding #dev #AI #Houzz https://t.co/lpr5qXHS1C",3,4
"x571023450","x1409900706333593601",2021-06-29 15:44:57,"Little_Redstone","Test #Befez 🦄🤏 Adi Tatarko #Houzz Standards #Fraud #theft #Harrassment #CyberBullying #Evilest #Canada #BigData #DataScience #startup #PyTorch #Python #RStats #TensorFlow #JavaScript #ReactJS #Code #web #Website #decor #coding #dev #Jobs #interiordesign 
https://t.co/qt7E3DhpmY",2,2
"x571023450","x1409718757128294402",2021-06-29 03:41:57,"Little_Redstone","Time by Art🛎️ #Houzz #Fraud #theft #Harrassment #Befez #CyberBullying #Evilest #Canada #BigData #DataScience #startup #PyTorch #Python #RStats #TensorFlow #JavaScript #ReactJS #Code #web #Website #decor #coding #dev #Jobs #interiordesign #AI #Toronto #IoT
https://t.co/pwDmBrKKwM",6,10
"x571023450","x1409679272709562368",2021-06-29 01:05:03,"Little_Redstone","Time by Art #Houzz #Fraud #theft #Harrassment #Befez #CyberBullying #Evilest #Canada #BigData #DataScience #startup #PyTorch #Python #RStats #TensorFlow #JavaScript #ReactJS #Code #web #Website #decor #coding #dev #Jobs #interiordesign #AI #Toronto #IoT
https://t.co/O8KRMlqsQO",7,14
"x571023450","x1409723116138401792",2021-06-29 03:59:16,"Little_Redstone","Let your plans be dark #Tararko #CrimeSceneKitchen 404 #Houzz #Fraud #Theft #Harrassment #Befez #CyberBullying #Evilest #Canada  #DataScience #startup #PyTorch #Python #RStats #TensorFlow #JavaScript #ReactJS #Code #web #Website #decor #coding #AMC  #dev https://t.co/SSmbIhprcn",5,18
"x571023450","x1409680526949027845",2021-06-29 01:10:02,"Little_Redstone","Unlawful #Houzz #CyberBullying #Fraud #Theft #Harrassment #Befez #Evil #Canada #BigData #DataScience #startup #PyTorch #Python #RStats #TensorFlow #JavaScript #ReactJS #Code #web #Website #webdev #decor #coding #dev #Jobs #interiordesign #AI #Reactjs #IoT
https://t.co/XbhLwKcVX7",6,12
"x1201757907945046018","x1410035249325633537",2021-06-30 00:39:35,"LeganaFingerhut","The #Rpackage #ampir to predict antimicrobial peptides from protein sequences v1.1.0 is now LIVE on #CRAN. It includes 2 updated classifications models (1 for full length proteins and 1 for mature peptides) AND a #shinyapp GUI making #ampir even more user friendly! #RStats 1/🧵 https://t.co/tw5yRLwWX9",3,2
"x1327925920624087040","x1409934692179079171",2021-06-29 18:00:00,"EasternStyle1","Ultrasound controls the assembly of objects.#Programming #IoT #AI #100DaysOfCode #MachineLearning #ML #Airdrop #Python #CloudComputing #Analytics #Serverless #womenwhocode #cybersecurity #CodeNewbie #DataScience #5G #RTXOn #RStats https://t.co/rtni1jMgVE",1,9
"x1327925920624087040","x1410033340879720454",2021-06-30 00:32:00,"EasternStyle1","The balance wheel is triply stacked.#Programming #IoT #AI #100DaysOfCode #MachineLearning #ML #Airdrop #Python #CloudComputing #Analytics #Serverless #womenwhocode #cybersecurity #CodeNewbie #DataScience #5G #RTXOn #RStats https://t.co/87F9cQYleD",5,9
"x1327925920624087040","x1409919592814694403",2021-06-29 17:00:00,"EasternStyle1","Test the robot to walk the steps.#Programming #IoT #AI #100DaysOfCode #MachineLearning #ML #Airdrop #Python #CloudComputing #Analytics #Serverless #womenwhocode #cybersecurity #CodeNewbie #DataScience #5G #RTXOn #RStats https://t.co/PMNW2nISax",6,15
"x144592995","x1409767839473573889",2021-06-29 06:56:59,"Rbloggers","Missing Migrants, tracking human deaths along migratory routes  {https://t.co/l0gRB08Glq} #rstats #DataScience",20,6
"x144592995","x1409701121325633537",2021-06-29 02:31:52,"Rbloggers","RStudio Professional Drivers 1.8.0  {https://t.co/h0EuhK0eDt} #rstats #DataScience",14,5
"x144592995","x1409913768771997696",2021-06-29 16:36:52,"Rbloggers","Gentle Introduction to Forecasting with Modeltime [Video Tutorial]  {https://t.co/kez43VRRr0} #rstats #DataScience",18,11
"x144592995","x1410014470693343232",2021-06-29 23:17:01,"Rbloggers","Stephan Kadauke from R/Medicine talks to R Consortium about Racial Bias  {https://t.co/L8O2eSP3S4} #rstats #DataScience",5,4
"x144592995","x1409857137086447621",2021-06-29 12:51:50,"Rbloggers","Transition plot in R-change in time visualization  {https://t.co/SjD0nMoFzf} #rstats #DataScience",22,9
"x144592995","x1409891138773950470",2021-06-29 15:06:56,"Rbloggers","Get the Odds of Euro 2020 Games based on FIFA World Ranking  {https://t.co/7xXQtaK08S} #rstats #DataScience",8,7
"x144592995","x1410033311141990401",2021-06-30 00:31:53,"Rbloggers","Euro 2020 Predictive Model based on FIFA Ranking System  {https://t.co/heb2DaeFmY} #rstats #DataScience",7,4
"x3439120917","x1410033057172799488",2021-06-30 00:30:52,"kylecontrast","Skimming through the first chapter, I WILL read this book and all of the examples before 2022.
After committing to learn more stats on various occasions and falling off the train, I'm sharing this for accountability.  Expect follow ups on this journey #RStats #BecomingABayesian https://t.co/wIfGi7vScR",3,3
