"user_id","status_id","created_at","screen_name","text","favorite_count","retweet_count"
"x103516223","x1408230701523038216",2021-06-25 01:08:57,"mdsumner","any #rstats func to format file paths? what I want is 

path_base_fmt(""/some/long/root/to/a/specific/abc/file.xyz"", max_cull = 4)

"" ../a/specific/abc/file.xyz""

it would default to the basename if cull greater than the branches",0,1
"x844152803991994368","x1408177537243623428",2021-06-24 21:37:42,"rweekly_live","May 2021: ""Top 40"" New CRAN Packages #rstats #datascience https://t.co/3iIcAQA43t",2,4
"x844152803991994368","x1407943465212780547",2021-06-24 06:07:35,"rweekly_live","Shiny on ECS #rstats #datascience https://t.co/6YwiGfmScP",4,3
"x844152803991994368","x1408230485805969408",2021-06-25 01:08:06,"rweekly_live","Updated forecasts for the UEFA Euro 2020 knockout stage https://t.co/21IKfhgOy3 #rstats #datascience https://t.co/59Bp6b34l6",1,1
"x844152803991994368","x1408026527577616384",2021-06-24 11:37:38,"rweekly_live","EARL online – highlights to look forward to #rstats #datascience https://t.co/CyhGfmUUGF",3,4
"x844152803991994368","x1407973668978823169",2021-06-24 08:07:36,"rweekly_live","How We Curate Our Monthly Newsletter @rOpenSci #rstats #datascience https://t.co/uDiUhS6k48",3,3
"x844152803991994368","x1407996323220049921",2021-06-24 09:37:37,"rweekly_live","Evaluation of the UEFA Euro 2020 group stage forecast https://t.co/21IKfhgOy3 #rstats #datascience https://t.co/bMT4iX4qih",1,3
"x844152803991994368","x1408064270558908424",2021-06-24 14:07:37,"rweekly_live","Why Shiny? Insights from a Shiny developer #rstats #datascience https://t.co/tOBu46O2IN",7,3
"x844152803991994368","x1408139780974682118",2021-06-24 19:07:40,"rweekly_live","Winners of the 3rd annual Shiny Contest @rstudio #rstats #datascience https://t.co/5frYQJYsjy",14,7
"x844152803991994368","x1408049180845776897",2021-06-24 13:07:39,"rweekly_live","Why Shiny? Opinions from a Shiny developer #rstats #datascience https://t.co/tOBu475E7n",6,3
"x844152803991994368","x1408169985684410375",2021-06-24 21:07:41,"rweekly_live","Working with Databases in R – Video Presentation from NairobiR and R-Ladies Nairobi @RConsortium #rstats #datascience https://t.co/tMQ7uxYEuY",5,4
"x844152803991994368","x1408109576789147648",2021-06-24 17:07:39,"rweekly_live","Strategic Analytics at Monash University: How RStudio Accelerated the Transformation @rstudio #rstats #datascience https://t.co/n3hfgOLPil",1,4
"x844152803991994368","x1407973670199377920",2021-06-24 08:07:36,"rweekly_live","ggpairs in R- A Brief Introduction to ggpairs #rstats #datascience https://t.co/261D4zcDgO",8,4
"x935569091678691328","x1408130283442827264",2021-06-24 18:29:56,"tidyversetweets","Searching for a table package to create scientific style tables in r (pdf output) #tidyverse #rstats https://t.co/hq6v8yy1E9",1,1
"x935569091678691328","x1407880028164182017",2021-06-24 01:55:30,"tidyversetweets","Error in UseMethod(""select"") : no applicable method for 'select' applied to an object of class ""c('double', 'numeric')"" #tidyverse #rstats https://t.co/Y2mDTUTlvS",0,1
"x935569091678691328","x1407994641891282944",2021-06-24 09:30:56,"tidyversetweets","Semi_join to filter columns of X based on multiple Y columns #tidyverse #rstats https://t.co/Tu9vt62i4F",0,1
"x935569091678691328","x1407910057849888778",2021-06-24 03:54:50,"tidyversetweets","_0 is not a function error when push to production #tidyverse #rstats https://t.co/9Yhqd5qZHW",0,1
"x935569091678691328","x1407998820521287681",2021-06-24 09:47:32,"tidyversetweets","R: print values greater then #tidyverse #rstats https://t.co/ujdd8UAv6C",1,1
"x935569091678691328","x1408050628782395396",2021-06-24 13:13:24,"tidyversetweets","Draw a bar chart in ggplot for above and below certain age #tidyverse #rstats https://t.co/IYBrBGocEg",0,1
"x935569091678691328","x1408076504764981252",2021-06-24 14:56:14,"tidyversetweets","Read CVS file with tagged values for missing data #tidyverse #rstats https://t.co/2tRKXCNJAl",2,2
"x935569091678691328","x1408191434692435968",2021-06-24 22:32:55,"tidyversetweets","Merging two dataframe with dpylr left join? #tidyverse #rstats https://t.co/U1fkXpsQwL",0,1
"x935569091678691328","x1408130284394930176",2021-06-24 18:29:56,"tidyversetweets","Model 3d scatterplot from black white image in R #tidyverse #rstats https://t.co/h0LiFEvQNi",0,1
"x935569091678691328","x1407940604043005952",2021-06-24 05:56:12,"tidyversetweets","case_when output conditioned by two character columns #tidyverse #rstats https://t.co/619PT63xUW",0,1
"x935569091678691328","x1408091838964137990",2021-06-24 15:57:10,"tidyversetweets","ggplot histogram colour by group not working #tidyverse #rstats https://t.co/mQvwLnf5DJ",1,2
"x935569091678691328","x1408202279057080321",2021-06-24 23:16:01,"tidyversetweets","Filter several values and make a df from each of them #tidyverse #rstats https://t.co/qwbTV8MMsF",0,1
"x935569091678691328","x1408082235773829126",2021-06-24 15:19:00,"tidyversetweets","Changing multiple text styles at once #tidyverse #rstats https://t.co/JfxUFiwWjQ",1,2
"x935569091678691328","x1408070393240330252",2021-06-24 14:31:57,"tidyversetweets","How can I reshape multiple columns of long data to wide? #tidyverse #rstats https://t.co/ue9PARqOlp",1,2
"x935569091678691328","x1408029983998713856",2021-06-24 11:51:22,"tidyversetweets","Bar plot colours from a vector #tidyverse #rstats https://t.co/5VOw0WZThw",0,1
"x935569091678691328","x1408136074019295235",2021-06-24 18:52:56,"tidyversetweets","sliding_window or sliding_period -- better explanation of the arguments than the documentation? #tidyverse #rstats https://t.co/Q8aJmDm3nW",0,1
"x935569091678691328","x1408076505402556429",2021-06-24 14:56:14,"tidyversetweets","filter dataframe by contents in name vector R #tidyverse #rstats https://t.co/vhcFshEQMG",1,2
"x935569091678691328","x1407971148126507015",2021-06-24 07:57:35,"tidyversetweets","R Web Scraping with RVEST: DT and DD Tag #tidyverse #rstats https://t.co/rMtIVcODYc",0,0
"x935569091678691328","x1408044312613605378",2021-06-24 12:48:18,"tidyversetweets","How to subtract data from one column to another? #tidyverse #rstats https://t.co/Us1iV0ATKr",0,1
"x935569091678691328","x1408206784821612545",2021-06-24 23:33:55,"tidyversetweets","Creating multiple input elements from dataframe? #tidyverse #rstats https://t.co/kWEZAq9KXo",0,1
"x935569091678691328","x1408082236981886976",2021-06-24 15:19:00,"tidyversetweets","Creating multiple overlaid density plots in ggplot2 #tidyverse #rstats https://t.co/EVRUjSDsbw",2,2
"x935569091678691328","x1407982064822112259",2021-06-24 08:40:57,"tidyversetweets","Loops for extracting vector percentiles #tidyverse #rstats https://t.co/dYnE2Cmfx9",0,1
"x935569091678691328","x1407865972959047681",2021-06-24 00:59:39,"tidyversetweets","ggplot: Combine stacked and dodge in barplot #tidyverse #rstats https://t.co/Fp2kNbfTKg",0,1
"x935569091678691328","x1408230138433753093",2021-06-25 01:06:43,"tidyversetweets","Error while attempting to install ""tidyverse"" to RStudio on MacOS Catalina Version 10.15.4 #tidyverse #rstats https://t.co/wDgNlwgeS3",1,1
"x935569091678691328","x1408109295690989569",2021-06-24 17:06:32,"tidyversetweets","Reordering variables in a plot #tidyverse #rstats https://t.co/xP8GGe1AD6",0,1
"x935569091678691328","x1408177300882038786",2021-06-24 21:36:45,"tidyversetweets","fit model in R with fitModel() function #tidyverse #rstats https://t.co/i2I0TtWaSd",2,3
"x935569091678691328","x1408130283916861441",2021-06-24 18:29:56,"tidyversetweets","How to pass condition with dynamical values to sqlQuery #tidyverse #rstats https://t.co/JwYJZ2kOFD",1,1
"x935569091678691328","x1408067375853826066",2021-06-24 14:19:57,"tidyversetweets","How to add number of observation and Median per group in boxplot in ggplot2 #tidyverse #rstats https://t.co/LCoStYLyGe",1,2
"x935569091678691328","x1408130282981511170",2021-06-24 18:29:55,"tidyversetweets","Add two more categories in ggplot2 #tidyverse #rstats https://t.co/h7q0tBRzLR",0,1
"x935569091678691328","x1408130282444648451",2021-06-24 18:29:55,"tidyversetweets","How to pivot_longer on multiple columns with unequal numbers of comma-separated values #tidyverse #rstats https://t.co/b9EGfXw69Z",0,1
"x935569091678691328","x1408191435266998272",2021-06-24 22:32:55,"tidyversetweets","Change colors in legends points (ggplot2) #tidyverse #rstats https://t.co/teQcDk4pqb",1,1
"x935569091678691328","x1408212572793360386",2021-06-24 23:56:55,"tidyversetweets","Updating hell (crashes after updating R) #tidyverse #rstats https://t.co/i4fUoF7J5T",0,1
"x935569091678691328","x1408212572193628163",2021-06-24 23:56:55,"tidyversetweets","Removing whitespace in Shiny font tags #tidyverse #rstats https://t.co/1p2Z18HPo0",0,1
"x935569091678691328","x1407865973437190149",2021-06-24 00:59:39,"tidyversetweets","R: how to personalize maps using geom_sf #tidyverse #rstats https://t.co/65ePVs8ju9",0,1
"x935569091678691328","x1408109296844427268",2021-06-24 17:06:32,"tidyversetweets","Adding cities names from geometry #tidyverse #rstats https://t.co/LNPGwUl6Np",0,1
"x935569091678691328","x1407865972413722625",2021-06-24 00:59:39,"tidyversetweets","Error in x * scale : non-numeric argument to binary operator #tidyverse #rstats https://t.co/zlWk4n48v3",1,1
"x935569091678691328","x1408024143774294024",2021-06-24 11:28:10,"tidyversetweets","Question about choropleth map's shape file #tidyverse #rstats https://t.co/gzDN7YpD5s",0,1
"x935569091678691328","x1408194328342798337",2021-06-24 22:44:25,"tidyversetweets","Adjusting the space between violin plots on the x-axis #tidyverse #rstats https://t.co/tlYOiei8vj",0,1
"x935569091678691328","x1408194327889813507",2021-06-24 22:44:25,"tidyversetweets","r ggplot non-linear gradient alpha #tidyverse #rstats https://t.co/ep6puAzfRe",0,1
"x935569091678691328","x1408194327235399687",2021-06-24 22:44:25,"tidyversetweets","Help with merging replicates for sequence data in Phyloseq. I've been stuck on this for months. ): #tidyverse #rstats https://t.co/9zWgRUHKdS",1,1
"x935569091678691328","x1408143975735779331",2021-06-24 19:24:20,"tidyversetweets","Density-2d plots on top of a ggmap #tidyverse #rstats https://t.co/rzwt1OwAYQ",0,1
"x935569091678691328","x1407971147585445895",2021-06-24 07:57:35,"tidyversetweets","geom_tile based on results of clustering #tidyverse #rstats https://t.co/92z0hD7wHO",0,0
"x935569091678691328","x1408119795694723072",2021-06-24 17:48:15,"tidyversetweets","Labels on Bar Chart are not working properly in R #tidyverse #rstats https://t.co/Tc7bktl47x",0,1
"x935569091678691328","x1408157253362913289",2021-06-24 20:17:06,"tidyversetweets","Adding rows of two categorical variables in a long dataset? #tidyverse #rstats https://t.co/bpZerEnMgo",0,1
"x935569091678691328","x1408157252729573377",2021-06-24 20:17:06,"tidyversetweets","Tabset RMarkdown #tidyverse #rstats https://t.co/NiJH0VO9An",0,1
"x935569091678691328","x1408109297360412678",2021-06-24 17:06:32,"tidyversetweets","Joining two time series based on id and time #tidyverse #rstats https://t.co/G7vFOgrTIW",1,1
"x935569091678691328","x1408087926525759497",2021-06-24 15:41:37,"tidyversetweets","https://t.co/I6L1HWwhiW returns: namespace sass 0.3.1 is being loaded, but &gt;= 0.4.0 is required #tidyverse #rstats https://t.co/ad5DoiZV1e",1,1
"x935569091678691328","x1408109296286638088",2021-06-24 17:06:32,"tidyversetweets","Rmd figure position shifted by text (PDF) #tidyverse #rstats https://t.co/FaDkaGzYxt",0,1
"x935569091678691328","x1408116336685944833",2021-06-24 17:34:30,"tidyversetweets","Inserting plot objects into the axis and annotate figures with ggplot2 #tidyverse #rstats https://t.co/uNRgRLQIut",0,1
"x935569091678691328","x1408082236453367814",2021-06-24 15:19:00,"tidyversetweets","Why is filter(str_detect() returning the wrong values using R? #tidyverse #rstats https://t.co/ryHiI5gqet",1,2
"x935569091678691328","x1407947311032975361",2021-06-24 06:22:52,"tidyversetweets","Plotting individual observations and group means with facets with ggplot2 #tidyverse #rstats https://t.co/c1Mvul7ASa",0,2
"x935569091678691328","x1408058828940210190",2021-06-24 13:45:59,"tidyversetweets","Issue making Flextable Transparent when knitting to Word #tidyverse #rstats https://t.co/b97txD8Dyt",1,1
"x935569091678691328","x1408056497020538884",2021-06-24 13:36:43,"tidyversetweets","R Multiply Column of DataFrame base on condition of another Column from two dataframes #tidyverse #rstats https://t.co/qJ0gHlhptr",0,1
"x935569091678691328","x1408100439346663426",2021-06-24 16:31:20,"tidyversetweets","Graph Demo for Shiny App Question #tidyverse #rstats https://t.co/pUFwgeLiZh",1,2
"x935569091678691328","x1408056495967805442",2021-06-24 13:36:43,"tidyversetweets","How to use `withr::defer()` instead of `testthat::setup()` in R? #tidyverse #rstats https://t.co/RB50cuMSLF",0,1
"x935569091678691328","x1407880027576975365",2021-06-24 01:55:30,"tidyversetweets","Help ! Is this a forum for R and R Studio ? #tidyverse #rstats https://t.co/4IZKEvByOQ",1,1
"x935569091678691328","x1407994643468324868",2021-06-24 09:30:56,"tidyversetweets","Reformatting dataframe for ggplot barplot #tidyverse #rstats https://t.co/TUKnvrNFXb",0,1
"x935569091678691328","x1408157252163411975",2021-06-24 20:17:05,"tidyversetweets","Using melt only for certain columns in R #tidyverse #rstats https://t.co/cO5kIFggiC",0,1
"x935569091678691328","x1408140066514407424",2021-06-24 19:08:48,"tidyversetweets","ggplot2 x-axis scale is not readable or non-existent #tidyverse #rstats https://t.co/G2S0rJQMqc",0,1
"x935569091678691328","x1408008652896694276",2021-06-24 10:26:37,"tidyversetweets","Rename all column names that include a certain string #tidyverse #rstats https://t.co/tWaUbbSbqo",0,1
"x935569091678691328","x1407998819971874819",2021-06-24 09:47:32,"tidyversetweets","stat_boxplot hide lines behind boxplot with transparant colour #tidyverse #rstats https://t.co/XIvR3HuySs",0,1
"x935569091678691328","x1408230137745842176",2021-06-25 01:06:43,"tidyversetweets","Change Kaplan-Meier plot y-axis to failure probability instead of survival probability using survminer (ggsurvplot)? #tidyverse #rstats https://t.co/SvRKZX81JX",0,1
"x935569091678691328","x1408067376780767243",2021-06-24 14:19:57,"tidyversetweets","Making updates to columns of a reactive data frame #tidyverse #rstats https://t.co/aiOqTASKb3",1,2
"x935569091678691328","x1408073252489121798",2021-06-24 14:43:18,"tidyversetweets","Add p-values via ggpubr to 100% stacked bar chart #tidyverse #rstats https://t.co/JcP41kZsQN",4,2
"x935569091678691328","x1408191435728461825",2021-06-24 22:32:55,"tidyversetweets","Distribution (separation) in the arrows (variables) of my RDA chart. #tidyverse #rstats https://t.co/KYe0XYG4Qd",0,1
"x935569091678691328","x1407977528271118340",2021-06-24 08:22:56,"tidyversetweets","Pivot longer by integrating mutiple columns #tidyverse #rstats https://t.co/nSx43oNaIM",0,1
"x935569091678691328","x1407977528778575883",2021-06-24 08:22:56,"tidyversetweets","Missing Legend in ggplot #tidyverse #rstats https://t.co/DpoBPHeb5i",0,1
"x935569091678691328","x1407994642449137665",2021-06-24 09:30:56,"tidyversetweets","Filter missing row numbers #tidyverse #rstats https://t.co/zECHnl2Rl6",1,2
"x935569091678691328","x1408181539603689482",2021-06-24 21:53:36,"tidyversetweets","Understanding the numbers in ggplot2 doc about boxplot #tidyverse #rstats https://t.co/QRDURCJtUe",1,2
"x935569091678691328","x1408070391768109063",2021-06-24 14:31:56,"tidyversetweets","R: Extract rows with NAs, delete those meeting condition A and take the mean of those meeting condition B #tidyverse #rstats https://t.co/RixXnQzDpQ",1,2
"x935569091678691328","x1408157251328634880",2021-06-24 20:17:05,"tidyversetweets","Non-numeric argument to binary operator error from subtracting two float columns in a dataframe #tidyverse #rstats https://t.co/Sfjyewltuw",0,1
"x935569091678691328","x1408170300466937867",2021-06-24 21:08:56,"tidyversetweets","webscraping a table with R rvest #tidyverse #rstats https://t.co/ShKpa5K8MB",2,3
"x935569091678691328","x1407947310420664320",2021-06-24 06:22:51,"tidyversetweets","rename the dataframe names by switching string patterns #tidyverse #rstats https://t.co/whou61utoX",0,2
"x935569091678691328","x1408136073490800640",2021-06-24 18:52:56,"tidyversetweets","Reorder factors by a group statistic #tidyverse #rstats https://t.co/Ak7lpZZT7h",0,1
"x935569091678691328","x1408056496546619394",2021-06-24 13:36:43,"tidyversetweets","Querying CosmosDB in R-shiny #tidyverse #rstats https://t.co/eLA3LfVAX9",0,1
"x935569091678691328","x1408013155578564610",2021-06-24 10:44:30,"tidyversetweets","Pivot_longer for multiple columns of repeated measurements data #tidyverse #rstats https://t.co/Bn3PNfl25I",0,1
"x935569091678691328","x1407926502679851008",2021-06-24 05:00:10,"tidyversetweets","Machine Learning Test/Train Optimization #tidyverse #rstats https://t.co/YaBQ0RBZgE",2,1
"x935569091678691328","x1408100438738538502",2021-06-24 16:31:20,"tidyversetweets","TOC Missing when opening pandoc pdf in Acrobat #tidyverse #rstats https://t.co/vcndGWDrqD",0,2
"x935569091678691328","x1408157250393358338",2021-06-24 20:17:05,"tidyversetweets","access multiple elements of same XML at different depths to convert to R tibble #tidyverse #rstats https://t.co/dzhvpY5HHT",0,1
"x935569091678691328","x1408034737931816965",2021-06-24 12:10:16,"tidyversetweets","GGplot histogram cutting off first values unless zoomed in #tidyverse #rstats https://t.co/727KE9wYMW",0,1
"x935569091678691328","x1408008653458710531",2021-06-24 10:26:37,"tidyversetweets","Issue in core R, utils #tidyverse #rstats https://t.co/mBnlIZkMjk",3,2
"x935569091678691328","x1407994642923098112",2021-06-24 09:30:56,"tidyversetweets","Performing matched risk set sampling (incidence density sampling) without replacement matching on two variables #tidyverse #rstats https://t.co/T3a1epblqa",0,1
"x935569091678691328","x1408070392569155593",2021-06-24 14:31:56,"tidyversetweets","Create an ""Other"" category by summing in dplyr #tidyverse #rstats https://t.co/o8UdjljTss",1,2
"x935569091678691328","x1408034737227190274",2021-06-24 12:10:16,"tidyversetweets","How to replace a variable with a variable from preceding column #tidyverse #rstats https://t.co/UTUIu3EUgd",0,1
"x935569091678691328","x1407977529256800256",2021-06-24 08:22:56,"tidyversetweets","Distorted geom_polygon with one group #tidyverse #rstats https://t.co/CY6aYQsgKs",0,1
"x935569091678691328","x1408034738464595970",2021-06-24 12:10:16,"tidyversetweets","Using any with dplyr #tidyverse #rstats https://t.co/fpPvrqwCuf",0,1
"x935569091678691328","x1407968116563456005",2021-06-24 07:45:32,"tidyversetweets","Setting limits for x and y using coord_sf after updating ggplot2 #tidyverse #rstats https://t.co/njQ7iQs3ys",0,1
"x233585808","x1407927088259158016",2021-06-24 05:02:30,"CRANberriesFeed","CRAN updates: AgroR COVIDIBGE mizer PNADcIBGE PNSIBGE POFIBGE SIPDIBGE xaringanthemer #rstats",1,1
"x233585808","x1408032748007268355",2021-06-24 12:02:21,"CRANberriesFeed","New CRAN package scutr with initial version 0.1.2 #rstats",2,2
"x233585808","x1408213933819838472",2021-06-25 00:02:19,"CRANberriesFeed","CRAN updates: codename MCMCvis mnreadR RstoxData survidm visvow #rstats",0,1
"x233585808","x1407972298955624454",2021-06-24 08:02:09,"CRANberriesFeed","New CRAN package iheiddown with initial version 0.8.2 #rstats",2,1
"x233585808","x1408017601494761475",2021-06-24 11:02:10,"CRANberriesFeed","New CRAN package occupancy with initial version 1.2 #rstats",1,2
"x233585808","x1407987378577367042",2021-06-24 09:02:04,"CRANberriesFeed","New CRAN package bayesrules with initial version 0.0.1 #rstats",0,1
"x233585808","x1408032679648546820",2021-06-24 12:02:05,"CRANberriesFeed","New CRAN package ahMLE with initial version 1.18 #rstats",1,2
"x233585808","x1407942109706035200",2021-06-24 06:02:11,"CRANberriesFeed","CRAN updates: simplevis #rstats",0,1
"x233585808","x1407972279896641538",2021-06-24 08:02:05,"CRANberriesFeed","New CRAN package bootGOF with initial version 0.1.0 #rstats",0,0
"x233585808","x1408032732542812168",2021-06-24 12:02:18,"CRANberriesFeed","New CRAN package PreProcessing with initial version 0.1.0 #rstats",1,2
"x233585808","x1408017579113955332",2021-06-24 11:02:05,"CRANberriesFeed","New CRAN package bigsimr with initial version 0.11.1 #rstats",1,2
"x233585808","x1408002513010409476",2021-06-24 10:02:13,"CRANberriesFeed","CRAN updates: lsasim nnTensor R2BEAT #rstats",1,2
"x233585808","x1407957278179971073",2021-06-24 07:02:28,"CRANberriesFeed","CRAN updates: colorspace glmmTMB glmnet policytree PResiduals psbcGroup SignacX wooldridge #rstats",2,2
"x233585808","x1408032739245400067",2021-06-24 12:02:19,"CRANberriesFeed","New CRAN package proteus with initial version 1.0.0 #rstats",2,2
"x233585808","x1408017619849027588",2021-06-24 11:02:14,"CRANberriesFeed","CRAN updates: mind scatterD3 #rstats",1,2
"x233585808","x1408032756228100099",2021-06-24 12:02:23,"CRANberriesFeed","CRAN updates: bdpar mapping #rstats",2,2
"x233585808","x1407972325975339008",2021-06-24 08:02:16,"CRANberriesFeed","New CRAN package prettyglm with initial version 0.1.0 #rstats",1,1
"x233585808","x1407972363539525635",2021-06-24 08:02:24,"CRANberriesFeed","CRAN updates: ranlip tergm #rstats",1,1
"x233585808","x1408198830022139909",2021-06-24 23:02:18,"CRANberriesFeed","CRAN updates: bigtime DImodels dyngen NFCP TraMineRextras #rstats",0,1
"x233585808","x1408228989110558730",2021-06-25 01:02:09,"CRANberriesFeed","CRAN updates: bayesAB #rstats",0,1
"x233585808","x1407972317628620801",2021-06-24 08:02:14,"CRANberriesFeed","New CRAN package OenoKPM with initial version 0.1.2 #rstats",0,0
"x233585808","x1407972347701833729",2021-06-24 08:02:21,"CRANberriesFeed","New CRAN package RDP with initial version 0.1.4 #rstats",0,0
"x233585808","x1407987413394284549",2021-06-24 09:02:13,"CRANberriesFeed","CRAN updates: broom #rstats",0,1
"x233585808","x1407972288251707395",2021-06-24 08:02:07,"CRANberriesFeed","New CRAN package crypto2 with initial version 1.3.0 #rstats",0,0
"x233585808","x1408032696207646723",2021-06-24 12:02:09,"CRANberriesFeed","New CRAN package CKMRpop with initial version 0.1.2 #rstats",2,2
"x1266166684055830529","x1408227412446351360",2021-06-25 00:55:53,"kevinkoegeI","First #TidyTuesday entry! I enjoyed poking around the @tpl_org ParkScore Index dataset. Lots of tidbits here I pulled straight from @rfortherest - can't recommend these #rstats resources highly enough! Code: https://t.co/vRMXg3cZy4 https://t.co/nzmyFQkWh4",1,2
"x1329756935449669635","x1408084831611854849",2021-06-24 15:29:19,"RHablamos","Configurar conexión entre Tableau Desktop y el lenguaje de programación R, tomado del Blog Hablamos R
#rstats #RStudio #TableauDesktop #tableau #datascience #programming #coding #blog #blogger #blogging #100DaysOfCode #data 
https://t.co/VAC1b3jAZ2",0,1
"x1329756935449669635","x1408073670417780741",2021-06-24 14:44:58,"RHablamos","Importar registros desde #MySQL hacia #RStudio, mediante una conexión #ODBC y el paquete #RODBC 
#rstats #RStudio #datascience #opensource #100daysofcode #coding #programming #statistics #estadistica #blog #blogger #blogging #database #sql #sqldeveloper 
https://t.co/yZlGkS8BWu",1,4
"x1329756935449669635","x1408089495291973635",2021-06-24 15:47:51,"RHablamos","Introduction to Data Science, es una certificación online y gratuita!!!, otorgada por el IBM Cognitive Class
#datascience #data #cienciadedatos #opensource #100daysofcode #coding #programming #python #rstats #rstudio #machinelearning #ibmwatson 
https://t.co/EByfFEvmjd",4,10
"x1329756935449669635","x1408094438740664321",2021-06-24 16:07:29,"RHablamos","Data Science Tools, certificación online y gratuita!!!, otorgada por el IBM Cognitive Class
#datascience #data #rstats #rstudio #python #pythonlearning #pythoncourse #opensource #100daysofcode #coding #programming #github #ibmwatson #tutorial #tutoriales 
https://t.co/GAZXTpIxnD",1,3
"x1329756935449669635","x1408227178433626114",2021-06-25 00:54:57,"RHablamos","Crear un Histograma de frecuencias en el lenguaje de programación R, haciendo uso de la función hist()
#histograma #estadistica #tutoriales #tutorial #rstats #rstudio #coding #programming #opensource #DataScience #100DaysOfCode #estadistica #Excel 
https://t.co/VYgTe9mMru",3,6
"x1329756935449669635","x1408079741995958273",2021-06-24 15:09:06,"RHablamos","Importar registros desde #Excel a #RStudio haciendo uso del paquete #openXLSX, tomado del Blog Hablamos R 
#rstats #RStudio #opensource #coding #programming #100daysofcode #microsoftexcel #excel #readxl #blog #blogger #blogging #data #estadistica  
https://t.co/6GoMmeo4RM",2,4
"x1329756935449669635","x1408102826656600064",2021-06-24 16:40:49,"RHablamos","Compartimos 36 artículos del Blog Hablamos R, desde como Ejecutar funciones de R en Power BI, pasando por la creación del diagrama de Ishikawa para terminar creando gráficos estadísticos con #ggplot2 
#rstats #RStudio #opensource #datascience #coding #data
https://t.co/6Xw9DR3pCO",1,6
"x1329756935449669635","x1408072188297580545",2021-06-24 14:39:05,"RHablamos","Importar registros desde #SPSS a #RStudio haciendo uso del paquete haven, tomado del #Blog Hablamos R 
#rstats #coding #programming #opensource #datascience #blogger #blogging #data #estadistica #statistics 
https://t.co/YQ10ENKmqn",0,4
"x1329756935449669635","x1408076512008540161",2021-06-24 14:56:15,"RHablamos","Importar registros desde SQL Server hacia #RStudio haciendo uso de una conexión #ODBC y el paquete #RODBC, tomado del Blog Hablamos R 
#rstats #RStudio #coding #programming #opensource #100DaysOfCode #blogger #blogging #data  #sql #sqlserver 
https://t.co/3bkGgG1NiU",0,6
