"user_id","status_id","created_at","screen_name","text","favorite_count","retweet_count"
"x935569091678691328","x1385755055979057152",2021-04-24 00:38:46,"tidyversetweets","Bookdown: why is final document title becoming the project title? #tidyverse #rstats https://t.co/NlbQqveuQg",0,0
"x935569091678691328","x1385718422017773571",2021-04-23 22:13:11,"tidyversetweets","Why is kableExtra add_footnote() causing book down compilation to fail? #tidyverse #rstats https://t.co/Pyg8TlFeBE",0,1
"x935569091678691328","x1385624800400314371",2021-04-23 16:01:10,"tidyversetweets","Select rows after condition in grouped data in R #tidyverse #rstats https://t.co/jWW7o6iIEZ",1,2
"x935569091678691328","x1385749875883577347",2021-04-24 00:18:11,"tidyversetweets","Histogram for multiple columns in R #tidyverse #rstats https://t.co/PYyaat0slz",0,1
"x935569091678691328","x1385665731094728705",2021-04-23 18:43:49,"tidyversetweets","Shiny Error, Input HTML must be a character vector of length 1 #tidyverse #rstats https://t.co/ZmMpLHuisH",1,2
"x935569091678691328","x1385588663145308166",2021-04-23 13:37:34,"tidyversetweets","Converting likert scale variables to be dichotomous #tidyverse #rstats https://t.co/UbsrYeDJqK",0,1
"x935569091678691328","x1385742169076428804",2021-04-23 23:47:33,"tidyversetweets","Replace NA values with modal value for factor variables in dplyr #tidyverse #rstats https://t.co/CWyNiSLFRV",0,1
"x935569091678691328","x1385742168472522754",2021-04-23 23:47:33,"tidyversetweets","modvizpop - Shiny Based Interface for Empowering Teams to Perform Real-Time Pharmacokinetic/Pharmacodynamic Simulations #tidyverse #rstats https://t.co/g9UDYVcOQU",0,1
"x935569091678691328","x1385622216906137603",2021-04-23 15:50:54,"tidyversetweets","Tooltip in geom_raster_interactive not returning correct value #tidyverse #rstats https://t.co/rsAwdmcGwL",1,2
"x935569091678691328","x1385622216331599873",2021-04-23 15:50:54,"tidyversetweets","Remove string in multiple variables in R #tidyverse #rstats https://t.co/UU84qNXqVr",1,2
"x935569091678691328","x1385739103719751684",2021-04-23 23:35:22,"tidyversetweets","Remove primary x axis and keep only duplicated secondary axis in ggplot #tidyverse #rstats https://t.co/6euN4E5ds9",0,1
"x935569091678691328","x1385557957081894914",2021-04-23 11:35:34,"tidyversetweets","Convert special characters in string to %HH code #tidyverse #rstats https://t.co/BXih1REw2Q",0,1
"x935569091678691328","x1385709492558438400",2021-04-23 21:37:42,"tidyversetweets","ggplot2::geom_path() in a loop #tidyverse #rstats https://t.co/KoHudXbpw3",2,2
"x935569091678691328","x1385638159480877057",2021-04-23 16:54:15,"tidyversetweets","Barplot for count data with multiple columns #tidyverse #rstats https://t.co/f7CcYOmiNb",2,2
"x935569091678691328","x1385660781321089026",2021-04-23 18:24:09,"tidyversetweets","Find the area enclosed by a loop function in r #tidyverse #rstats https://t.co/IkOm4v5yOo",1,2
"x935569091678691328","x1385660780859727877",2021-04-23 18:24:09,"tidyversetweets","error with LoadData (VecStatGraphs2D) #tidyverse #rstats https://t.co/7NXxG4Txqv",1,2
"x935569091678691328","x1385660780331163650",2021-04-23 18:24:09,"tidyversetweets","Unable to deploy shiny app - unable to access index for repository CRAN #tidyverse #rstats https://t.co/kRgERdmDEK",1,2
"x935569091678691328","x1385554660690317313",2021-04-23 11:22:28,"tidyversetweets","Bioconductor and Bioconda version mismatch when deploying application #tidyverse #rstats https://t.co/zxYOwpxiHg",0,1
"x935569091678691328","x1385732082425425920",2021-04-23 23:07:28,"tidyversetweets","install dplyr 'required package: stats' #tidyverse #rstats https://t.co/yvdAxAkUpL",0,1
"x935569091678691328","x1385482742108803076",2021-04-23 06:36:41,"tidyversetweets","Add tabber to rmarkdown navbar #tidyverse #rstats https://t.co/qOy7A8L5B3",0,1
"x935569091678691328","x1385529468890935296",2021-04-23 09:42:21,"tidyversetweets","Dplyr, Compare within row across multiple columns remove non-matching and create new row. R #tidyverse #rstats https://t.co/3L6LgTaRem",0,1
"x935569091678691328","x1385650255669039112",2021-04-23 17:42:19,"tidyversetweets","Coloring each quadrant on a ggplot xy scatter according to a color scale specified given by a third variable. geom_rect R #tidyverse #rstats https://t.co/l420OS9HeM",1,2
"x935569091678691328","x1385650255161487360",2021-04-23 17:42:19,"tidyversetweets","How to search values in expandable (nested) rows of a table? #tidyverse #rstats https://t.co/0uAa4z0Gfv",2,2
"x935569091678691328","x1385614687962746887",2021-04-23 15:20:59,"tidyversetweets","Prevent ggarrange() from hiding significance stars on plot(?) #tidyverse #rstats https://t.co/0L12EG1M2y",1,2
"x935569091678691328","x1385550794158526465",2021-04-23 11:07:06,"tidyversetweets","Group variables by values with % of each other #tidyverse #rstats https://t.co/PEuvpiUDRl",0,1
"x935569091678691328","x1385440961992396800",2021-04-23 03:50:40,"tidyversetweets","I need to finish off the outside lines and baseline for a halfcourt basketball court in R, and I can't seem to get the right coordinates using ggplot2 #tidyverse #rstats https://t.co/fsktV8ov1C",0,1
"x935569091678691328","x1385475000216346627",2021-04-23 06:05:55,"tidyversetweets","Is there a way to use an inverse pattern for stringr in R? #tidyverse #rstats https://t.co/5z1573ePRM",0,1
"x935569091678691328","x1385474999696334849",2021-04-23 06:05:55,"tidyversetweets","How to find city using lat and lon from shape file in R #tidyverse #rstats https://t.co/gNAaXAUTH3",4,3
"x935569091678691328","x1385525708097654785",2021-04-23 09:27:25,"tidyversetweets","Problem with ggplot2 packages in R, how to set colors and legends #tidyverse #rstats https://t.co/cn2tjouPbN",1,1
"x935569091678691328","x1385548933376536578",2021-04-23 10:59:42,"tidyversetweets","ioslides_presentation in RMarkdown: Overlay R-Code in a Column, Output overlay in the second Column #tidyverse #rstats https://t.co/k037uFEKwk",0,1
"x935569091678691328","x1385548932843917313",2021-04-23 10:59:42,"tidyversetweets","Ambiguity in conversion the Character to Date in R #tidyverse #rstats https://t.co/3cOFmKzDGX",0,1
"x935569091678691328","x1385429843106439168",2021-04-23 03:06:29,"tidyversetweets","R ggplot Sort Percent Stacked Bar Chart #tidyverse #rstats https://t.co/sSdstarJjx",0,1
"x935569091678691328","x1385610860303847427",2021-04-23 15:05:47,"tidyversetweets","Merging columns and only keeping the dummy variable #tidyverse #rstats https://t.co/J6szSN6GU7",0,1
"x935569091678691328","x1385610859846635520",2021-04-23 15:05:47,"tidyversetweets","ggplot: Putting geom_fundtion over geom_bar #tidyverse #rstats https://t.co/t8p8h9X5eA",0,1
"x935569091678691328","x1385466325607141376",2021-04-23 05:31:27,"tidyversetweets","How to scrape multiple tables on URL with rvest in R #tidyverse #rstats https://t.co/1n2j04YP6U",2,2
"x935569091678691328","x1385542226533445636",2021-04-23 10:33:03,"tidyversetweets","R: ggplot2 stat_bindot alternative for circle / round points - error produced #tidyverse #rstats https://t.co/kbORHRmkiF",1,1
"x935569091678691328","x1385645250119573519",2021-04-23 17:22:26,"tidyversetweets","Constructing a single linear predictor comprised of several predictors for predicted probability plots #tidyverse #rstats https://t.co/EIlgog4JqG",1,2
"x935569091678691328","x1385425926742319105",2021-04-23 02:50:55,"tidyversetweets","How can I re-write this code without using ggplot at all? #tidyverse #rstats https://t.co/tpQ5bFBKFb",0,1
"x935569091678691328","x1385532774468112386",2021-04-23 09:55:30,"tidyversetweets","Parsing failures message reading .csv file in readr package #tidyverse #rstats https://t.co/gERIkfQQgq",0,1
"x935569091678691328","x1385714959577870342",2021-04-23 21:59:26,"tidyversetweets","table unordered #tidyverse #rstats https://t.co/SUntxWuB7W",2,2
"x935569091678691328","x1385606599704670211",2021-04-23 14:48:51,"tidyversetweets","Change axis 10.000 to 10k and -10.000 to -10k in R #tidyverse #rstats https://t.co/2zIO1R5Wux",0,1
"x935569091678691328","x1385538348480036874",2021-04-23 10:17:38,"tidyversetweets","How can I order the subplot inside a plot in ggplot? #tidyverse #rstats https://t.co/GY4EqtciGH",1,1
"x935569091678691328","x1385529469398441986",2021-04-23 09:42:22,"tidyversetweets","how to plot timeseries events in a barcode style #tidyverse #rstats https://t.co/TYBhnPqJQ3",0,1
"x935569091678691328","x1385455531159031812",2021-04-23 04:48:33,"tidyversetweets","Arranging y-axis in ggplot2 heatmap - based on relation of variables #tidyverse #rstats https://t.co/lhW4t67LrN",0,1
"x935569091678691328","x1385455530655641600",2021-04-23 04:48:33,"tidyversetweets","Rename row names from a set of dataframe #tidyverse #rstats https://t.co/iJExLtOsKD",0,1
"x935569091678691328","x1385419729335066629",2021-04-23 02:26:17,"tidyversetweets","How to write a vector with internal structure to Excel in R? #tidyverse #rstats https://t.co/S17wLSfSXp",0,2
"x935569091678691328","x1385603378584064001",2021-04-23 14:36:03,"tidyversetweets","Tricky conditional imputation, ideally using Tidyverse #tidyverse #rstats https://t.co/SQpImu0IpZ",0,1
"x935569091678691328","x1385603378097524740",2021-04-23 14:36:03,"tidyversetweets","Web Scraping in R Timeout #tidyverse #rstats https://t.co/DqeR4LWRUr",0,1
"x935569091678691328","x1385603376843411463",2021-04-23 14:36:02,"tidyversetweets","Why Rmarkdown file cannot be knitted to HTML #tidyverse #rstats https://t.co/dY8f3Bs0Ae",0,1
"x935569091678691328","x1385532775017504770",2021-04-23 09:55:30,"tidyversetweets","Parameters in Rmarkdown for interactive filtering in an R chunk #tidyverse #rstats https://t.co/WA6Ha0NyEq",1,1
"x935569091678691328","x1385525708626096130",2021-04-23 09:27:25,"tidyversetweets","Can you convert an R raw vector representing an RDS file back into an R object without a round trip to disk? #tidyverse #rstats https://t.co/p0Rx3Kt3qE",0,1
"x935569091678691328","x1385446929249673218",2021-04-23 04:14:22,"tidyversetweets","R Shiny with Flexdashboard - Save reactive ggplot using download button #tidyverse #rstats https://t.co/XJucaStBHr",0,1
"x935569091678691328","x1385508236908892167",2021-04-23 08:17:59,"tidyversetweets","How to increase spaces between categories in ggplot? #tidyverse #rstats https://t.co/udc4ryw41F",0,1
"x935569091678691328","x1385673397812695041",2021-04-23 19:14:17,"tidyversetweets","select to drop and keep some variables in same select call #tidyverse #rstats https://t.co/8AxczdXFjI",1,2
"x935569091678691328","x1385632903594270720",2021-04-23 16:33:22,"tidyversetweets","Separate string into new columns of unknown number #tidyverse #rstats https://t.co/VI9MFRjJLn",1,2
"x935569091678691328","x1385683937926606850",2021-04-23 19:56:10,"tidyversetweets","Grouped bar plot in ggplot2 #tidyverse #rstats https://t.co/RG7Wtgax11",2,2
"x935569091678691328","x1385522306693226499",2021-04-23 09:13:54,"tidyversetweets","Add optional parameters to custom made stat in ggplot #tidyverse #rstats https://t.co/zfRP0gdjyP",0,1
"x935569091678691328","x1385702564268675078",2021-04-23 21:10:11,"tidyversetweets","UFO Sightings In Illinois - Shiny Contest Submission #tidyverse #rstats https://t.co/cXXE10pIz2",1,2
"x935569091678691328","x1385702563685691394",2021-04-23 21:10:10,"tidyversetweets","Anyone have issues with RStudio Cloud on a MAC #tidyverse #rstats https://t.co/rzznduJeWg",1,2
"x935569091678691328","x1385403325055520771",2021-04-23 01:21:06,"tidyversetweets","filter dataframe columns by data in matrix rows r #tidyverse #rstats https://t.co/wtFNsPaI5r",0,1
"x935569091678691328","x1385525709183979526",2021-04-23 09:27:25,"tidyversetweets","file.remove() with dynamic input in R #tidyverse #rstats https://t.co/yIJkT2EePk",0,1
"x935569091678691328","x1385425927329308673",2021-04-23 02:50:55,"tidyversetweets","Output missings in for ( ) loop interation #tidyverse #rstats https://t.co/vWxcRXv0lr",0,1
"x935569091678691328","x1385628428359983105",2021-04-23 16:15:35,"tidyversetweets","'Interpolation' of a missing date/value in R? #tidyverse #rstats https://t.co/sEl7l9oiCw",1,2
"x935569091678691328","x1385525707569197061",2021-04-23 09:27:25,"tidyversetweets","How to get same grouping results using dplyr to get result consistent with sqldf result? #tidyverse #rstats https://t.co/tA1H1deOGA",0,1
"x935569091678691328","x1385571647999012870",2021-04-23 12:29:58,"tidyversetweets","How to modify/remove R rows that don&amp;#39;t fit the regex pattern of the column? #tidyverse #rstats https://t.co/R43QEbZGku",2,1
"x935569091678691328","x1385516528850726917",2021-04-23 08:50:56,"tidyversetweets","The function is not re-scrape with R #tidyverse #rstats https://t.co/mkBamEsci9",0,1
"x935569091678691328","x1385673397326127106",2021-04-23 19:14:17,"tidyversetweets","Future doFuture foreach backend issue with mutate #tidyverse #rstats https://t.co/Y4Eik1RAOl",1,2
"x935569091678691328","x1385489935931633664",2021-04-23 07:05:16,"tidyversetweets","Countor plot of bivariate normal functions #tidyverse #rstats https://t.co/bH3ORwVeyh",1,2
"x935569091678691328","x1385522306177376256",2021-04-23 09:13:54,"tidyversetweets","Specifying colours and their order on plots in Likert package R #tidyverse #rstats https://t.co/PMNFrN12Fl",0,1
"x935569091678691328","x1385645251285618691",2021-04-23 17:22:26,"tidyversetweets","Use elements of array as names for expand_grid in R #tidyverse #rstats https://t.co/rH1r5mMuhs",1,2
"x935569091678691328","x1385645250698379265",2021-04-23 17:22:26,"tidyversetweets","Reverse primary y axis and revert secondary axis #tidyverse #rstats https://t.co/dJAUd6SBbJ",1,2
"x935569091678691328","x1385466325066153986",2021-04-23 05:31:27,"tidyversetweets","How to spread a single column based on multiple columns in R? #tidyverse #rstats https://t.co/RALdUamWhm",4,3
"x935569091678691328","x1385451350796820481",2021-04-23 04:31:57,"tidyversetweets","Display MathJax inside shinyalert modal #tidyverse #rstats https://t.co/OJn7aXc7Ef",0,1
"x935569091678691328","x1385618791283843075",2021-04-23 15:37:18,"tidyversetweets","glm function yields different results with same OS on different computers #tidyverse #rstats https://t.co/ghOHKD2iTe",1,1
"x935569091678691328","x1385411728469495809",2021-04-23 01:54:30,"tidyversetweets","Shading Between Lines Based On Percentages #tidyverse #rstats https://t.co/bcGls1aGGV",0,1
"x935569091678691328","x1385685413877010435",2021-04-23 20:02:02,"tidyversetweets","How to draw at a desired scale using ggplot2? #tidyverse #rstats https://t.co/qH3IWn4YxY",2,2
"x935569091678691328","x1385538348995932161",2021-04-23 10:17:39,"tidyversetweets","How to stop ggplot swapping the order of my samples? #tidyverse #rstats https://t.co/9XsqS03gX1",0,1
"x935569091678691328","x1385554660023422976",2021-04-23 11:22:27,"tidyversetweets","cannot publish to RSConnect _ Application deployment failed with error: An R package cannot be installed because a required system-level dependency is missing. (r-missing-system-library) #tidyverse #rstats https://t.co/udm1d1QRHl",0,1
"x935569091678691328","x1385502202505084928",2021-04-23 07:54:01,"tidyversetweets","The legend in ggplot doesn't work in Jupyter Lab but the same code works in the open-access JupyterLab platform #tidyverse #rstats https://t.co/AwFEwCcgud",0,1
"x935569091678691328","x1385680145541787651",2021-04-23 19:41:06,"tidyversetweets","Group periodic data in dataframe #tidyverse #rstats https://t.co/IxAAetPJvs",1,2
"x935569091678691328","x1385403325571473409",2021-04-23 01:21:07,"tidyversetweets","How to turn column data into column names? #tidyverse #rstats https://t.co/WKDAOEJZS6",0,1
"x935569091678691328","x1385597749484146689",2021-04-23 14:13:41,"tidyversetweets","New dataframe based on calculations on a existing one #tidyverse #rstats https://t.co/2HTBmbHgY4",0,1
"x935569091678691328","x1385606600224739328",2021-04-23 14:48:51,"tidyversetweets","Another 409 error on https://t.co/I6L1HWwhiW: cannot restart, update, or archive a Shiny app #tidyverse #rstats https://t.co/WsEEnAACfy",0,1
"x935569091678691328","x1385628428867575815",2021-04-23 16:15:35,"tidyversetweets","change ggplot color of single variable to red in R #tidyverse #rstats https://t.co/YUx14d8FHf",2,2
"x935569091678691328","x1385632904248578052",2021-04-23 16:33:22,"tidyversetweets","Enable site wide search for a collection of flexdashboards using fuse js #tidyverse #rstats https://t.co/GhfUeL2q0I",1,2
"x935569091678691328","x1385593847091142656",2021-04-23 13:58:10,"tidyversetweets","Add rows in a data.frame so that each group is of equal length #tidyverse #rstats https://t.co/pRj8j9ZIM0",1,1
"x935569091678691328","x1385395638158856195",2021-04-23 00:50:34,"tidyversetweets","remove ""()"" in Rdata #tidyverse #rstats https://t.co/A3S5wrimcW",1,1
"x935569091678691328","x1385425927799152643",2021-04-23 02:50:55,"tidyversetweets","Error in qqnorm When Knitting to PDF: ""Object not found Calls: &lt;Anonymous&gt; ... withCallingHandlers -&gt; withVisible #tidyverse #rstats https://t.co/rQkLLJBqnr",0,1
"x935569091678691328","x1385440962608910344",2021-04-23 03:50:40,"tidyversetweets","apply multiple logical functions to string to obtain a single final logical vector #tidyverse #rstats https://t.co/6sP1toK29c",1,1
"x935569091678691328","x1385502201968271361",2021-04-23 07:54:00,"tidyversetweets","Renaming column values based on criteria #tidyverse #rstats https://t.co/V33mVf0dZV",0,1
"x1203623631856779264","x1385753441809600512",2021-04-24 00:32:21,"icymi_r","✍️🧹🖥 Tidygeocoder 1.0.3 | Jesse Cambon

👤 Jesse Cambon @jessecambon  

🔗 https://t.co/GHKDGiBi9v
#rstats #datascience https://t.co/DbdLrlyOkV",5,2
"x1203623631856779264","x1385579880918790154",2021-04-23 13:02:41,"icymi_r","📦📊🌊 oce • Analysis of Oceanographic Data

👤 Dan Kelley, Clark Richards, PhD @ClarkGRichards

🔗 https://t.co/w2fXsl4f87
#rstats #datascience https://t.co/C9fAqV7sYS",13,7
"x1203623631856779264","x1385472603998113792",2021-04-23 05:56:24,"icymi_r","✍️📦🔤 Analyzing the programming languages used in R packages - Philippe Massicotte

👤 Philippe Massicotte @philmassicotte  

🔗 https://t.co/xbb01zm2i1
#rstats #datascience https://t.co/bIlqq5JbIo",8,9
"x1203623631856779264","x1385504306145730560",2021-04-23 08:02:22,"icymi_r","👥 Did you know you can keep up with updates from your favourite #rstats organisations and local meetups with this one handy list?

https://t.co/0YlkjXvTof",6,2
"x1203623631856779264","x1385405954049589252",2021-04-23 01:31:33,"icymi_r","✍️ Sometimes I R: How to analyze visual analog (slider) scale data?  A reasonable choice might be the zero-one-inflated beta model.

👤 Matti Vuorre @vuorre  

🔗 https://t.co/m4zS42mGFn
#rstats #datascience https://t.co/OAgbc40QXL",16,7
"x1203623631856779264","x1385718709516386308",2021-04-23 22:14:20,"icymi_r","✍️ Doubletten ausschließen in R: unique() und wie man es schneller macht | Statistik Dresden

👤 Statistik in Dresden @statistikindd  

🔗 https://t.co/IGbWFxmTrn
#rstats #datascience https://t.co/6X0tMUC29a",4,3
"x1203623631856779264","x1385545013556305920",2021-04-23 10:44:08,"icymi_r","📦🖥 caracas • Computer Algebra

👤 Mikkel M Andersen @mikldk; Søren Højsgaard @sorenhojsgaard  

🔗 https://t.co/h1RJpMn4IV
#rstats #datascience",4,7
"x1203623631856779264","x1385614558811852802",2021-04-23 15:20:28,"icymi_r","📦🖥 flow • View and Browse Code Using Flow Diagrams

👤 Antoine Fabri @antoine_fabri  

🔗 https://t.co/5Y3e8GFNrh
#rstats #datascience https://t.co/6bXEjQ0IBq",40,18
"x1203623631856779264","x1385683973343432707",2021-04-23 19:56:18,"icymi_r","✍️🏊 SwimmeR goes to the Para Games and other Updates - v0.9.0 – Swimming + Data Science

👤 Greg Pilgrim

🔗 https://t.co/xPrTL1az9f
#rstats #datascience",5,6
"x1203623631856779264","x1385509845386895360",2021-04-23 08:24:23,"icymi_r","✍️ Formatting Migration Recall Data for Longitudinal Analysis.  Use tidyr::pivot_longer to reshape wide data into a long format.

👤 Matt Gunther

🔗 https://t.co/IgbAENDdP6
#rstats #datascience",16,6
"x1203623631856779264","x1385475204592308224",2021-04-23 06:06:44,"icymi_r","✍️📊 Beeswarm en ggplot2 con ggbeeswarm | R CHARTS

👤 R CODER @rcoderweb  

🔗 https://t.co/jKpTmTqepi
#rstats #datascience https://t.co/TkLyYLNYSm",25,7
"x1203623631856779264","x1385440328216453123",2021-04-23 03:48:09,"icymi_r","✍️🗺 Hierarchical modelling of spatial data

👤 Lisa Gecchele, Coding Club @our_codingclub  

🔗 https://t.co/BPLYwapp2j
#rstats #datascience https://t.co/Ba8Yr1Qvw5",97,19
"x944231","x1385752186546688003",2021-04-24 00:27:21,"statwonk","List columns provide a ton of leverage! 💪 The #tidyverse makes it a delight to work with data. 🚀 

https://t.co/GS5qRUKIfL #rstats https://t.co/Quup8oL0K9",4,3
"x14209719","x1385750936015015945",2021-04-24 00:22:23,"jonkeane","@thomas_mock @gshotwell Thank the @ApacheArrow community!  I’m mostly just the messenger and fiddling with things on the edges. The community building arrow is bringing all of this to #rstats (and many other language bindings!) with just a little bit of connection work in the bindings",3,2
"x134938710","x1385386046779584520",2021-04-23 00:12:27,"InfometricsNZ","Our #30DayChartChallenge has gone to the dogs 🐶 so for a Day 8 (animals) catch up, economist Andrew Beattie looked at the most popular dog breeds in NZ. Another treemap made with #rstats https://t.co/JeRdn2dGk3",2,4
"x134938710","x1385749854232530947",2021-04-24 00:18:05,"InfometricsNZ","#30DayChartChallenge Day 10 (abstract)
Hopefully not too abstract. Answers on the back of a postcard.
Simple ggplot geom_col, with width=1.3 on the bars. #rstats https://t.co/qi10ifT6zL",1,3
"x134938710","x1385490908020240384",2021-04-23 07:09:08,"InfometricsNZ","#30DayChartChallenge Day 22 (animation)
@orphee_mickalad won the recent Palmerston North City Council by-election after 10 iterations of counting. Single Transferable Vote (STV) counts can be confusing - @dakvid's animated bar chart shows the transfer of votes
#rstats {gganimate} https://t.co/IvAv7sB70P",3,5
"x1241814552","x1385748801252564993",2021-04-24 00:13:54,"thomas_mock","@gshotwell @jonkeane And that  #rstats reality gets closer and closer!

Current unreleased {arrow} nightly:

""dplyr::mutate() is now supported in Arrow for many applications.""

https://t.co/d73Hnll8LY",5,3
"x844152803991994368","x1385739205138165760",2021-04-23 23:35:46,"rweekly_live","Which #TidyTuesday Netflix titles are movies and which are TV shows? @juliasilge #rstats #datascience https://t.co/6bl4pL0yUd",3,5
"x844152803991994368","x1385384356907192328",2021-04-23 00:05:44,"rweekly_live","drat 0.2.0: Now with ‘docs/’ @eddelbuettel #rstats #datascience https://t.co/MzEz3wISKV",4,5
"x844152803991994368","x1385746756902789121",2021-04-24 00:05:47,"rweekly_live","haven 2.4.0 #rstats #datascience https://t.co/BOstGR9rSP",5,5
"x844152803991994368","x1385701450454556684",2021-04-23 21:05:45,"rweekly_live","What is the Tukey loss function? #rstats #datascience https://t.co/Poqm4cqbEk",4,6
"x844152803991994368","x1385678807651295234",2021-04-23 19:35:47,"rweekly_live","recipes 0.1.16 #rstats #datascience https://t.co/1OIbf2YIXW",3,2
"x844152803991994368","x1385678807110201348",2021-04-23 19:35:46,"rweekly_live","Short-circuit evaluation of boolean operations in R        #rstats #datascience https://t.co/8HKLtoJcLl",4,4
"x103516223","x1385740673895202818",2021-04-23 23:41:37,"mdsumner","#rstats why I'm excited about this

 we can now have a single in-memory mesh version of any spatial object ready for direct 3D interactive plotting

it rounds out the models in {silicate} that provide the various ways of representing spatial data, we can snap directly to vis /1 https://t.co/UobQzFs7Vr",3,2
"x103516223","x1385743170982453249",2021-04-23 23:51:32,"mdsumner","#rstats I said ""in-memory"" but large meshes can be easily reduced to a query from a data store, it's the same with the indices, they all live together - we can run queries that are geometry- (vertex), topology- (index) or object- (shape) focussed 

{rgl} #mesh3d https://t.co/Mh2bsGr6ty",0,2
"x103516223","x1385742420143337472",2021-04-23 23:48:33,"mdsumner","{anglr} augments {silicate} with a one-step jump to mesh3d, but left an awkward gap because mesh3d had no point, edges, or lines in its structure, but now it does  so it's time for a reboot👌

#rstats
4/4",0,1
"x103516223","x1385541847095791619",2021-04-23 10:31:33,"mdsumner","#rstats {rgl} update just hit CRAN supports points and lines in.mesh3d
https://t.co/1UL1VJDuPh

🤯🥳 expect more from me on this 😜",9,4
"x103516223","x1385443289730412546",2021-04-23 03:59:55,"mdsumner","#rstats convex hull in 3D geometry, 2D and 1D topology with mesh3d https://t.co/JPcYRj4HvN",2,2
"x899690604","x1385738349495734272",2021-04-23 23:32:22,"JenRichmondPhD","Last internship class of the term and we made memes in #rstats - so fun! Some of my favourites below.... thanks to @sctyner for the memer package! 

And super thanks to my dream teaching team @katefaasse and @djnavarro !! 💜💜💜",9,4
"x268619848","x1385710611707858945",2021-04-23 21:42:09,"Sheraj99","Taxonomy of Principal Distances for #MachineLearning. #BigData #Analytics #DataScience #AI #IoT #IIoT #Python #RStats #Java #JavaScript #ReactJS #CloudComputing #Serverless #DataScientist #Linux #Mathematics #Statistics #Programming #Coding #100DaysofCode 
https://t.co/RWDQ1B6T3J",0,4
"x268619848","x1385598809368059905",2021-04-23 14:17:53,"Sheraj99","AI Best: 10 Popular Must-read Free Books. #BigData #Analytics #DataScience #IoT #IIoT #PyTorch #Python #RStats #TensorFlow #Java #JavaScript #ReactJS #CloudComputing #Serverless #DataScientist #Linux #Books #Programming #Coding #100DaysofCode 
https://t.co/Mz3BffWszR",9,21
