"user_id","status_id","created_at","screen_name","text","favorite_count","retweet_count"
"x392623479","x1493031438316417034",2022-02-14 01:16:48,"NadarSenpai","Centralizing your Analytics Infrastructure with eoda and Covestro #Analytics #DataScience #AI #ML #RStats #Python #coding #DataAnalytics https://t.co/xdetsitmS6",0,3
"x392623479","x1492980755374485510",2022-02-13 21:55:24,"NadarSenpai","RStudio Community Monthly Events - January 2022 #Analytics #DataScience #AI #ML #RStats #Python #coding #DataAnalytics https://t.co/hwn97iYOnX",0,0
"x392623479","x1493030681718366210",2022-02-14 01:13:48,"NadarSenpai","(Re)Introducing the ""Solutions"" website #Analytics #DataScience #AI #ML #RStats #Python #coding #DataAnalytics https://t.co/K1KTYQ5cVU",0,4
"x392623479","x1492889942468567041",2022-02-13 15:54:33,"NadarSenpai","11 Extensions to Power Up your Jupyter Notebook #Analytics #DataScience #AI #ML #RStats #Python #coding #DataAnalytics https://t.co/C3NgYy7pdX",1,1
"x392623479","x1492933072706314242",2022-02-13 18:45:56,"NadarSenpai","Bridging The Big Data Divide - Forbes #Analytics #DataScience #AI #ML #RStats #Python #coding #DataAnalytics https://t.co/GKasVnU3uv",0,0
"x392623479","x1493029168707256322",2022-02-14 01:07:47,"NadarSenpai","Announcing RStudio Workbench #Analytics #DataScience #AI #ML #RStats #Python #coding #DataAnalytics https://t.co/hYbMNN4Vyl",0,2
"x392623479","x1493028412306436096",2022-02-14 01:04:47,"NadarSenpai","Building Effective Data Science Teams #Analytics #DataScience #AI #ML #RStats #Python #coding #DataAnalytics https://t.co/oejqDGJ0MO",1,4
"x392623479","x1492932316183810049",2022-02-13 18:42:56,"NadarSenpai","Data Science for More Effective Farm Inputs - AG INFORMATION NETWORK OF THE WEST - AGInfo Ag Information Network Of The West #Analytics #DataScience #AI #ML #RStats #Python #coding #DataAnalytics https://t.co/4EcN4IM5lp",3,2
"x392623479","x1492808199887630337",2022-02-13 10:29:44,"NadarSenpai","I trained a model. What is next? #Analytics #DataScience #AI #ML #RStats #Python #coding #DataAnalytics https://t.co/b1Z64XNxak",0,1
"x392623479","x1492978485874282496",2022-02-13 21:46:23,"NadarSenpai","Sharing Secure and Scalable Shiny Apps on RStudio Connect #Analytics #DataScience #AI #ML #RStats #Python #coding #DataAnalytics https://t.co/vTP60NpuhB",0,0
"x392623479","x1493027655800827905",2022-02-14 01:01:46,"NadarSenpai","Upcoming Webinar - Incorporating R into your Clinical Legacy Workflows #Analytics #DataScience #AI #ML #RStats #Python #coding #DataAnalytics https://t.co/ay77uJOSiS",1,2
"x392623479","x1492931559682363393",2022-02-13 18:39:55,"NadarSenpai","From ""data for good"" to ""data for impact"" - NationSwell #Analytics #DataScience #AI #ML #RStats #Python #coding #DataAnalytics https://t.co/TAIUM5F7if",0,1
"x392623479","x1492886899639435266",2022-02-13 15:42:28,"NadarSenpai","Data scientists who use their skills to earn extra money aside from their main jobs or use these skills in investment, how do you do this ? How did you start ? #Analytics #DataScience #AI #ML #RStats #Python #coding #DataAnalytics https://t.co/t8fMkwo5Ck",2,2
"x392623479","x1492846797680787457",2022-02-13 13:03:06,"NadarSenpai","7 Ways To Increase Revenue of Your WooCommerce Store [Tips and Plugins] #Analytics #DataScience #AI #ML #RStats #Python #coding #DataAnalytics https://t.co/seN2GmS4oC",1,1
"x392623479","x1492930803193593860",2022-02-13 18:36:55,"NadarSenpai","Data science, Cybersecurity and the Metaverse Future of Higher Education - DATAQUEST #Analytics #DataScience #AI #ML #RStats #Python #coding #DataAnalytics https://t.co/XsK22NelRx",2,4
"x392623479","x1492930046700445702",2022-02-13 18:33:55,"NadarSenpai","College of Arts &amp; Sciences receives grant to initiate instructional programs in Big Data Analytics and Artificial Intelligence - Tuskegee University #Analytics #DataScience #AI #ML #RStats #Python #coding #DataAnalytics https://t.co/5GwmcRG4rw",2,1
"x392623479","x1493026899370643458",2022-02-14 00:58:46,"NadarSenpai","RStudio v1.4 Update: What's New #Analytics #DataScience #AI #ML #RStats #Python #coding #DataAnalytics https://t.co/qKxrZGUN3o",1,1
"x392623479","x1493026142898556929",2022-02-14 00:55:46,"NadarSenpai","Building Effective Data Science Teams: Answering Your Questions #Analytics #DataScience #AI #ML #RStats #Python #coding #DataAnalytics https://t.co/DXQxNEB2sK",2,3
"x392623479","x1493025386497728514",2022-02-14 00:52:45,"NadarSenpai","Debunking the Myths of R vs. Python #Analytics #DataScience #AI #ML #RStats #Python #coding #DataAnalytics https://t.co/XjiPfEPsbF",0,0
"x392623479","x1492927020669546499",2022-02-13 18:21:53,"NadarSenpai","insideBIGDATA Guide to How Data Analytics is Transforming Healthcare - insideBIGDATA #Analytics #DataScience #AI #ML #RStats #Python #coding #DataAnalytics https://t.co/i8JxNBENGr",0,0
"x392623479","x1493024630092750848",2022-02-14 00:49:45,"NadarSenpai","R in Supply Chain Management: Meetup Q&amp;A #Analytics #DataScience #AI #ML #RStats #Python #coding #DataAnalytics https://t.co/SQMEk68JCF",0,0
"x392623479","x1493023873692020736",2022-02-14 00:46:45,"NadarSenpai","Winners of the 3rd annual Shiny Contest #Analytics #DataScience #AI #ML #RStats #Python #coding #DataAnalytics https://t.co/Qm6bknYLgp",1,0
"x392623479","x1493023117198995457",2022-02-14 00:43:44,"NadarSenpai","Strategic Analytics at Monash University: How RStudio Accelerated the Transformation #Analytics #DataScience #AI #ML #RStats #Python #coding #DataAnalytics https://t.co/8A2OeKvnEq",0,0
"x392623479","x1492883873616826372",2022-02-13 15:30:26,"NadarSenpai","Is it a thing to convert a messy spreadsheet into a small relational database for ease of use? Or would you use other cleaning/tidying techniques? Newbie here, advice very welcome! #Analytics #DataScience #AI #ML #RStats #Python #coding #DataAnalytics https://t.co/z7QSjbpnge",1,3
"x392623479","x1493022360831770624",2022-02-14 00:40:44,"NadarSenpai","RStudio Professional Drivers 1.8.0 #Analytics #DataScience #AI #ML #RStats #Python #coding #DataAnalytics https://t.co/BS9XKFaj4p",1,0
"x392623479","x1493021604338708482",2022-02-14 00:37:44,"NadarSenpai","Shiny, Tableau, and PowerBI: Better Business Intelligence #Analytics #DataScience #AI #ML #RStats #Python #coding #DataAnalytics https://t.co/oUwbGcUVDv",0,0
"x392623479","x1493020847778455558",2022-02-14 00:34:43,"NadarSenpai","A CEO’s View of Open Source Data Science in the Enterprise #Analytics #DataScience #AI #ML #RStats #Python #coding #DataAnalytics https://t.co/IaUz77a7eI",1,3
"x392623479","x1492973190527737857",2022-02-13 21:25:21,"NadarSenpai","How BI and Data Science Deliver Deeper Insight Together #Analytics #DataScience #AI #ML #RStats #Python #coding #DataAnalytics https://t.co/wiwOqSbaYA",4,2
"x392623479","x1492972412958396419",2022-02-13 21:22:15,"NadarSenpai","Data Science Education Lacks a Much-Needed Focus on Ethics - Nextgov #Analytics #DataScience #AI #ML #RStats #Python #coding #DataAnalytics https://t.co/Nk3IOFNVJg",1,1
"x392623479","x1493020091335729156",2022-02-14 00:31:43,"NadarSenpai","Advice to Aspiring Sports Analytics Professionals #Analytics #DataScience #AI #ML #RStats #Python #coding #DataAnalytics https://t.co/C1xSUkmHiC",0,0
"x392623479","x1492970899955400711",2022-02-13 21:16:15,"NadarSenpai","The Rare Disease Treatment Market to ride on data science - Medgadget #Analytics #DataScience #AI #ML #RStats #Python #coding #DataAnalytics https://t.co/X55IKnoDf3",0,0
"x392623479","x1492970143349100549",2022-02-13 21:13:14,"NadarSenpai","Silicon Valley employees go away from large companies to Web3. What is the future of the Internet? - CryptoSlate #Analytics #DataScience #AI #ML #RStats #Python #coding #DataAnalytics https://t.co/N8rBgxky4V",0,0
"x392623479","x1492880847258673157",2022-02-13 15:18:25,"NadarSenpai","Is a computer science degree fine to intern/work in data science? #Analytics #DataScience #AI #ML #RStats #Python #coding #DataAnalytics https://t.co/H2wiwYurVM",1,3
"x392623479","x1493019334884610049",2022-02-14 00:28:43,"NadarSenpai","Top 3 Coding Best Practices from the Shiny Contest #Analytics #DataScience #AI #ML #RStats #Python #coding #DataAnalytics https://t.co/MZ5NJsrxvz",0,0
"x392623479","x1493018578307760130",2022-02-14 00:25:42,"NadarSenpai","Shiny Apps from Concept to Production - An RStudio Community X-Session with Appsilon #Analytics #DataScience #AI #ML #RStats #Python #coding #DataAnalytics https://t.co/Lka3BXdBVX",0,0
"x392623479","x1492968630107189253",2022-02-13 21:07:14,"NadarSenpai","Top YouTube channels to learn programming in 2022 - Analytics India Magazine #Analytics #DataScience #AI #ML #RStats #Python #coding #DataAnalytics https://t.co/C56lLRm6jK",0,0
"x392623479","x1492967873538629636",2022-02-13 21:04:13,"NadarSenpai","NFL taps data science community to help track head impacts - The Star Online #Analytics #DataScience #AI #ML #RStats #Python #coding #DataAnalytics https://t.co/9dIOcEG9Z7",1,4
"x392623479","x1493017821827289089",2022-02-14 00:22:42,"NadarSenpai","RStudio Connect 1.9.0 - Content Curation Tools #Analytics #DataScience #AI #ML #RStats #Python #coding #DataAnalytics https://t.co/1XrZ2l4a6z",1,0
"x392623479","x1493017065371885568",2022-02-14 00:19:41,"NadarSenpai","R in Healthcare Meetup Q&amp;A #Analytics #DataScience #AI #ML #RStats #Python #coding #DataAnalytics https://t.co/MZP6uafLoe",0,3
"x392623479","x1493016308857905163",2022-02-14 00:16:41,"NadarSenpai","RStudio Cloud: An inclusive solution for learning R #Analytics #DataScience #AI #ML #RStats #Python #coding #DataAnalytics https://t.co/7UDpP3s5Zs",0,0
"x392623479","x1492965604076273666",2022-02-13 20:55:12,"NadarSenpai","UW-Madison Chancellor Blank presents her final report to the Board (day 1 news summary) - University of Wisconsin System #Analytics #DataScience #AI #ML #RStats #Python #coding #DataAnalytics https://t.co/SjPgtA8oEy",0,0
"x392623479","x1492964847549624329",2022-02-13 20:52:12,"NadarSenpai","Data Management News for the Week of February 10; Updates from Promethium, Superconductive, Pepperdata, and More - Solutions Review #Analytics #DataScience #AI #ML #RStats #Python #coding #DataAnalytics https://t.co/QeNlcV9FX3",0,1
"x392623479","x1493015552473894918",2022-02-14 00:13:41,"NadarSenpai","Democratizing Data with R, Python, and Slack #Analytics #DataScience #AI #ML #RStats #Python #coding #DataAnalytics https://t.co/T7VEivGXnz",0,0
"x392623479","x1493014796064731139",2022-02-14 00:10:40,"NadarSenpai","RStudio Voices - Julia Silge #Analytics #DataScience #AI #ML #RStats #Python #coding #DataAnalytics https://t.co/AZ98l30TtL",0,0
"x392623479","x1493014039580090380",2022-02-14 00:07:40,"NadarSenpai","Using Shiny in Healthcare: Examples from the 2021 Shiny Contest #Analytics #DataScience #AI #ML #RStats #Python #coding #DataAnalytics https://t.co/1op8glEpkl",0,0
"x392623479","x1493013283137273867",2022-02-14 00:04:40,"NadarSenpai","Announcing bookdown v0.23 #Analytics #DataScience #AI #ML #RStats #Python #coding #DataAnalytics https://t.co/z2Q1AcbIzg",0,0
"x392623479","x1492877064793432069",2022-02-13 15:03:23,"NadarSenpai","What are your team's Google Cloud Platform (GCP) tips and tricks? #Analytics #DataScience #AI #ML #RStats #Python #coding #DataAnalytics https://t.co/7uUQuBqQQh",1,1
"x392623479","x1493012526736498705",2022-02-14 00:01:39,"NadarSenpai","pins 0.4.0: Versioning #Analytics #DataScience #AI #ML #RStats #Python #coding #DataAnalytics https://t.co/3xONVPnjSh",0,1
"x392623479","x1492913403333120003",2022-02-13 17:27:47,"NadarSenpai","Data Science Careers Q&amp;A With Adobe | Data and Lifelong Learning - Datamation #Analytics #DataScience #AI #ML #RStats #Python #coding #DataAnalytics https://t.co/XO2kTZ3MPH",5,5
"x392623479","x1493011770285379589",2022-02-13 23:58:39,"NadarSenpai","Cheatsheet Updates #Analytics #DataScience #AI #ML #RStats #Python #coding #DataAnalytics https://t.co/hcqzyGEezH",0,1
"x392623479","x1492961821208236036",2022-02-13 20:40:10,"NadarSenpai","Meet The Winners Of The 'Dare In Reality' Hackathon - Analytics India Magazine #Analytics #DataScience #AI #ML #RStats #Python #coding #DataAnalytics https://t.co/8lQySp1L84",0,0
"x392623479","x1493011013830168578",2022-02-13 23:55:39,"NadarSenpai","Practical Advice for R in Production -  Answering Your Questions #Analytics #DataScience #AI #ML #RStats #Python #coding #DataAnalytics https://t.co/09BP4NECoh",0,1
"x392623479","x1492960308083761155",2022-02-13 20:34:09,"NadarSenpai","Two Market Research Industry Firsts: M Science &amp; Sundial Launching an Exclusive Consumer Transaction Data Solution and a No-code Analysis Tool - Business Wire #Analytics #DataScience #AI #ML #RStats #Python #coding #DataAnalytics https://t.co/ind25TklPq",0,2
"x392623479","x1493010257408311298",2022-02-13 23:52:38,"NadarSenpai","RStudio Connect 2021.08.0 Python Updates #Analytics #DataScience #AI #ML #RStats #Python #coding #DataAnalytics https://t.co/AlYmr7c0V3",0,1
"x392623479","x1493009501024313350",2022-02-13 23:49:38,"NadarSenpai","RStudio Connect 2021.08.0 Custom Branding #Analytics #DataScience #AI #ML #RStats #Python #coding #DataAnalytics https://t.co/JH0ayaTHRT",0,0
"x392623479","x1493008744556503041",2022-02-13 23:46:38,"NadarSenpai","Announcing Calendar Based Versioning for All Commercial RStudio Products #Analytics #DataScience #AI #ML #RStats #Python #coding #DataAnalytics https://t.co/B5csee1VE0",0,0
"x392623479","x1493007988138860547",2022-02-13 23:43:37,"NadarSenpai","My Excel and R Journey in Financial Services #Analytics #DataScience #AI #ML #RStats #Python #coding #DataAnalytics https://t.co/McWHtvRLbb",0,0
"x392623479","x1493007231612293123",2022-02-13 23:40:37,"NadarSenpai","How do you use Shiny to communicate to 8 million people? #Analytics #DataScience #AI #ML #RStats #Python #coding #DataAnalytics https://t.co/icYN0d3sbF",0,0
"x392623479","x1492957281994035207",2022-02-13 20:22:08,"NadarSenpai","Tiger Global Backs Devron to Deliver Breakthrough Private Data Analysis - PRNewswire #Analytics #DataScience #AI #ML #RStats #Python #coding #DataAnalytics https://t.co/zN0zpdT6dH",2,1
"x392623479","x1493005718814871555",2022-02-13 23:34:36,"NadarSenpai","RStudio Workbench Load Balancing Changes #Analytics #DataScience #AI #ML #RStats #Python #coding #DataAnalytics https://t.co/92ZCR5J8WH",0,0
"x392623479","x1492956525387730953",2022-02-13 20:19:08,"NadarSenpai","Newgen buys data science company Number Theory - Times of India #Analytics #DataScience #AI #ML #RStats #Python #coding #DataAnalytics https://t.co/CVdO5YGP0C",0,3
"x392623479","x1493004962326065154",2022-02-13 23:31:36,"NadarSenpai","RStudio Package Manager 2021.09.0 - Capturing and Maintaining Working Repositories #Analytics #DataScience #AI #ML #RStats #Python #coding #DataAnalytics https://t.co/Cd9Qz7u874",0,1
"x392623479","x1492910377012764678",2022-02-13 17:15:45,"NadarSenpai","Data science and diversity - https://t.co/jgC8JrWyda #Analytics #DataScience #AI #ML #RStats #Python #coding #DataAnalytics https://t.co/WIRb7xb6ss",0,0
"x392623479","x1492955012372303876",2022-02-13 20:13:07,"NadarSenpai","Indium Positioned as a Strong Contender in ISG's Provider Lens Analytics Services US Report 2021 - Business Wire #Analytics #DataScience #AI #ML #RStats #Python #coding #DataAnalytics https://t.co/Fy7yqipbff",0,0
"x392623479","x1493004205791002626",2022-02-13 23:28:35,"NadarSenpai","Curating for @WeAreRLadies on Twitter #Analytics #DataScience #AI #ML #RStats #Python #coding #DataAnalytics https://t.co/Vl6lq8Yyga",0,1
"x392623479","x1493003449339891712",2022-02-13 23:25:35,"NadarSenpai","What's New on RStudio Cloud - September 2021 #Analytics #DataScience #AI #ML #RStats #Python #coding #DataAnalytics https://t.co/9w0oRg1DU0",0,0
"x392623479","x1492952742872113157",2022-02-13 20:04:06,"NadarSenpai","Virtual CXO Roundtable discussion on Transforming Analytics with Modern Data Lakes, Data Warehouses and Cloud - Analytics India Magazine #Analytics #DataScience #AI #ML #RStats #Python #coding #DataAnalytics https://t.co/WrfV3nu5v7",0,0
"x392623479","x1492869499518869510",2022-02-13 14:33:19,"NadarSenpai","Do you guys actually know how to use git? #Analytics #DataScience #AI #ML #RStats #Python #coding #DataAnalytics https://t.co/kMY2ktz8im",0,1
"x392623479","x1493002692947546115",2022-02-13 23:22:35,"NadarSenpai","RStudio 2021.09.0 Update: What's New #Analytics #DataScience #AI #ML #RStats #Python #coding #DataAnalytics https://t.co/ZUVDJxphHi",0,1
"x392623479","x1493001936433467394",2022-02-13 23:19:34,"NadarSenpai","How to Use shinyMatrix and plotly Graphs as Inputs in a Shiny App #Analytics #DataScience #AI #ML #RStats #Python #coding #DataAnalytics https://t.co/10DsKya8ac",0,3
"x392623479","x1493001180053753857",2022-02-13 23:16:34,"NadarSenpai","An RStudio Table Contest for 2021 #Analytics #DataScience #AI #ML #RStats #Python #coding #DataAnalytics https://t.co/Xn556DCGsm",0,0
"x392623479","x1493000423619375105",2022-02-13 23:13:34,"NadarSenpai","pins 1.0.0 #Analytics #DataScience #AI #ML #RStats #Python #coding #DataAnalytics https://t.co/8oaee6ipfW",0,0
"x392623479","x1492999667101151239",2022-02-13 23:10:33,"NadarSenpai","Teaching a Biomedical Data Science Course Using RStudio Cloud #Analytics #DataScience #AI #ML #RStats #Python #coding #DataAnalytics https://t.co/mtNKal76Cn",3,4
"x392623479","x1492949716790919170",2022-02-13 19:52:04,"NadarSenpai","The 10 Most Important Jobs for ML Products in 2022 - DataDrivenInvestor #Analytics #DataScience #AI #ML #RStats #Python #coding #DataAnalytics https://t.co/LwmoqzN3Je",0,1
"x392623479","x1492784645674610690",2022-02-13 08:56:08,"NadarSenpai","Shiny v1.3.2 #Analytics #DataScience #AI #ML #RStats #Python #coding #DataAnalytics https://t.co/ZsqdgvR29D",0,0
"x392623479","x1492998910557700096",2022-02-13 23:07:33,"NadarSenpai","RStudio Connect 2021.09.0 Tableau Analytics Extensions #Analytics #DataScience #AI #ML #RStats #Python #coding #DataAnalytics https://t.co/brRBgVfBzv",0,0
"x392623479","x1492905081213177862",2022-02-13 16:54:42,"NadarSenpai","Best Online Master's in Data Science Programs in 2022 - Fortune #Analytics #DataScience #AI #ML #RStats #Python #coding #DataAnalytics https://t.co/W8xDtdtzGn",3,1
"x392623479","x1492998154047868928",2022-02-13 23:04:33,"NadarSenpai","Why Your Data Science Team Might Need a Shiny Deployment Engineer #Analytics #DataScience #AI #ML #RStats #Python #coding #DataAnalytics https://t.co/O9VQW9FTNJ",3,3
"x392623479","x1492947447240351749",2022-02-13 19:43:03,"NadarSenpai","£23 million to boost skills and diversity in AI jobs - https://t.co/f1Ub0We7gx #Analytics #DataScience #AI #ML #RStats #Python #coding #DataAnalytics https://t.co/A2tiUwE2om",0,0
"x392623479","x1492997397559009286",2022-02-13 23:01:32,"NadarSenpai","The INSPIRE U2 Program: Training Students in Big Data and Statistics Using RStudio #Analytics #DataScience #AI #ML #RStats #Python #coding #DataAnalytics https://t.co/82E1AQsVpw",0,2
"x392623479","x1492863445183746055",2022-02-13 14:09:16,"NadarSenpai","How to calculate Power Regression in R (Step-by-Step Guide) #Analytics #DataScience #AI #ML #RStats #Python #coding #DataAnalytics https://t.co/Zz9cAt1wvA",2,1
"x392623479","x1492945934170402819",2022-02-13 19:37:02,"NadarSenpai","New director appointed to SFI's Insight centre for data analytics at NUIG - https://t.co/x76Qi0IgSp #Analytics #DataScience #AI #ML #RStats #Python #coding #DataAnalytics https://t.co/7R58RFwQPV",0,1
"x392623479","x1492862688740970500",2022-02-13 14:06:15,"NadarSenpai","How to use R Markdown (part one) #Analytics #DataScience #AI #ML #RStats #Python #coding #DataAnalytics https://t.co/fuW62IBdoc",1,0
"x392623479","x1492996641078583303",2022-02-13 22:58:32,"NadarSenpai","Embedding Shiny Apps in Tableau Dashboards Using shinytableau #Analytics #DataScience #AI #ML #RStats #Python #coding #DataAnalytics https://t.co/kbN0yDVt9j",0,0
"x392623479","x1492995884543524864",2022-02-13 22:55:32,"NadarSenpai","The INSPIRE U2 Program: Student Reflections on Data Science Training #Analytics #DataScience #AI #ML #RStats #Python #coding #DataAnalytics https://t.co/k7k0p5vlz9",3,1
"x392623479","x1492943664611569670",2022-02-13 19:28:01,"NadarSenpai","Why Big Data Analytics, AI/ML will be the Most In-Demand Skills in India in 2022? - Analytics Insight #Analytics #DataScience #AI #ML #RStats #Python #coding #DataAnalytics https://t.co/XISlMc02ov",0,1
"x392623479","x1492781620079771653",2022-02-13 08:44:07,"NadarSenpai","Introducing SAML in RStudio Connect #Analytics #DataScience #AI #ML #RStats #Python #coding #DataAnalytics https://t.co/XHTWSNZCII",0,1
"x392623479","x1492995128117583877",2022-02-13 22:52:31,"NadarSenpai","RStudio Professional Drivers 2021.10.0 #Analytics #DataScience #AI #ML #RStats #Python #coding #DataAnalytics https://t.co/CHM6OSvCG7",0,1
"x392623479","x1492860419471519746",2022-02-13 13:57:14,"NadarSenpai","Beginner’s guide to machine learning in R (with step-by-step tutorial) #Analytics #DataScience #AI #ML #RStats #Python #coding #DataAnalytics https://t.co/5g3hW8K2Tm",1,2
"x392623479","x1492994371561603076",2022-02-13 22:49:31,"NadarSenpai","How Data Scientists and Security Teams Can Effectively Work Together #Analytics #DataScience #AI #ML #RStats #Python #coding #DataAnalytics https://t.co/0t2k0Arf4F",0,0
"x392623479","x1492942151348625410",2022-02-13 19:22:01,"NadarSenpai","Bayous: What Data Lakes Have Become | by Sanjiv Khosla | Xplore | Feb, 2022 - Medium #Analytics #DataScience #AI #ML #RStats #Python #coding #DataAnalytics https://t.co/sJZrHxXJpv",0,2
"x392623479","x1492993615202816002",2022-02-13 22:46:31,"NadarSenpai","RStudio at R/Pharma 2021 #Analytics #DataScience #AI #ML #RStats #Python #coding #DataAnalytics https://t.co/6PyOdxXMSI",0,0
"x392623479","x1492992858718187534",2022-02-13 22:43:30,"NadarSenpai","Announcing the RStudio 2021 Communications Survey #Analytics #DataScience #AI #ML #RStats #Python #coding #DataAnalytics https://t.co/ZeAh9COa3o",0,1
"x392623479","x1492940638236594180",2022-02-13 19:16:00,"NadarSenpai","Data science graduates on new U.S. visas can earn $100k - eFinancialCareers #Analytics #DataScience #AI #ML #RStats #Python #coding #DataAnalytics https://t.co/1PRZsf2c3B",1,3
"x392623479","x1492992102216744964",2022-02-13 22:40:30,"NadarSenpai","How the ""Clusterbuster"" Shiny App Helps Hundreds of Doctors and Epidemiologists Battle COVID-19 in the Netherlands #Analytics #DataScience #AI #ML #RStats #Python #coding #DataAnalytics https://t.co/IRfvnXv80Q",0,2
"x392623479","x1492899029168103429",2022-02-13 16:30:39,"NadarSenpai","How to become a data scientist: A guide to the education, skills, and necessary experience - Fortune #Analytics #DataScience #AI #ML #RStats #Python #coding #DataAnalytics https://t.co/otzVXEjeO3",0,2
"x392623479","x1492939881689014282",2022-02-13 19:12:59,"NadarSenpai","Top Popular Indian Data Science Trainings for Aspirants in 2022 - Analytics Insight #Analytics #DataScience #AI #ML #RStats #Python #coding #DataAnalytics https://t.co/57xmcGRKDY",1,7
"x392623479","x1492991345820057603",2022-02-13 22:37:29,"NadarSenpai","Announcing RStudio on Amazon SageMaker #Analytics #DataScience #AI #ML #RStats #Python #coding #DataAnalytics https://t.co/YV30w8rU8D",0,2
"x392623479","x1492897516223975427",2022-02-13 16:24:39,"NadarSenpai","UC San Diego Launches Master of Data Science Online Program - HPCwire #Analytics #DataScience #AI #ML #RStats #Python #coding #DataAnalytics https://t.co/BwfdfVav2G",3,4
"x392623479","x1492990589268381696",2022-02-13 22:34:29,"NadarSenpai","RStudio Community Monthly Events - November 2021 #Analytics #DataScience #AI #ML #RStats #Python #coding #DataAnalytics https://t.co/Ufu1MP6moU",0,4
"x392623479","x1492896750792757248",2022-02-13 16:21:36,"NadarSenpai","Exploratory Data Analysis in Python #Analytics #DataScience #AI #ML #RStats #Python #coding #DataAnalytics https://t.co/klgfwdZ2RV",0,2
"x392623479","x1492989076382834693",2022-02-13 22:28:28,"NadarSenpai","How To Augment Tableau With R &amp; Python - A Webinar and Case Study from Sweden #Analytics #DataScience #AI #ML #RStats #Python #coding #DataAnalytics https://t.co/bH7SrkUq08",0,2
"x392623479","x1492975460170534917",2022-02-13 21:34:22,"NadarSenpai","What's New on RStudio Cloud - February 2022 #Analytics #DataScience #AI #ML #RStats #Python #coding #DataAnalytics https://t.co/oTPUawE720",0,1
"x392623479","x1492988319894052867",2022-02-13 22:25:28,"NadarSenpai","Announcing the RStudio Blog’s New Vision and Design #Analytics #DataScience #AI #ML #RStats #Python #coding #DataAnalytics https://t.co/nG695MHfG7",0,2
"x392623479","x1492777080693702657",2022-02-13 08:26:05,"NadarSenpai","rstudio::conf(2020) is open for registration! #Analytics #DataScience #AI #ML #RStats #Python #coding #DataAnalytics https://t.co/7LHOpv0Wm8",0,1
"x392623479","x1492987563421937669",2022-02-13 22:22:28,"NadarSenpai","R Markdown Lesser-Known Tips &amp; Tricks #1: Working in the RStudio IDE #Analytics #DataScience #AI #ML #RStats #Python #coding #DataAnalytics https://t.co/lXNK8claQA",0,2
"x392623479","x1492775567950815233",2022-02-13 08:20:04,"NadarSenpai","The Shiny Developer Series #Analytics #DataScience #AI #ML #RStats #Python #coding #DataAnalytics https://t.co/xIPiOpIfcl",0,5
"x392623479","x1492986806966571017",2022-02-13 22:19:27,"NadarSenpai","RStudio Community Monthly Events - December 2021 #Analytics #DataScience #AI #ML #RStats #Python #coding #DataAnalytics https://t.co/7LbfN2lcWl",0,5
"x392623479","x1492986050582564880",2022-02-13 22:16:27,"NadarSenpai","Three Ways to Program in Python With RStudio #Analytics #DataScience #AI #ML #RStats #Python #coding #DataAnalytics https://t.co/7P046smd4t",0,3
"x392623479","x1492985294186029063",2022-02-13 22:13:27,"NadarSenpai","Using Keras for Deep Learning with R #Analytics #DataScience #AI #ML #RStats #Python #coding #DataAnalytics https://t.co/QSZhoJDZDG",2,5
