"user_id","status_id","created_at","screen_name","text","favorite_count","retweet_count"
"x211747851","x1462952152322695168",2021-11-23 01:12:28,"talesgomes27","Meu projeto final do Curso de Dashboard com Shiny da @curso_r.

#RStats #30daysmapchallange

https://t.co/Ekx2oCxXet",0,0
"x12960572","x1462950022526291969",2021-11-23 01:04:00,"Lago72","The promise and pitfalls of digital operating models.
https://t.co/QBxwDGiQ3f 
v/ @Raconteur
HT @enricomolinari

@Lago72 #fintech #insurtech #finserv #marketing #100DaysOfCode #DevOps #RStats #JavaScript #TensorFlow #neobanks #Coding #Python #EMV #API #ModelOps #NLP #startup https://t.co/XL6XKzyo9i",4,8
"x12960572","x1462645515653455875",2021-11-22 04:54:00,"Lago72","Applied Machine Learning

HT @ruben_arce_s

@Lago72 #BigData #Analytics #MachineLearning #CyberSecurity #RStats #TensorFlow #javascript #CloudComputing #database #DataScience #100DaysofCode #ML #devops #php #AI #digital #opensource #DeepLearning #DigitalTransformation https://t.co/kgs06FrCZo",77,80
"x2728657237","x1462949272635072512",2021-11-23 01:01:01,"DD_FaFa_","Up to 63% off now. Cleaning Data in R. Develop the skills you need to go from raw data to awesome insights as quickly and accurately as possible https://t.co/m3CMH8mKkZ #rstats #rawdata #insights",0,0
"x2728657237","x1462816620322033664",2021-11-22 16:13:54,"DD_FaFa_","Up to 63% off now. Fundamentals of Bayesian Data Analysis in R. Learn what Bayesian data analysis is, how it works, and why it is a useful tool to have in your data science toolbox https://t.co/wVxakuQJcB #rstats #intro #bayesian",1,1
"x2728657237","x1462623604739166212",2021-11-22 03:26:56,"DD_FaFa_","Up to 63% off now. Introduction to Regression in R. Predict housing prices and ad click-through rate by implementing, analyzing, and interpreting regression analysis in R https://t.co/Is2WVN1GYQ #rstats #houseprices #regression",1,1
"x45841081","x1462677224486805512",2021-11-22 07:00:00,"hgfernan","R para programar, cap. 1 - Operadores relacionais em R 2/3
https://t.co/I1o3jTezlS

Apresentação de operadores de comparação, ou relacionais, em R: operadores de menor e maior, segundo de série de 3 vídeos.

#rstats #introR #cursogratuito #programador",0,0
"x45841081","x1462949019504852999",2021-11-23 01:00:01,"hgfernan","R ideas -- Mineração de textos, usando o pacote tm
https://t.co/OaptvcmKyp   

Início da mineração de textos usando o pacote tm: processamento de arquivo PDF, limpeza do texto e transformações para frequência de termos.

#Rstats #sourcecode #programming #textmining #rideas",0,0
"x45841081","x1462767831167107073",2021-11-22 13:00:02,"hgfernan","R ideas -- cálculo de Eps para várias ordens de grandeza
https://t.co/jHndRUEedA   

Eps é o maior número que somado a 1 ainda dá 1 como resultado. O programa find_eps.R generaliza o conceito para várias ordens de grandeza.

#Rstats #sourcecode #programming #rideas",0,0
"x45841081","x1462858420193611777",2021-11-22 19:00:00,"hgfernan","R para programar, cap. 2 - Vetores 2/2
https://t.co/PKI7WIt1Wj

Apresentação do tipo de dados vetor no R através de propriedades avançadas; segundo de série de 2 vídeos.

#Rstats #introR #cursogratuito #programador",1,0
"x45841081","x1462616832385302529",2021-11-22 03:00:01,"hgfernan","R para programar, cap. 2 - Números no R 1 / 4
https://t.co/VwzUH82IqC

Idéia geral de números no computador e no R. O conceito de números em ponto flutuante. Formatação básica de números

#Rstats #introR #cursogratuito #programador",0,0
"x45841081","x1462798022967009281",2021-11-22 15:00:00,"hgfernan","R para programar, cap. 2 - Vetores ½
https://t.co/Mquz46zL3i

Apresentação do tipo de dados vetor no R, primeiro de série de 2 vídeos.

#Rstats #introR #cursogratuito #programador",0,0
"x45841081","x1462707425253855232",2021-11-22 09:00:00,"hgfernan","R ideas -- Matriz de associação em R 4
https://t.co/j6b161nLxc   

Sobre novas funções auxiliares e de transformação em matrizes de frequência. Quarto vídeo da série.

#Rstats #sourcecode #programming #rpackage #rideas",0,0
"x45841081","x1462828225508388865",2021-11-22 17:00:01,"hgfernan","R ideas -- Aplicação de ANOVA à análise de agrupamentos
https://t.co/UrXFrUF6wn   

A análise de agrupamentos, ou clustering, é testada por ANOVA.

#Rstats #sourcecode #programming #rideas",0,0
"x45841081","x1462737623043219459",2021-11-22 11:00:00,"hgfernan","R para programar, cap. 1 - Operadores relacionais em R 3/3
https://t.co/HgbSJt3jTc

Apresentação de operadores de comparação, ou relacionais, em R: operadores de menor ou igual, e maior ou igual, terceiro de série de 3 vídeos.

#Rstats #introR #cursogratuito #programador",0,0
"x45841081","x1462586627629400067",2021-11-22 01:00:00,"hgfernan","R ideas -- Benchmark para R, usando programa de cálculo de eps
https://t.co/14dIUge1S9   

Apresentação de benchmarks em R, sobre o programa find_eps

#Rstats #sourcecode #programming #benchmarkr #rideas",0,1
"x45841081","x1462647025552400391",2021-11-22 05:00:00,"hgfernan","R ideas -- Matriz de associação em R 3
https://t.co/RY8XcxjoU0   

Apresentação conceitual das estruturas de dados que serão usadas nos códigos. Terceiro vídeo da série.

#Rstats #sourcecode #programming #rpackage #rideas",0,0
"x45841081","x1462918818628620297",2021-11-22 23:00:00,"hgfernan","R para programar, cap. 2 - Números no R 1 / 4
https://t.co/VwzUH8kjPc

Idéia geral de números no computador e no R. O conceito de números em ponto flutuante. Formatação básica de números

#Rstats #introR #cursogratuito #programador",0,0
"x45841081","x1462888622093443081",2021-11-22 21:00:01,"hgfernan","R ideas -- Benchmark para R, usando programa de cálculo de eps
https://t.co/14dIUge1S9   

Apresentação de benchmarks em R, sobre o programa find_eps

#Rstats #sourcecode #programming #benchmarkr #rideas",1,1
"x935569091678691328","x1462947390177091594",2021-11-23 00:53:32,"tidyversetweets","Create ggplot2 legend unrelated to plotted data #tidyverse #rstats https://t.co/hfPiBriTs5",0,0
"x935569091678691328","x1462837071182286855",2021-11-22 17:35:10,"tidyversetweets","Find out which observations are located in each ""bar"" of the histogram #tidyverse #rstats https://t.co/bi6tI8wCHu",1,1
"x935569091678691328","x1462947390726586371",2021-11-23 00:53:32,"tidyversetweets","Performing arithmetic across data frames (tibbles) #tidyverse #rstats https://t.co/tLMWUclZst",0,0
"x935569091678691328","x1462830218960384001",2021-11-22 17:07:56,"tidyversetweets","Webscraping with Rvest in freedom24 page #tidyverse #rstats https://t.co/Tv3Hy2fris",1,1
"x935569091678691328","x1462769563683143684",2021-11-22 13:06:55,"tidyversetweets","Add a serial order column to my data frame in R #tidyverse #rstats https://t.co/C2va7BcFeC",0,0
"x935569091678691328","x1462769564354240517",2021-11-22 13:06:55,"tidyversetweets","The Y-axis is not sorted, ggplot #tidyverse #rstats https://t.co/sZ2LnulH28",0,0
"x935569091678691328","x1462947389682163722",2021-11-23 00:53:32,"tidyversetweets","Color time-series with numeric variables #tidyverse #rstats https://t.co/EfX1yzHKbT",0,0
"x935569091678691328","x1462947391267651585",2021-11-23 00:53:32,"tidyversetweets","Why does my ggplot look wrong, how do I plot two types of error lines for training and testing? #tidyverse #rstats https://t.co/POwaborFL3",0,0
"x935569091678691328","x1462661300748787714",2021-11-22 05:56:43,"tidyversetweets","Create dummy if one variable matches another by group #tidyverse #rstats https://t.co/d90sqRDuFZ",0,0
"x935569091678691328","x1462858301213925385",2021-11-22 18:59:32,"tidyversetweets","Initialize vector using the ifelse function in R #tidyverse #rstats https://t.co/8uG0uavFHh",1,1
"x935569091678691328","x1462690825083801609",2021-11-22 07:54:02,"tidyversetweets","R conditional calculate date difference #tidyverse #rstats https://t.co/g2dWKrKMV1",0,0
"x935569091678691328","x1462947389124362240",2021-11-23 00:53:32,"tidyversetweets","purpose of `delayedAssign` of package data #tidyverse #rstats https://t.co/9qVqZNKT3q",0,0
"x935569091678691328","x1462947388604272640",2021-11-23 00:53:32,"tidyversetweets","How to centre single bar position with multiple bars in position_dodge in ggplot2 #tidyverse #rstats https://t.co/VtvlfyC9Av",0,0
"x935569091678691328","x1462806560086843404",2021-11-22 15:33:56,"tidyversetweets","In R, I cannot use the tidyr:fill function for some reason #tidyverse #rstats https://t.co/9eyOCANRcw",0,0
"x935569091678691328","x1462681830445006849",2021-11-22 07:18:18,"tidyversetweets","Date Converting problem #tidyverse #rstats https://t.co/gI43sCKohf",2,1
"x935569091678691328","x1462923782541172743",2021-11-22 23:19:44,"tidyversetweets","Determine if any of the values in a set of variables match the value in another variable #tidyverse #rstats https://t.co/QYv0149BoF",0,0
"x935569091678691328","x1462813362493005831",2021-11-22 16:00:58,"tidyversetweets","Keyboard shortcut to delete the current rmd chunk in RStudio #tidyverse #rstats https://t.co/bS2ep2pEqw",1,0
"x935569091678691328","x1462813361972862977",2021-11-22 16:00:57,"tidyversetweets","Circular ggplot - Missing values (geom_bar) #tidyverse #rstats https://t.co/Ld3N9b39Fj",1,0
"x935569091678691328","x1462947388021256193",2021-11-23 00:53:32,"tidyversetweets","How do I combine 2 different pieces of data to achieve one ""master set""? [R] #tidyverse #rstats https://t.co/C3E8Rbtr2S",0,0
"x935569091678691328","x1462717725978116101",2021-11-22 09:40:56,"tidyversetweets","How do I partially lengthen a big messy dataset in R? #tidyverse #rstats https://t.co/6eZH96cO3D",0,0
"x935569091678691328","x1462813360089702408",2021-11-22 16:00:57,"tidyversetweets","How to obtain subscripts for labels in ggarrange R #tidyverse #rstats https://t.co/dAqnEBgZc9",1,1
"x935569091678691328","x1462744816803106817",2021-11-22 11:28:35,"tidyversetweets","why jump page when plot(ggplot) in rmarkdown #tidyverse #rstats https://t.co/zHlYUi66ji",0,0
"x935569091678691328","x1462616145857552389",2021-11-22 02:57:17,"tidyversetweets","For ggplot of iterative error: Error in `[.data.frame`(data, , m) : undefined columns selected #tidyverse #rstats https://t.co/Elj1BJTHYy",1,1
"x935569091678691328","x1462779280702779395",2021-11-22 13:45:32,"tidyversetweets","add rows with date/time interval between two dates r #tidyverse #rstats https://t.co/GfNxoWD4Pu",0,0
"x935569091678691328","x1462729684349771786",2021-11-22 10:28:27,"tidyversetweets","my code not giving any visualization ,i am using Rstudio Cloud #tidyverse #rstats https://t.co/R09x2k5eJQ",0,0
"x935569091678691328","x1462855615756316672",2021-11-22 18:48:51,"tidyversetweets","Different axis label format depending on value using plotly #tidyverse #rstats https://t.co/LuPaq8ylon",0,0
"x935569091678691328","x1462625518872846339",2021-11-22 03:34:32,"tidyversetweets","Counting the Number of Times a Condition Appears in a Data Frame #tidyverse #rstats https://t.co/97uldrnWbH",1,1
"x935569091678691328","x1462776082306945029",2021-11-22 13:32:49,"tidyversetweets","Filling in missing NA based upon factor level #tidyverse #rstats https://t.co/Tzz4DpbU3F",0,0
"x935569091678691328","x1462830216229924875",2021-11-22 17:07:56,"tidyversetweets","Error using RandomForest #tidyverse #rstats https://t.co/dGBGpJQdpk",1,1
"x935569091678691328","x1462880230067126273",2021-11-22 20:26:40,"tidyversetweets","Seperate GeneID seperated by ""/"" in one column to multiple columns #tidyverse #rstats https://t.co/dMaxWPI8Zg",1,0
"x935569091678691328","x1462889253520789509",2021-11-22 21:02:31,"tidyversetweets","Transition probabilities for entire table in R #tidyverse #rstats https://t.co/iQF0f0QfOR",0,0
"x935569091678691328","x1462806560770514944",2021-11-22 15:33:56,"tidyversetweets","How to make a Venn diagram with species count data from 3 different samples in R? #tidyverse #rstats https://t.co/WeyzW55Mjw",0,0
"x935569091678691328","x1462779281441013764",2021-11-22 13:45:32,"tidyversetweets","KNN error: could not find function ""train"" #tidyverse #rstats https://t.co/ViLo5dt5Gz",0,0
"x935569091678691328","x1462729685012471811",2021-11-22 10:28:27,"tidyversetweets","Error: You do not have permissions to use the API Calls #tidyverse #rstats https://t.co/HAQXY6Pd3b",0,0
"x935569091678691328","x1462855616322547724",2021-11-22 18:48:52,"tidyversetweets","Iteration all variables with quantiles of one changeable variable (ntile) #tidyverse #rstats https://t.co/QdUM7ZRqv1",0,0
"x935569091678691328","x1462830219551776778",2021-11-22 17:07:57,"tidyversetweets","problem in geom_line when colored based on a categorical variable #tidyverse #rstats https://t.co/fo7IJaLDu0",1,1
"x935569091678691328","x1462830218293428229",2021-11-22 17:07:56,"tidyversetweets","Images uploaded through shiny FileInput unable to be accessed in LaTeX Rmarkdown #tidyverse #rstats https://t.co/td2qMrdU53",1,1
"x935569091678691328","x1462813360806940685",2021-11-22 16:00:57,"tidyversetweets","CSS for Printing #tidyverse #rstats https://t.co/WHclRfiI3c",1,1
"x935569091678691328","x1462830216892592131",2021-11-22 17:07:56,"tidyversetweets","Authorize https://t.co/I6L1HWeGro to access single private repo #tidyverse #rstats https://t.co/9mtFUCwZ1C",1,1
"x935569091678691328","x1462868566399668231",2021-11-22 19:40:19,"tidyversetweets","Cross-validation AUC x Logistic Regression #tidyverse #rstats https://t.co/L6iqdklI2D",0,0
"x935569091678691328","x1462880229534355456",2021-11-22 20:26:40,"tidyversetweets","Predictor and Response variables #tidyverse #rstats https://t.co/vel9hdCSAc",0,0
"x935569091678691328","x1462786940642672645",2021-11-22 14:15:58,"tidyversetweets","Error: You do not have permissions to use the API Calls #tidyverse #rstats https://t.co/l87Ehe7jXg",0,0
"x935569091678691328","x1462786939971678216",2021-11-22 14:15:58,"tidyversetweets","Copying values from row with matching ID to row with NA's #tidyverse #rstats https://t.co/CjenZNjHNZ",0,0
"x935569091678691328","x1462571576046637061",2021-11-22 00:00:11,"tidyversetweets","How to plot the iterative error of a neural net model using RSNNS using R? #tidyverse #rstats https://t.co/mgjhwdvMZN",2,1
"x935569091678691328","x1462868565778915336",2021-11-22 19:40:19,"tidyversetweets","How can I override the functionality for accessing variables in an environment? #tidyverse #rstats https://t.co/jGdyiK3IJR",0,0
"x935569091678691328","x1462840656167157765",2021-11-22 17:49:25,"tidyversetweets","purrr iteration of list of named lists. #tidyverse #rstats https://t.co/Jpc2FelFvn",1,1
"x935569091678691328","x1462863230829842433",2021-11-22 19:19:07,"tidyversetweets","Receiving XML2 error when trying to add theme #tidyverse #rstats https://t.co/QIJeLFnFzU",1,1
"x935569091678691328","x1462707731354341380",2021-11-22 09:01:13,"tidyversetweets","Filter only the rows which were changed with R #tidyverse #rstats https://t.co/GJsJTEjSZ5",0,0
"x935569091678691328","x1462762712484790281",2021-11-22 12:39:42,"tidyversetweets","Figure titles/captions not appearing in bookdown book #tidyverse #rstats https://t.co/a1FGyaZ07k",1,1
"x935569091678691328","x1462590441090686978",2021-11-22 01:15:09,"tidyversetweets","Mutate 2 vectors into a single vector in R #tidyverse #rstats https://t.co/7nMOCFYDzv",1,1
"x935569091678691328","x1462590441690386433",2021-11-22 01:15:09,"tidyversetweets","How to store a value object extracted from the for statement. #tidyverse #rstats https://t.co/V1xpTVxr7C",1,1
"x935569091678691328","x1462830217672675341",2021-11-22 17:07:56,"tidyversetweets","rmarkdown html loop multiple figure heights #tidyverse #rstats https://t.co/ePnVEcFvnn",1,1
"x935569091678691328","x1462823080733069321",2021-11-22 16:39:35,"tidyversetweets","Plot side-by-side box plots of the data (in one plot). Label the plot appropriately. #tidyverse #rstats https://t.co/E4tZrVoIcd",1,1
"x935569091678691328","x1462813361364742151",2021-11-22 16:00:57,"tidyversetweets","fill dates in R #tidyverse #rstats https://t.co/jXNZf5qoB6",1,1
"x935569091678691328","x1462638415938301955",2021-11-22 04:25:47,"tidyversetweets","Why can't I read this html by using html_table function? #tidyverse #rstats https://t.co/A301CVqaD3",0,0
"x935569091678691328","x1462729685540999168",2021-11-22 10:28:27,"tidyversetweets","Getting overlaid boxplots with different colors #tidyverse #rstats https://t.co/bpWSh1pNV7",0,0
"x935569091678691328","x1462667575956066307",2021-11-22 06:21:39,"tidyversetweets","Replace some values in a dataframe if they are included in another dataframe with strings #tidyverse #rstats https://t.co/O9IuR6lxHd",0,0
"x935569091678691328","x1462638415338426369",2021-11-22 04:25:47,"tidyversetweets","GGplot giving the error: Error in if (slev[1] == 0 &amp; slev[2] == 1) return(D) : missing value where TRUE/FALSE needed #tidyverse #rstats https://t.co/4nk9dW9FUe",0,0
"x935569091678691328","x1462740737460785155",2021-11-22 11:12:22,"tidyversetweets","tryCatch() with map() in R #tidyverse #rstats https://t.co/sV3JnJ7E1G",0,0
"x935569091678691328","x1462793705467920393",2021-11-22 14:42:51,"tidyversetweets","Add rectangular panels to show variation of a categorical variable in the background of geom_line plot #tidyverse #rstats https://t.co/OaAu2fBQqG",0,0
"x935569091678691328","x1462638414763855878",2021-11-22 04:25:47,"tidyversetweets","only single ellipsoid created. #tidyverse #rstats https://t.co/dLM0eGEUD0",0,0
"x1184490032196915200","x1462947256466915332",2021-11-23 00:53:00,"getmodzy","Straight from one of our judges - we're in the final stretch of the ModzyAIHackathon! It's not too late to register - don't miss out on your chance to win 💰 

#dev #devlife #womenwhocode #programmers #rstats #python #java #javascript https://t.co/02PEZi35fp",1,2
"x268619848","x1462945333357514760",2021-11-23 00:45:22,"Sheraj99","#Kubernetes Cheat Sheet! #Python #BigData #Analytics #DataScience #IIoT #PyTorch #RStats #TensorFlow #JavaScript #ReactJS #GoLang #CloudComputing #Serverless #DataScientist #Linux #Books #Programming #Coding #100DaysofCode #Flutter #DevOps #blockchain #HTML #Jupyter #MLOp #AI #ML https://t.co/q58YWbccDn",14,29
"x268619848","x1462945045703757830",2021-11-23 00:44:13,"Sheraj99","Machine learning attack cheatsheet #Python #BigData #Analytics #DataScience #IIoT #PyTorch #RStats #TensorFlow #JavaScript #ReactJS #GoLang #CloudComputing #Serverless #DataScientist #Linux #Programming #100DaysofCode #Flutter #DevOps #blockchain #HTML #Jupyter #MLOps #AI #ML https://t.co/GRUHfH8PRy",9,16
"x268619848","x1462576529179873288",2021-11-22 00:19:52,"Sheraj99","Syed Tousif Ahmed: Whose Sign Is It Anyway? #BigData #Analytics #DataScience #AI #MachineLearning #IoT #IIoT #Python #RStats #TensorFlow #Java #JavaScript #ReactJS #CloudComputing #Serverless #DataScientist #Linux #Programming #Coding #100DaysofCode 
https://t.co/rjUcLRte2J",16,36
"x268619848","x1462584299404812292",2021-11-22 00:50:45,"Sheraj99","One Stop Solution For Best Online #DataScience Resources #Python #BigData #Analytics #IIoT #PyTorch #RStats #TensorFlow #JavaScript #ReactJS #GoLang #CloudComputing #Serverless #DataScientist #Linux #Programming #Coding #100DaysofCode #Flutter #DevOps #blockchain #HTML #Jupyter https://t.co/ItPSJmiLZU",78,81
"x268619848","x1462575166878330886",2021-11-22 00:14:27,"Sheraj99","A #MachineLearning Based Analysis of Sperm Count: Male Fertility Prediction. #BigData #Analytics #DataScience #AI  #IoT #IIoT #PyTorch #Python #RStats #TensorFlow #Java #JavaScript #ReactJS #GoLang #CloudComputing #Serverless #DataScientist #Linux  
https://t.co/Dy2UxpEisV",15,30
"x268619848","x1462583918260109326",2021-11-22 00:49:14,"Sheraj99","#Python clean code tip #Infographic #BigData #Analytics #DataScience #IIoT #PyTorch #RStats #TensorFlow #JavaScript #ReactJS #GoLang #CloudComputing #Serverless #DataScientist #Linux #Books #Programming #Coding #100DaysofCode #Flutter #DevOps #blockchain #HTML #Jupyter #MLOps #AI https://t.co/1YT8nOxrCN",12,22
"x268619848","x1462945663289901056",2021-11-23 00:46:41,"Sheraj99","DevOps Roadmap #Python #BigData #Analytics #DataScience #IIoT #PyTorch #RStats #TensorFlow #JavaScript #ReactJS #GoLang #CloudComputing #Serverless #DataScientist #Linux #Books #Programming #Coding #100DaysofCode #Flutter #DevOps #blockchain #HTML #Jupyter #MLOps #AI #ML #NLProc https://t.co/QzXUVJ8FbA",8,20
"x268619848","x1462582699076599819",2021-11-22 00:44:23,"Sheraj99","Some interesting facts about #AI #Python #BigData #Analytics #DataScience #IIoT #PyTorch #RStats #TensorFlow #JavaScript #ReactJS #GoLang #CloudComputing #Serverless #DataScientist #Linux #Books #Programming #Coding #100DaysofCode #Flutter #DevOps #blockchain #HTML #Jupyter #MLOp https://t.co/m6SUsXipLK",89,101
"x268619848","x1462945156982874112",2021-11-23 00:44:40,"Sheraj99","Applied #MachineLearning #Python #BigData #Analytics #DataScience #IIoT #PyTorch #RStats #TensorFlow #JavaScript #ReactJS #GoLang #CloudComputing #Serverless #DataScientist #Linux #Books #Programming #Coding #100DaysofCode #Flutter #DevOps #blockchain #HTML #Jupyter #MLOps #AI https://t.co/sBBmGqYjLG",15,25
"x268619848","x1462940770579763205",2021-11-23 00:27:14,"Sheraj99","The 5 Certificates to Prove Your #Python Knowledge. #BigData #Analytics #DataScience #AI #MachineLearning #IoT #IIoT #RStats #TensorFlow #Java #JavaScript #ReactJS #CloudComputing #Serverless #DataScientist #Linux #Programming #Coding #100DaysofCode 
https://t.co/URh9NcomVY",13,21
"x268619848","x1462583311465951238",2021-11-22 00:46:49,"Sheraj99","Programming languages #Python #BigData #Analytics #DataScience #IIoT #PyTorch #RStats #TensorFlow #JavaScript #ReactJS #GoLang #CloudComputing #Serverless #DataScientist #Linux #Books #Programming #Coding #100DaysofCode #Flutter #DevOps #blockchain #HTML #Jupyter #MLOps #AI #ML https://t.co/79Nu2TPvpA",55,80
"x268619848","x1462580250290929664",2021-11-22 00:34:39,"Sheraj99","DNA Sequencing for Fuzzy Classification: #BigData #Analytics #DataScience #AI #MachineLearning #IoT #IIoT #PyTorch #Python #RStats #TensorFlow #Java #JavaScript #ReactJS #CloudComputing #Serverless #DataScientist #Linux #Programming #Coding #100DaysofCode
https://t.co/sEt3BLW53p",9,17
"x18545760","x1462945661498781696",2021-11-23 00:46:40,"ghuiber","#rstats is not just for stats. I’m using it to design bicycle frames: https://t.co/m5h7tw49NF",1,1
"x2489702532","x1462944314431004681",2021-11-23 00:41:19,"gjmount","I don't know where else you're going to get a SIGNED book *and* workshop for under $100. Treat yourself. It's almost the holidays... 
https://t.co/nlQ0t6tVcE  #rstats #excel #python #learntocode",0,1
"x983470194982088704","x1462943374659436545",2021-11-23 00:37:35,"R4DScommunity","The next R4DS Office Hours begin at Nov 22, 2021 07:00PM CDT! Have an #rstats question you've been meaning to ask? Head over to our slack via https://t.co/XpQXP5Iano, and we'll try to get you an answer! See the calendar for upcoming office hours: https://t.co/rb7kh5s6pS",0,1
"x83421765","x1462943183902412801",2021-11-23 00:36:49,"sim_pod","Sometimes past you just wants future you to understand their struggle #rstats #nse https://t.co/rb2CuN356r",2,1
"x1631919066","x1462942768666447874",2021-11-23 00:35:10,"tomasdamerau","*Vacante laboral* como analista de datos en temas laborales. 

Más info: https://t.co/lijAGn8Sw3
  #RStats #Python #SQL 

 #OfertaLaboral 

Se agradece difusión! https://t.co/gK5nHQl1lb",3,5
"x1969069184","x1462941769549635590",2021-11-23 00:31:12,"globaliqx","These fiberbots are inspired by nature! 

#Robotics #AI #IoT #DeepLearning #IIoT #MachineLearning #DataScience 
#insurtech #programming #100DaysOfCode #ML #Airdrop #Python #CloudComputing #Analytics #Serverless #cybersecurity #CodeNewbie  #5G #RTXOn #RStats #finserv #SmartHome https://t.co/h2aNgQtWtI",8,23
"x1094022475736903687","x1462938102029332486",2021-11-23 00:16:38,"themis277","خصم 75% على الإشتراك السنوي من منصة داتاكامب
اشترك من هنا
https://t.co/n6c3yJDew2
مراجعة مسار مبرمج بلغة آر
https://t.co/7sT4AWLb97
#programming #DataScience #MachineLearning #DeepLearning #RStats #Python #coding #100DaysOfCode
#علم_البيانات #البيانات #التعلم_الآلة #التعلم_العميق",2,6
"x1094022475736903687","x1462939044317433862",2021-11-23 00:20:22,"themis277","خصم 75% على الإشتراك السنوي من منصة داتاكامب
اشترك من هنا
https://t.co/n6c3yJDew2
Python Programmer Track Review
https://t.co/agIpthf2sb
#programming #DataScience #MachineLearning  #RStats #Python #coding #100DaysOfCode
#علم_البيانات #البيانات #التعلم_الآلة #التعلم_العميق",1,2
"x2321122829","x1462938476714856448",2021-11-23 00:18:07,"PipingHotData","Ever wonder about how people think about starring #rstats GitHub repos? 

👀Check out this ⭐️ post by @_johnmackintosh 

Thank you for motivating me to be more active in this arena, John!🙏 https://t.co/Kau01nKF3W",2,1
"x4133370832","x1462885020222332930",2021-11-22 20:45:42,"cloudpreacher","These are the world's most powerful supercomputers https://t.co/85avHAaEWv 

MT @wef #supercomputers #tech #AI #MachineLearning #IoT #coding #Python #ArtificialIntelligence #BigData #Analytics #Innovation #DataScience #IIoT #PyTorch #RStats #Serverless #Programming #100DaysofCode https://t.co/7r7uxVwfcK",41,48
"x4133370832","x1462937283628306436",2021-11-23 00:13:23,"cloudpreacher","Sharing data for impact! Open Data Report by @MicrosoftASIA

https://t.co/FJ3B3xguFb

MT @kuriharan #BigData #Analytics #DataScience #AI #IoT #IIoT #PyTorch #Python #RStats #TensorFlow #Java #JavaScript #ReactJS #Serverless #Linux #Coding #100DaysofCode #datamining #opendata https://t.co/bgzt97hbd1",11,29
