"user_id","status_id","created_at","screen_name","text","favorite_count","retweet_count"
"x4332661635","x1479262868092641281",2022-01-07 01:25:25,"MicahEHirsch","So excited this book finally got delivered today! One of my big goals for 2022 is to learn Bayesian stats. I’m excited to learn! If you have any other resource suggestions, please let me know! #rstats #bayes https://t.co/TQB7Fu8XGo",1,0
"x1306528816731500544","x1479261225934544896",2022-01-07 01:18:54,"mygenienetwork","Why do AI and ML go hand-in-glove with IoT?

https://t.co/4crWQXXndx

#Analytics #MachineLearning #AI #Python #Rstats #Reactjs #IoT #IIoT #Linux #Serverless #flutter #ML #javascript #TensorFlow #BigData #CloudComputing",3,9
"x1306528816731500544","x1479156082840850445",2022-01-06 18:21:06,"mygenienetwork","All about Artificial intelligence. 

#Python #BigData #Analytics #AI #DataScience #IoT #IIoT #Azure #PyTorch #RStats #DotNet #C #CPP #Java #CSharp #Flutter #SQL https://t.co/wcrODwmO97",3,9
"x1306528816731500544","x1479242977574895621",2022-01-07 00:06:23,"mygenienetwork","AI+ML in #Business Functions

https://t.co/2Xdm8mETAs via @ingliguori
 
#BigData #Analytics #DataScience #AI #IoT #IIoT #PyTorch #Python #RStats #TensorFlow #Java #JavaScript #ReactJS #CloudComputing #DevCommunity #Serverless #DataScientist #Programming #Coding https://t.co/cAYgVmatlK",9,16
"x1306528816731500544","x1478883782275092484",2022-01-06 00:19:04,"mygenienetwork","5 biggest #internetofthings (IoT) trends in 2022!
https://t.co/V0pzTsErDe 

#AI #DataScience #rstats #javascript #serverless #Linux #python #BigData #IoT #Flutter #DevOps #GitHub #MLOps 

@EvanKirstel @antgrasso @LindaGrass0 @mikequindazzi @iiot_world",11,28
"x268619848","x1479258687785025539",2022-01-07 01:08:49,"Sheraj99","Best of Nmap Cheatsheet https://t.co/MQ7U0sw4HL #BigData #Analytics #DataScience #AI #MachineLearning #IIoT #PyTorch #Python #RStats #TensorFlow #Java #JavaScript #ReactJS #GoLang #CloudComputing #Serverless #DataScientist #Linux #Programming #Coding #100DaysofCode #DL #NLProc https://t.co/KaUOEBXCtf",10,17
"x268619848","x1479255688417271812",2022-01-07 00:56:54,"Sheraj99","Top 10 #Probability And #Statistics #Books Suggested By Experts. #BigData #Analytics #DataScience #IoT #IIoT #PyTorch #Python #RStats #TensorFlow  #JavaScript #ReactJS #CloudComputing #Serverless #DataScientist #Linux #Programming #Coding #100DaysofCode 
https://t.co/bBqkw0xBuo",10,14
"x268619848","x1479240913050288134",2022-01-06 23:58:11,"Sheraj99","A Must Read Free #Books in 2021. #BigData #Analytics #DataScience #IoT #IIoT #Python #RStats #TensorFlow #JavaScript #ReactJS #CloudComputing #Serverless #DataScientist #Linux #Mathematics #Statistics #Programming #Coding #100DaysofCode 
https://t.co/Jg7EkW2Yhd",4,16
"x268619848","x1479256822938804230",2022-01-07 01:01:24,"Sheraj99","Best of Linux Command Cheatsheet https://t.co/GawdYomoGL #SQL #BigData #Analytics #DataScience #AI #MachineLearning #IIoT #PyTorch #Python #RStats #TensorFlow #Java #JavaScript #ReactJS #GoLang #CloudComputing #Serverless #DataScientist #Linux #Programming #Coding #100DaysofCode",16,26
"x268619848","x1479135357912428550",2022-01-06 16:58:44,"Sheraj99","A Stacked Deep Learning Approach to Cyber-Attacks. #BigData #Analytics #DataScience #AI #MachineLearning #CyberSecurity #IoT #IIoT #Python #RStats #TensorFlow #JavaScript #ReactJS  #Serverless #DataScientist #Linux #Programming #Coding #100DaysofCode 
https://t.co/TPulhr8SOR",7,16
"x268619848","x1479252061455855619",2022-01-07 00:42:29,"Sheraj99","A cheatsheet for SQLmap: https://t.co/avfmYotjzg #SQL #BigData #Analytics #DataScience #AI #MachineLearning #IoT #IIoT #PyTorch #Python #RStats #TensorFlow #Java #JavaScript #ReactJS #GoLang #CloudComputing #Serverless #DataScientist #Linux #Programming #Coding #100DaysofCode https://t.co/92FaL0oLaU",6,18
"x268619848","x1479134850749763592",2022-01-06 16:56:44,"Sheraj99","Domestic Violence Signal using Surveillance Cameras! #BigData #Analytics #DataScience #AI #MachineLearning #IoT #IIoT #Python #RStats #TensorFlow #JavaScript #ReactJS #CloudComputing #Serverless #DataScientist #Linux #Programming #Coding #100DaysofCode 
https://t.co/pKizacuGak",5,16
"x268619848","x1478895886151426048",2022-01-06 01:07:10,"Sheraj99","3 Best Python Bootcamp Courses! #BigData #Analytics #DataScience #AI #MachineLearning #IoT #IIoT #PyTorch #Python #RStats #TensorFlow #Java #JavaScript #ReactJS #GoLang #CloudComputing #Serverless #DataScientist #Linux #Programming #Coding #100DaysofCode 
https://t.co/tI0KQV9vZJ",8,13
"x268619848","x1479111110821220356",2022-01-06 15:22:24,"Sheraj99","Best New Keras Books To Read In 2022. #BigData #Analytics #DataScience #IoT #IIoT #PyTorch #Python #RStats #TensorFlow #Java #JavaScript #ReactJS #GoLang #CloudComputing #Serverless #DataScientist #Linux #Books #Programming #Coding #100DaysofCode 
https://t.co/DcZbNld9Ma",6,8
"x268619848","x1479124717579681797",2022-01-06 16:16:28,"Sheraj99","The Riemann Conjecture! #BigData #Analytics #DataScience #AI #MachineLearning #IoT #IIoT #Python #RStats #TensorFlow #Java #JavaScript #ReactJS #GoLang #CloudComputing #Serverless #DataScientist #Linux #Mathematics #Programming #Coding #100DaysofCode 
https://t.co/0mrVcB8XCA",4,15
"x268619848","x1479131816745390088",2022-01-06 16:44:40,"Sheraj99","TLDR: Data Science Bookcamp. #BigData #Analytics #DataScience #AI #MachineLearning #IoT #IIoT #PyTorch #Python #RStats #TensorFlow #Java #JavaScript #ReactJS #GoLang #CloudComputing #Serverless #DataScientist #Linux #Programming #Coding #100DaysofCode 
https://t.co/qOoSa2uG41",2,16
"x268619848","x1479202007307243523",2022-01-06 21:23:35,"Sheraj99","Linux Commands Cheat-Sheet. #BigData #Analytics #DataScience #AI #MachineLearning #IoT #IIoT #PyTorch #Python #RStats #TensorFlow #Java #JavaScript #ReactJS #GoLang #CloudComputing #Serverless #DataScientist #Linux #Programming #Coding #100DaysofCode 
https://t.co/nqFvtxVT85",5,23
"x268619848","x1479115665575346187",2022-01-06 15:40:29,"Sheraj99","Trillion-Parameter Trained AI Language Model. #BigData #Analytics #DataScience #AI #MachineLearning #IoT #IIoT #NLProc #Python #RStats #TensorFlow #JavaScript #ReactJS #CloudComputing #Serverless #DataScientist #Linux #Programming #Coding #100DaysofCode 
https://t.co/Fwy9lOARYD",2,2
"x268619848","x1479099965876150274",2022-01-06 14:38:06,"Sheraj99","Tutel Optimizes Mixture of ML Models for AI Nodes. #BigData #Analytics #DataScience #AI #MachineLearning #IoT #IIoT #Python #RStats #TensorFlow #JavaScript #ReactJS #CloudComputing #Serverless #DataScientist #Linux #Programming #Coding #100DaysofCode 
https://t.co/bmm3uAseVR",7,15
"x268619848","x1479129474067226629",2022-01-06 16:35:22,"Sheraj99","Biostatistics, Machine Learning, BI Books. #BigData #Analytics #DataScience #IoT #IIoT #PyTorch #Python #RStats #TensorFlow #Java #JavaScript #ReactJS #GoLang #CloudComputing #Serverless #DataScientist #Linux #Books #Programming #Coding #100DaysofCode 
https://t.co/iPpxLGPg5N",3,19
"x268619848","x1478896523287093248",2022-01-06 01:09:42,"Sheraj99","Logistic Regression: Scratch vs. Scikit-Learn. #BigData #Analytics #DataScience #AI #MachineLearning #IoT #IIoT #Python #RStats #TensorFlow #Java #JavaScript #ReactJS #CloudComputing #Serverless #DataScientist #Linux #Programming #Coding #100DaysofCode 
https://t.co/cVBHXGfw4x",20,30
"x268619848","x1479124579507445764",2022-01-06 16:15:55,"Sheraj99","AI Best: Deep Domain Adaptation using PyTorch Adapt. #BigData #Analytics #DataScience #AI #MachineLearning #IoT #IIoT #Python #RStats #TensorFlow #JavaScript #ReactJS #CloudComputing #Serverless #DataScientist #Linux #Programming #Coding #100DaysofCode 
https://t.co/LAOhlkSU83",7,14
"x268619848","x1478896295590907912",2022-01-06 01:08:48,"Sheraj99","Free eBook: Bayes Rules! (Preorder for 2022). #BigData #Analytics #DataScience #IoT #IIoT #Python #RStats #TensorFlow #JavaScript #ReactJS #GoLang #CloudComputing #Serverless #DataScientist #Linux #Statistics #Books #Programming #Coding #100DaysofCode 
https://t.co/6ne7wjTrgt",9,11
"x268619848","x1478896404621938688",2022-01-06 01:09:14,"Sheraj99","A Graph Neural network in #Azure ML (Regression). #BigData #Analytics #DataScience #AI #MachineLearning #IoT #IIoT #Python #RStats #TensorFlow #Java #JavaScript #ReactJS #CloudComputing #Serverless #DataScientist #Linux #Programming #Coding #100DaysofCode 
https://t.co/OiYV1hMpem",19,44
"x2186228077","x1479257561299763201",2022-01-07 01:04:20,"m45hap","my 11 yo is getting her first macbook for school. first q: mam, can i have some of your #octocat and #Rstats stickers 🥳😎🤣",2,2
"x1228948889694113792","x1479255891421450241",2022-01-07 00:57:42,"Adam_C_Garber","Would love to transition to completely #OpenSource mixture modeling- Feeling hopeful that I can make the leap soon!

Thankful for the hard work that goes into these #rstats resources 👇 https://t.co/vq0aOe9lBD",2,4
"x1359942243017101312","x1479254221975273479",2022-01-07 00:51:04,"joshualerickson","If you want to use {gwavr} but don't know #rstats, no problem! Use it online with https://t.co/gup6d99FzT! Still early and beta but seems to be fine with modest queries (small-ish areas). Only 1 GB RAM so be AWARE. App here https://t.co/jdeU3KX0rH #hydrology #rspatial #water https://t.co/YcrolGcMkG",1,3
"x1359942243017101312","x1479229772945588224",2022-01-06 23:13:55,"joshualerickson","Why would https://t.co/gup6d9rOO1 have memory issues if when I profile locally I'm getting &lt;200 MB used... #rstats #rshiny #rstudio Can't seem to find solutions on SO or other channels... so lost!",0,2
"x118445123","x1479253198116433920",2022-01-07 00:47:00,"dexter913","Από πού έπαιρνε η ελλάδα την ενέργεια τον τελευταίο χρόνο;

δεδομένα από https://t.co/R4EcgBiors

#rstats #data_viz #greece https://t.co/3GjWs6RIXn",0,2
"x1397599479969325059","x1479252105940582407",2022-01-07 00:42:39,"antanastasio","learning R with my diamonds dataset #Rstats https://t.co/qqeUfc0iZd",2,2
"x760831843","x1479247035199115274",2022-01-07 00:22:30,"alldominguez","Any good material or resources to learn how to quantify uncertainty using markov simulation in R??? #rstats #epitwitter",0,3
"x815944365449314304","x1479242445414023170",2022-01-07 00:04:16,"ChiragParsania","GitHub for #R. Make universe of your R packages at r-universe. Something new to learn in 2022. 

https://t.co/bIEhMF7m44

#rstats",1,2
"x1477285695882465280","x1479233877356986368",2022-01-06 23:30:13,"rcityviews","Image created in #rstats using data from #OpenStreetMap. https://t.co/hxrD6GZxlt",0,2
"x1477285695882465280","x1479241612706340866",2022-01-07 00:00:58,"rcityviews","Image created in #rstats using data from #OpenStreetMap. https://t.co/bE0xj1mFF2",1,3
"x1477285695882465280","x1479228754518065159",2022-01-06 23:09:52,"rcityviews","Image created in #rstats using data from #OpenStreetMap. https://t.co/uQ8xrwlKhZ",1,2
"x1477285695882465280","x1479229911869136898",2022-01-06 23:14:28,"rcityviews","Image created in #rstats using data from #OpenStreetMap. https://t.co/UBXs2NVYUT",0,2
"x935569091678691328","x1478953032889118721",2022-01-06 04:54:15,"tidyversetweets","Creating a loop to find 90th percentile #tidyverse #rstats https://t.co/rtvGHJDQN0",0,1
"x935569091678691328","x1479223572413526016",2022-01-06 22:49:16,"tidyversetweets","Why `code_folding: hide` doesnt give th eoption to hide/show code in Rmarkdown? #tidyverse #rstats https://t.co/RouvDXulCt",1,1
"x935569091678691328","x1479076709190320130",2022-01-06 13:05:42,"tidyversetweets","R doesn't find an already installed package #tidyverse #rstats https://t.co/mNnkJgD0fk",0,1
"x935569091678691328","x1479236997009059845",2022-01-06 23:42:37,"tidyversetweets","Getting different results from the same function inside and outside a mutate function call #tidyverse #rstats https://t.co/0hxL85b7EX",2,1
"x935569091678691328","x1478953031291084801",2022-01-06 04:54:14,"tidyversetweets","Shiny Server not showing application and no logs at all #tidyverse #rstats https://t.co/RieIiAoGfI",0,1
"x935569091678691328","x1478953030636744706",2022-01-06 04:54:14,"tidyversetweets","Elastic net error in R: ""xFold01: preprocessor 1/1, model 1/10: Error: `y` should be one of the following classes: 'data.frame', 'matrix', 'factor'"" #tidyverse #rstats https://t.co/eZ3Ipz7nLS",0,1
"x935569091678691328","x1479232722304438272",2022-01-06 23:25:38,"tidyversetweets","pak lockfile creation within github action hangs forever #tidyverse #rstats https://t.co/sO14DAVxJk",0,1
"x935569091678691328","x1478990867897765891",2022-01-06 07:24:35,"tidyversetweets","R: How to Intersect multiple vectors that gives all possible combination #tidyverse #rstats https://t.co/NeZxCU7MJv",0,1
"x935569091678691328","x1479178505409679361",2022-01-06 19:50:12,"tidyversetweets","Deleting variables in a vector #tidyverse #rstats https://t.co/QATUV3b2mH",1,2
"x935569091678691328","x1479216285506576385",2022-01-06 22:20:19,"tidyversetweets","Partially duplicate rows and get elements from variables's names #tidyverse #rstats https://t.co/WT8xiFab8J",1,1
"x935569091678691328","x1479145135963357184",2022-01-06 17:37:36,"tidyversetweets","Why is my bar chart in ggplot2 using different fonts on the x and y axis? #tidyverse #rstats https://t.co/IKE1HJyeN3",1,3
"x935569091678691328","x1478914432935903235",2022-01-06 02:20:52,"tidyversetweets","How to set dynamic data limits across facets in ggplot2? #tidyverse #rstats https://t.co/L4xiRTS2lS",1,2
"x935569091678691328","x1479049272842727426",2022-01-06 11:16:40,"tidyversetweets","How to manipulate the legend height #tidyverse #rstats https://t.co/LC5RwQzu99",0,1
"x935569091678691328","x1479087654989975559",2022-01-06 13:49:11,"tidyversetweets","Xaringan Extra misplaces scribbles when printing from Chrome as PDF #tidyverse #rstats https://t.co/3wJftfdV2n",0,1
"x935569091678691328","x1479025794215288834",2022-01-06 09:43:22,"tidyversetweets","Writing other columns when matching a condition #tidyverse #rstats https://t.co/w19uEjQYsq",0,2
"x935569091678691328","x1479137583737319430",2022-01-06 17:07:35,"tidyversetweets","ggplot: multiple points based on a single observation value #tidyverse #rstats https://t.co/dt6SCEbpQ9",0,1
"x935569091678691328","x1479117154872029199",2022-01-06 15:46:25,"tidyversetweets","conditionally copying reference values in r #tidyverse #rstats https://t.co/WzY6CzzMAw",0,1
"x935569091678691328","x1479240672662204428",2022-01-06 23:57:13,"tidyversetweets","Incorrect result when using dynamic column name set in Dplyr mutate #tidyverse #rstats https://t.co/XJhhOUEDYH",0,1
"x935569091678691328","x1479220759205756935",2022-01-06 22:38:06,"tidyversetweets","Ordering for stacked bar chart but with different values in each one. #tidyverse #rstats https://t.co/vox6mXuAfr",1,1
"x935569091678691328","x1479165351501914113",2022-01-06 18:57:56,"tidyversetweets","How to separate ""."" delimited columns with tidyR #tidyverse #rstats https://t.co/Cto7lyDtHA",1,2
"x935569091678691328","x1478923172544237568",2022-01-06 02:55:36,"tidyversetweets","How to change the color of each facet in a scatter plot in R? #tidyverse #rstats https://t.co/Xkz9iQakbU",2,3
"x935569091678691328","x1479128140026982401",2022-01-06 16:30:04,"tidyversetweets","How to write code to sqlite straight from r markdown #tidyverse #rstats https://t.co/q4V28G7EhO",0,1
"x935569091678691328","x1478975771301584897",2022-01-06 06:24:36,"tidyversetweets","error in labeling decimal number data in ggplot 2 #tidyverse #rstats https://t.co/fcdoHHLro8",0,1
"x935569091678691328","x1479173066634797061",2022-01-06 19:28:35,"tidyversetweets","How can I program a data frame so it shows the information based on months, quarters ,semesters or year depending on what the user needs? #tidyverse #rstats https://t.co/xR2rGwvqlL",0,1
"x935569091678691328","x1478953032348020746",2022-01-06 04:54:15,"tidyversetweets","Gradient colour fill a barplot in ggplot2 #tidyverse #rstats https://t.co/iPxJpjV0w2",0,1
"x935569091678691328","x1479204360072613901",2022-01-06 21:32:56,"tidyversetweets","Inner_join on NSE #tidyverse #rstats https://t.co/uKk68UB4tB",0,1
"x935569091678691328","x1478953031827873799",2022-01-06 04:54:15,"tidyversetweets","Why negative value in krigging of rainfall? #tidyverse #rstats https://t.co/QXS2S87xCN",0,1
"x935569091678691328","x1479084028703686656",2022-01-06 13:34:47,"tidyversetweets","Unable to import data using import from text(readr) #tidyverse #rstats https://t.co/HAeoOJkz6V",0,1
"x935569091678691328","x1479067692929851392",2022-01-06 12:29:52,"tidyversetweets","Continue a file path in the next line in R #tidyverse #rstats https://t.co/GkWhg5LqR9",1,1
"x935569091678691328","x1479067692388728834",2022-01-06 12:29:52,"tidyversetweets","Sankey diagram in time #tidyverse #rstats https://t.co/z1Th7HPJ6Z",1,1
"x935569091678691328","x1479200131358547968",2022-01-06 21:16:08,"tidyversetweets","Get a standard deviation by group and subtract from mean column standard deviation in R #tidyverse #rstats https://t.co/GrNmxHNqsa",0,1
"x935569091678691328","x1479178505955033096",2022-01-06 19:50:12,"tidyversetweets","How can I plot, 2 different multi- regressions from 2 different data in R #tidyverse #rstats https://t.co/gGlwUXIyCx",1,3
"x935569091678691328","x1478963304114630662",2022-01-06 05:35:04,"tidyversetweets","Tidyverse: Match word in string from list of keywords #tidyverse #rstats https://t.co/Q6JcvdjGh7",1,1
"x935569091678691328","x1479067691235356672",2022-01-06 12:29:51,"tidyversetweets","Decomposition Error #tidyverse #rstats https://t.co/yc4FkTpDuR",0,1
"x935569091678691328","x1479007633512271873",2022-01-06 08:31:13,"tidyversetweets","Get nearest n matching strings #tidyverse #rstats https://t.co/hbLGeVGoQ2",0,1
"x935569091678691328","x1478914431891423235",2022-01-06 02:20:52,"tidyversetweets","How to plot negative values using ggplot geom_col avoiding values interpolation #tidyverse #rstats https://t.co/z0qNkmskiN",1,2
"x935569091678691328","x1479096264260296710",2022-01-06 14:23:24,"tidyversetweets","How to arrange x-axis in the ggplot2 (Boxplot) #tidyverse #rstats https://t.co/11YFVyvZll",1,1
"x935569091678691328","x1479076708540162054",2022-01-06 13:05:41,"tidyversetweets","How create the line that intersects the medians of the groups using R:ggplot2 #tidyverse #rstats https://t.co/OrMcYxYeVc",0,1
"x935569091678691328","x1479049272217817088",2022-01-06 11:16:40,"tidyversetweets","Removing sample IDs from PCA plot in ggbiplot, R #tidyverse #rstats https://t.co/8BPEMKmPdl",0,1
"x935569091678691328","x1478896493138530307",2022-01-06 01:09:35,"tidyversetweets","Underline effect for graph and text using ggplot2 #tidyverse #rstats https://t.co/Arx3rWoAND",1,2
"x935569091678691328","x1479232721696219137",2022-01-06 23:25:38,"tidyversetweets","Pivot_Longer with Multiple Variables #tidyverse #rstats https://t.co/uU4RctY2Tp",0,1
"x935569091678691328","x1479067691818311682",2022-01-06 12:29:52,"tidyversetweets","Conditional tidy_comb_all, and reinserting fields? #tidyverse #rstats https://t.co/H1fFzKpTFm",0,1
"x935569091678691328","x1479207952628297733",2022-01-06 21:47:12,"tidyversetweets","Creating a New Variable for Each Unique Group #tidyverse #rstats https://t.co/dYQAUkwgF4",0,1
"x935569091678691328","x1479200130662379524",2022-01-06 21:16:08,"tidyversetweets","Order Bars in ggplot2 from high to low (when repeating words are used) #tidyverse #rstats https://t.co/fc8r5DC7Up",1,1
"x935569091678691328","x1479128140664524802",2022-01-06 16:30:04,"tidyversetweets","Is there a function to sort a bar graph by count instead of the default alphabetical in ggplot? #tidyverse #rstats https://t.co/07RUUySuSt",0,1
"x935569091678691328","x1478969022750199816",2022-01-06 05:57:47,"tidyversetweets","Cicerone does not work in shinydashboard #tidyverse #rstats https://t.co/qbNnvAx5sw",0,1
"x935569091678691328","x1479165352777035785",2022-01-06 18:57:56,"tidyversetweets","An RMarkdown file in does not work in Kaggle which works on RStudio itself #tidyverse #rstats https://t.co/ZIwVkLp3h7",1,2
"x935569091678691328","x1479119958969925632",2022-01-06 15:57:33,"tidyversetweets","Convert matrix to tidy format and store it in `data.table` #tidyverse #rstats https://t.co/K6V9SvFAhB",0,1
"x935569091678691328","x1478914432403136514",2022-01-06 02:20:52,"tidyversetweets","ggplot2 mutate error when select variable from uploaded dataset in R shinydashbard #tidyverse #rstats https://t.co/cg2NV9LZoS",1,2
"x935569091678691328","x1479040329626103809",2022-01-06 10:41:08,"tidyversetweets","Manual scale ggplot legend #tidyverse #rstats https://t.co/xOMNSmTUF1",0,1
"x935569091678691328","x1479178506621829120",2022-01-06 19:50:12,"tidyversetweets","Data changes when assigning names to elements in a list #tidyverse #rstats https://t.co/3SXPF4NxrI",1,2
"x935569091678691328","x1479040331228368897",2022-01-06 10:41:08,"tidyversetweets","Read dataframe from list in multiple RData files #tidyverse #rstats https://t.co/n2R9g3uAji",0,1
"x935569091678691328","x1479040330192330756",2022-01-06 10:41:08,"tidyversetweets","Deafault values of functions arguments #tidyverse #rstats https://t.co/aIBNE2x1sv",0,1
"x935569091678691328","x1479053282853146625",2022-01-06 11:32:36,"tidyversetweets","ggplot secondry y axis scale based on data with facet_wrap or grid_arrange #tidyverse #rstats https://t.co/d4BB8etDS8",0,1
"x935569091678691328","x1479100499836080131",2022-01-06 14:40:14,"tidyversetweets","How to create boxplot graph and same coloured spots around them #tidyverse #rstats https://t.co/ADk3ZibO0z",0,1
"x935569091678691328","x1479165352143732738",2022-01-06 18:57:56,"tidyversetweets","Adding expression to ggplot axis label seems to require an extra character? #tidyverse #rstats https://t.co/UBrNqCptZc",1,2
"x935569091678691328","x1478914433468583940",2022-01-06 02:20:52,"tidyversetweets","Convert long completed data to a mids object #tidyverse #rstats https://t.co/9LVFMU6ihj",1,2
"x935569091678691328","x1478945395459956736",2022-01-06 04:23:54,"tidyversetweets","Calculate correlation for two data frames for all columns after group_by in R #tidyverse #rstats https://t.co/wOzIPhddz5",1,1
"x935569091678691328","x1479053282320465923",2022-01-06 11:32:36,"tidyversetweets","Questions regarding not found object in ggplot and IV in a graph #tidyverse #rstats https://t.co/temhHJBSps",0,1
"x935569091678691328","x1479058266537828358",2022-01-06 11:52:24,"tidyversetweets","Project Rocker RStudio Problem Rendering Rmd Files to PDF files #tidyverse #rstats https://t.co/Dz8ezG28w2",0,1
"x935569091678691328","x1479170323970936849",2022-01-06 19:17:41,"tidyversetweets","Discrete value supplied to continuous scale, but a Vector of Doubles is provided #tidyverse #rstats https://t.co/X04ErRfAm2",0,1
"x935569091678691328","x1478914431346163714",2022-01-06 02:20:51,"tidyversetweets","How to change facet heights in ggplot2 #tidyverse #rstats https://t.co/3fHNZ5aBwi",1,2
"x935569091678691328","x1479170323396317185",2022-01-06 19:17:41,"tidyversetweets","Create a HTML file from R file issue #tidyverse #rstats https://t.co/FLE1vMNYek",0,1
"x935569091678691328","x1478923173118857218",2022-01-06 02:55:36,"tidyversetweets","Manual bootstrapping for confidence intervals using tidyverse only #tidyverse #rstats https://t.co/cvQZzN4ZVj",3,3
"x935569091678691328","x1479170322817601542",2022-01-06 19:17:41,"tidyversetweets","index synonmyms? #tidyverse #rstats https://t.co/VFK3QBlJ2F",0,1
"x935569091678691328","x1479156166622171148",2022-01-06 18:21:26,"tidyversetweets","Add legend to boxplot rstudio #tidyverse #rstats https://t.co/GXmzsuFzEA",2,2
"x935569091678691328","x1478896493755043841",2022-01-06 01:09:35,"tidyversetweets","Grouping variables for bar chart in ggplot2: different x-axis for groups #tidyverse #rstats https://t.co/bzkboAkUOT",1,2
"x935569091678691328","x1479067693445697537",2022-01-06 12:29:52,"tidyversetweets","Assign max n value based on group #tidyverse #rstats https://t.co/QpEwsHsIa2",2,2
"x1203623631856779264","x1479160379947339780",2022-01-06 18:38:10,"icymi_r","✍️📊⇆ Comparing Distributions

👤 Kieran Healy @kjhealy  

🔗 https://t.co/AcLIzWCzrT
#rstats #datascience https://t.co/RIXBcR1VlH",98,16
"x1203623631856779264","x1479177996816764929",2022-01-06 19:48:10,"icymi_r","📦📊 {ggpattern} • ggplot geoms with pattern fills

👤 mikefc @coolbutuseless, Trevor L Davis

🔗 https://t.co/ytCh0rYTQr
#rstats #datascience https://t.co/IVQINCiZNS",45,9
"x1203623631856779264","x1479081365534617601",2022-01-06 13:24:12,"icymi_r","📦🧹 {tidycensus} • Load US Census boundary and attribute data as 'tidyverse' and 'sf'-ready data frames in R

👤 Kyle Walker @kyle_e_walker, Matt Herman @buddyherms

🔗 https://t.co/8ybVhBxK33
#rstats #datascience https://t.co/1XroYBOR38",66,12
"x1203623631856779264","x1479239900964790272",2022-01-06 23:54:09,"icymi_r","📦🔎 {tesseract} • Bindings to Tesseract OCR engine for R

👤 Jeroen Ooms @opencpu

🔗 https://t.co/s1HE4ZCsBA
#rstats #datascience",10,5
"x1203623631856779264","x1479001844345147392",2022-01-06 08:08:12,"icymi_r","📦📊🚲 {strava} • Create artistic visualisations with your exercise data

👤 Marcus Volz

🔗 https://t.co/jB67De25B4
#rstats #datascience https://t.co/w8qrFDP65Q",44,7
"x1203623631856779264","x1478989260749426689",2022-01-06 07:18:12,"icymi_r","🗞️🗞️ Want to get a curated summary of each month's most popular data science posts and packages delivered straight to your inbox?  Check out the newsletter 👇

https://t.co/EXHioYMpq8
#rstats #python #datascience #machinelearning",21,7
"x1203623631856779264","x1478922810269569026",2022-01-06 02:54:09,"icymi_r","📺 R Blogdown Tutorial: Introduction - YouTube

👤 Jennifer Sloane &amp; Tehilla Ostrovsky

🔗 https://t.co/5rEdAiwh5q
#rstats #datascience",41,14
